ID,Sypnosis,Genres
7674,"As a child, Moritaka Mashiro dreamt of becoming a mangaka, just like his childhood hero and uncle, Tarou Kawaguchi, creator of a popular gag manga. But when tragedy strikes, he gives up on his dream and spends his middle school days studying, aiming to become a salaryman instead.

One day, his classmate Akito Takagi, the school's top student and aspiring writer, notices the detailed drawings in Moritaka's notebook. Seeing the vast potential of his artistic talent, Akito approaches Moritaka, proposing that they become mangaka together. After much convincing, Moritaka realizes that if he is able to create a popular manga series, he may be able to get the girl he has a crush on, Miho Azuki, to take part in the anime adaptation as a voice actor. Thus the pair begins creating manga under the pen name Muto Ashirogi, hoping to become the greatest mangaka in Japan, the likes of which no one has ever seen.

[Written by MAL Rewrite]","['Comedy', 'Drama', 'Romance', 'Otaku Culture', 'Shounen']"
1519,"Rokurou ""Rock"" Okajima has joined the Lagoon Company, a pirate mercenary group which operates out of Roanapur, Thailand. Despite his initial protests, this filthy slum of depraved souls and merciless criminals now serves as the former salaryman's home. Stranded, with nothing left of his past life but the clothes on his back and his inner morality, Rock is forced to perform jobs alongside the other members of the Lagoon crew. Berated for his lack of spine as he wades through the underbelly of society, he must decide whether to continue on amidst the gunfire and ruthlessness or risk everything he has in an attempt to be free. Whether he chooses the comfort of a familiar land or the freedom of being an outlaw, his decision will have lasting consequences on the crew who gave him a home.

[Written by MAL Rewrite]","['Action', 'Adult Cast', 'Organized Crime', 'Seinen']"
32867,"Despite their differences in position, three men—the youngest senior executive of the Port Mafia, Osamu Dazai; the lowest ranking member, Sakunosuke Oda; and the intelligence agent, Ango Sakaguchi—gather at the Lupin Bar at the end of the day to relax and take delight in the company of friends.

However, one night, Ango disappears. A photograph taken at the bar is all that is left of the three together.

Fast forward to the present, and Dazai is now a member of the Armed Detective Agency. The Guild, an American gifted organization, has entered the fray and is intent on taking the Agency's work permit. They must now divide their attention between the two groups, the Guild and the Port Mafia, who oppose their very existence.   

[Written by MAL Rewrite]","['Action', 'Mystery', 'Adult Cast', 'Detective', 'Organized Crime', 'Super Power', 'Seinen']"
232,"Ten-year-old Sakura Kinomoto is an ordinary fourth-grade student living in Tomoeda until, one day, she stumbles upon a mysterious book of cards titled ""The Clow."" Pondering over her discovery, she unintentionally causes a magical gust of wind to scatter the cards all over town.

The accident awakens the Beast of the Seal—Keroberos, nicknamed ""Kero""—who tells Sakura that she has released the mystical ""Clow Cards"" created by the sorcerer Clow Reed. Due to each Card's ability to act independently and their incredible power, Clow had sealed them away. Now that they have been set free, the Cards pose great danger to the world, and it is up to Sakura to put an end to them.

Appointing Sakura as the ""Cardcaptor"" and granting her the Sealed Key, Kero tasks her with finding and recapturing all the Clow Cards. Alongside her best friend Tomoyo Daidouji, and with Kero's guidance, Sakura must learn to balance her new secret duty with the everyday troubles as she takes flight on her magical adventures as Cardcaptor Sakura.

[Written by MAL Rewrite]
","['Adventure', 'Comedy', 'Drama', 'Romance', 'Mahou Shoujo', 'School', 'Shoujo']"
18,"Takumi Fujiwara finally joins Ryousuke and Keisuke Takahashi to create ""Project D."" Their goal is twofold: Ryousuke wants to develop his ""High-Speed Street Racing Theory,"" while Keisuke and Takumi aim at improving their driving skills by facing powerful opponents on dangerous roads. The idea of Project D is to challenge street racing teams from other prefectures to improve both their uphill and downhill records. In order to attract the attention of the best racing teams, Ryousuke creates a dedicated website to announce the future battles of Project D and post the team's results.

The fourth season of Initial D details the hardships and successes of the members of Project D as they try to become the best street racing team outside of Gunma Prefecture.

[Written by MAL Rewrite]","['Action', 'Drama', 'Racing', 'Seinen']"
47,"Japan, 1988. An explosion caused by a young boy with psychic powers tears through the city of Tokyo and ignites the fuse that leads to World War III. In order to prevent any further destruction, he is captured and taken into custody, never to be heard from again. Now, in the year 2019, a restored version of the city known as Neo-Tokyo—an area rife with gang violence and terrorism against the current government—stands in its place. Here, Shoutarou Kaneda leads ""the Capsules,"" a group of misfits known for riding large, custom motorcycles and being in constant conflict with their rivals ""the Clowns.""

During one of these battles, Shoutarou's best friend Tetsuo Shima is caught up in an accident with an esper who finds himself in the streets of Tokyo after escaping confinement from a government institution. Through this encounter, Tetsuo begins to develop his own mysterious abilities, as the government seeks to quarantine this latest psychic in a desperate attempt to prevent him from unleashing the destructive power that could once again bring the city to its knees.

[Written by MAL Rewrite]","['Action', 'Horror', 'Sci-Fi', 'Gore', 'Military', 'Super Power', 'Seinen']"
49052,"In a quiet rural town, the spotlight of a local junior high school football team rests on one player: Ashito Aoi. Known for his unpredictable moves and self-centered playing style, Ashito is the sole powerhouse pushing his team through an important high school preliminary tournament. However, their win streak is short-lived—an opponent causes Ashito to lose his temper and act violently, resulting in his removal from the rest of the game.

Without their star player, the team is quickly eliminated from the tournament. Just as he believes all hope is lost, Ashito is approached by a youth team coach named Tatsuya Fukuda who senses potential in him, and Fukuda invites him for tryouts in Tokyo. In an unfamiliar setting surrounded by talent, Ashito must bring out the best of his ability to prove himself and secure what could be a life-changing career.

[Written by MAL Rewrite]
","['Sports', 'Team Sports', 'Seinen']"
1889,"In the small village of Hinamizawa, Rika Furude and her friends live together in relative harmony. Beneath this mask of peace, however, lies a hidden darkness, one that Rika understands all too well. In this eternal summer, she has been witness to unspeakable horrors. Every time the clock resets, Rika must try to find the villain behind these senseless deaths before tragedy strikes again. However, trying to decipher a mystery when only half the clues are present proves time and again to be disastrous, and each time she believes that things will change, she inevitably fails. As the annual festival approaches, Rika begins her descent from hope to despair in her struggle to break the chains of fate entangling them all.

[Written by MAL Rewrite]","['Horror', 'Mystery', 'Suspense', 'Gore', 'Psychological']"
49909,"One day, manga author Shin Karino is greeted by four-year-old Kotarou Satou, his new next-door neighbor, who gifts him a box of tissues. In Karino's eyes, Kotarou is an odd kid: he speaks in an extremely formal manner, and he lives alone in his apartment—no parents or relatives in sight. But Kotarou neither seems to mind, nor wants to rely on people.

Feeling sympathetic toward Kotarou's circumstances, Karino decides to follow Kotarou to a bathhouse in case something might happen to him and there he comes to understand the little boy is not so different from him. Little by little, Karino—along with the other residents of the apartment complex—grows fond of Kotarou and his antics. At the same time, Kotarou himself might have found something akin to a family in his unique neighbors.

[Written by MAL Rewrite]","['Slice of Life', 'Childcare', 'Seinen']"
853,"Haruhi Fujioka is a studious girl who has recently enrolled at the prestigious Ouran Academy. One day, while looking for a quiet and peaceful place to study, she stumbles across a seemingly unused music room. Upon entering, Haruhi is welcomed by the members of the well-known Host Club: a club in which attractive boys amuse girls from across the entire school. However, when Tamaki Suou—the founder and president of the club—startles the bright scholarship student, she accidentally breaks an expensive vase.

With repayment looking difficult for Haruhi, the Host Club members come up with the perfect solution to the girl's problem: work for the club and ultimately become a Host herself! Mistaken for a boy by her peers, Haruhi has to entertain various female students while coping with her fellow Hosts' extravagant personalities.

[Written by MAL Rewrite]
","['Comedy', 'Romance', 'Crossdressing', 'Reverse Harem', 'School', 'Shoujo']"
1430,"Arsene Lupin III discovers that the spoils from his latest casino robbery are actually ""Gothic Bills,"" legendary counterfeits that are nigh impossible to distinguish from genuine bills. Together with colleague Daisuke Jigen, he heads to the small nation of Cagliostro to investigate the origin of these counterfeits. Upon arrival, they save a girl from a high-speed chase who turns out to be Clarisse d' Cagliostro, the daughter of the late Duke d' Cagliostro. She is running from a sinister plot by Count Cagliostro to steal her family's treasure through a forced marriage.

Natural flirt Lupin dislikes seeing a girl in distress and seeks to remedy the situation. Goemon Ishikawa XIII, Fujiko Mine, and Kouichi Zenigata also join the fray, each with their own motivations. As everyone converges at Cagliostro Castle, Lupin reminisces about his visit there 10 years ago, and the castle's secrets emerge from the depths.

[Written by MAL Rewrite]
","['Action', 'Adventure', 'Award Winning', 'Comedy', 'Mystery', 'Adult Cast', 'Seinen']"
50709,"The number of terrorist acts in Japan has never been lower, thanks to the efforts of a syndicate called Direct Attack (DA). The organization raises orphaned girls as killers to carry out assassinations under their ""Lycoris"" program. Takina Inoue is an exceptional Lycoris with a strong sense of purpose and a penchant for perfection. Unfortunately, a hostage situation tests her patience, and the resulting act of insubordination leads to her transfer out of DA. Not thrilled about losing the only place she belonged to, she reluctantly arrives at her new base of operations—LycoReco, a cafe in disguise.

Takina's new partner, however, turns out to be quite different from what she imagined. Despite being the famed Lycoris prodigy, Chisato Nishikigi appears almost unconcerned with her duties. She drags Takina along on all kinds of odd jobs under the simple explanation of helping people in need. Takina is even more puzzled when Chisato takes down a group of armed assailants without killing any of them. Feeling like a fish out of water, Takina itches to get reinstated into DA—but Chisato is determined to prove to her that there is more to a life than just taking them.

[Written by MAL Rewrite]
",['Action']
48549,"With the ambitious Ryuusui Nanami on board, Senkuu Ishigami and his team are almost ready to sail the seas and reach the other side of the world—where the bizarre green light that petrified humanity originated. Thanks to the revival of a skillful chef, enough food is being prepared for the entire crew, and the incredible reinvention of the GPS promises to ensure safety on the open sea.

Preparations for the upcoming journey progress swimmingly until Senkuu receives an eerie message from a mysterious source. More driven than ever, the scientist sets out to explore the new world and discover what it can offer for his scientific cause. Though the uncharted territories may hide unkind surprises, Senkuu, with a little help from science, is ready to take on any challenge.

[Written by MAL Rewrite]","['Adventure', 'Comedy', 'Sci-Fi', 'Shounen']"
40852,"Senkuu has made it his goal to bring back two million years of human achievement and revive the entirety of those turned to statues. However, one man stands in his way: Tsukasa Shishiou, who believes that only the fittest of those petrified should be revived.

As the snow melts and spring approaches, Senkuu and his allies in Ishigami Village finish the preparations for their attack on the Tsukasa Empire. With a reinvented cell phone model now at their disposal, the Kingdom of Science is ready to launch its newest scheme to recruit the sizable numbers of Tsukasa's army to their side. However, it is a race against time; for every day the Kingdom of Science spends perfecting their inventions, the empire rapidly grows in number.

Reuniting with old friends and gaining new allies, Senkuu and the Kingdom of Science must stop Tsukasa's forces in order to fulfill their goal of restoring humanity and all its creations. With the two sides each in pursuit of their ideal world, the Stone Wars have now begun!

[Written by MAL Rewrite]","['Adventure', 'Comedy', 'Sci-Fi', 'Shounen']"
25537,"The Holy Grail War: a violent battle between mages in which seven masters and their summoned servants fight for the Holy Grail, a magical artifact that can grant the victor any wish. Nearly 10 years ago, the final battle of the Fourth Holy Grail War wreaked havoc on Fuyuki City and took over 500 lives, leaving the city devastated. 

Shirou Emiya, a survivor of this tragedy, aspires to become a hero of justice like his rescuer and adoptive father, Kiritsugu Emiya. Despite only being a student, Shirou is thrown into the Fifth Holy Grail War when he accidentally sees a battle between servants at school and summons his own servant, Saber. 

When a mysterious shadow begins a murderous spree in Fuyuki City, Shirou aligns himself with Rin Toosaka, a fellow participant in the Holy Grail War, in order to stop the deaths of countless people. However, Shirou's feelings for his close friend Sakura Matou lead him deeper into the dark secrets surrounding the war and the feuding families involved.

[Written by MAL Rewrite]","['Action', 'Fantasy', 'Urban Fantasy']"
54856,"As the graduation ceremony at Katagiri High School comes to an end, Kyouko Hori, her boyfriend Izumi Miyamura, and their friends begin to look back on their time as students. The moments they shared together may be fleeting, but each one is a colorful piece of their precious memories.

[Written by MAL Rewrite]","['Romance', 'School', 'Shounen']"
48736,"High school student Wakana Gojou spends his days perfecting the art of making hina dolls, hoping to eventually reach his grandfather's level of expertise. While his fellow teenagers busy themselves with pop culture, Gojou finds bliss in sewing clothes for his dolls. Nonetheless, he goes to great lengths to keep his unique hobby a secret, as he believes that he would be ridiculed were it revealed. 

Enter Marin Kitagawa, an extraordinarily pretty girl whose confidence and poise are in stark contrast to Gojou's meekness. It would defy common sense for the friendless Gojou to mix with the likes of Kitagawa, who is always surrounded by her peers. However, the unimaginable happens when Kitagawa discovers Gojou's prowess with a sewing machine and brightly confesses to him about her own hobby: cosplay. Because her sewing skills are pitiable, she decides to enlist his help.

As Gojou and Kitagawa work together on one cosplay outfit after another, they cannot help but grow close—even though their lives are worlds apart.

[Written by MAL Rewrite]
","['Romance', 'Otaku Culture', 'School', 'Seinen']"
38481,"The Daihasei Festival has begun, and that of course means that Tokiwadai Middle School—a prestigious all-girls' middle school—is competing too. Despite the participation of the ""Ace of Tokiwadai,"" Mikoto Misaka, the other students who are participating are still putting their utmost effort into winning, no matter how impossible the feat may seem against her overwhelming might.

However, not all is fun and games. Due to the festival, Academy City opens to the outside world, and various factions have begun plotting ways to infiltrate the city. Misaka appears to be on their radar, and as the festival proceeds, people lurking from the shadows begin to emerge...

Toaru Kagaku no Railgun T brings back the Tokiwadai Ace and her friends as they dive deeper into the dark side of Academy City. From terrorist attacks to ruthless underground projects, anything is possible in this city.

[Written by MAL Rewrite]","['Action', 'Fantasy', 'Sci-Fi', 'Super Power', 'Urban Fantasy']"
37430,"Thirty-seven-year-old Satoru Mikami is a typical corporate worker, who is perfectly content with his monotonous lifestyle in Tokyo, other than failing to nail down a girlfriend even once throughout his life. In the midst of a casual encounter with his colleague, he falls victim to a random assailant on the streets and is stabbed. However, while succumbing to his injuries, a peculiar voice echoes in his mind, and recites a bunch of commands which the dying man cannot make sense of.

When Satoru regains consciousness, he discovers that he has reincarnated as a goop of slime in an unfamiliar realm. In doing so, he acquires newfound skills—notably, the power to devour anything and mimic its appearance and abilities. He then stumbles upon the sealed Catastrophe-level monster ""Storm Dragon"" Veldora who had been sealed away for the past 300 years for devastating a town to ashes. Sympathetic to his predicament, Satoru befriends him, promising to assist in destroying the seal. In return, Veldora bestows upon him the name Rimuru Tempest to grant him divine protection. 

Now, liberated from the mundanities of his past life, Rimuru embarks on a fresh journey with a distinct goal in mind. As he grows accustomed to his new physique, his gooey antics ripple throughout the world, gradually altering his fate.

[Written by MAL Rewrite]","['Action', 'Comedy', 'Fantasy', 'Isekai', 'Reincarnation', 'Shounen']"
59160,Second season of Wind Breaker.,"['Action', 'Delinquents', 'School']"
3701,"In a world where memories exist in memory chips separate from the body, death of the body no longer means death of the soul. It is possible for memories to be viewed, altered, and transferred between bodies. These memory chips are used by the rich to obtain eternal lives in carefully selected bodies, while for the poor, selling their own bodies and conserving their souls in the chips often become the only way to earn a living. An electrolytic cloud in the sky serves as a barrier between the heavens of the fortunate and the underworld of the destitute, making this social division impregnable. 

One day, a man named Kaiba wakes up in an empty room with no memories, a mysterious hole in his chest, and a locket holding the picture of an unknown woman. After escaping an attack and stumbling upon a decrepit village of underworld residents, he begins his adventure across the different planets of this strange universe to find out more about his own identity and the woman he once knew.

Through a journey of self-discovery and acceptance, Kaiba weaves together tales of souls and spirits and explores the importance of memories.

[Written by MAL Rewrite]","['Adventure', 'Avant Garde', 'Award Winning', 'Mystery', 'Romance', 'Sci-Fi', 'Psychological']"
28675,"After Akihito Kanbara reunites with Mirai Kuriyama—whom he believed had vanished after defeating Beyond the Boundary—he discovers a heartbreaking fact: Mirai has lost all memory of him, their friends, and her past as a Spirit Warrior. Akihito is utterly devastated, but realizes that she has a unique opportunity. Mirai can finally live the life of a normal girl—where she'll be completely devoid of the supernatural society that both shunned and used her. While it's all for the sake of Mirai's happiness, the price is costly—Akihito and his friends must keep her true origins a secret from her, and as a result avoid befriending her. 

However, the troubling memories of Mirai's old life gradually begin to resurface, and a mysterious new evil leads a group of shadow-like creatures into the city with the goal of seeking her out. As the situations become dire, Akihito must fight to protect himself, his closest friends, and Mirai—the bespectacled beauty he holds most dear. 

[Written by MAL Rewrite]
","['Action', 'Romance', 'Supernatural', 'School']"
30503,"Yato and Yukine have finally mended their relationship as god and Regalia. As a minor and unknown deity, Yato continues to take odd jobs for five yen apiece in hopes of one day having millions of worshippers and his own grand shrine. He has yet to fix Hiyori Iki's loose soul, but she cheerily prepares for high school nonetheless.

While things are seemingly back to normal, the complicated history between Yato and Bishamon—goddess of war and warriors—resurfaces. Bishamon holds a mysterious old grudge against Yato, which results in violent clashes between them. To further complicate matters, Bishamon's most trusted Regalia, Kazuma, is indebted to Yato. When lives are on the line, unraveling these secrets is possibly the only way to correct mistakes of the past.

[Written by MAL Rewrite]
","['Action', 'Supernatural', 'Mythology', 'Shounen']"
721,"In a fairy tale come to life, the clumsy, sweet, and gentle Ahiru seems like an unlikely protagonist. In reality, Ahiru is just as magical as the talking cats and crocodiles that inhabit her town—for Ahiru really is a duck! Transformed by the mysterious Drosselmeyer into a human girl, Ahiru soon learns the reason for her existence. Using her magical egg-shaped pendant, Ahiru can transform into Princess Tutu—a beautiful and talented ballet dancer whose dances relieve people of the turmoil in their hearts. With her newfound ability, Ahiru accepts the challenge of collecting the lost shards of her prince's heart, for long ago he had shattered it in order to seal an evil raven away for all eternity.

Princess Tutu is a tale of heroes and their struggle against fate. Their beliefs, their feelings, and ultimately their actions will determine whether this fairy tale can reach its ""happily ever after.""

[Written by MAL Rewrite]","['Drama', 'Mystery', 'Romance', 'Anthropomorphic', 'Love Polygon', 'Mahou Shoujo', 'Performing Arts']"
34572,"Asta and Yuno were abandoned at the same church on the same day. Raised together as children, they came to know of the ""Wizard King""—a title given to the strongest mage in the kingdom—and promised that they would compete against each other for the position of the next Wizard King. However, as they grew up, the stark difference between them became evident. While Yuno is able to wield magic with amazing power and control, Asta cannot use magic at all and desperately tries to awaken his powers by training physically.

When they reach the age of 15, Yuno is bestowed a spectacular Grimoire with a four-leaf clover, while Asta receives nothing. However, soon after, Yuno is attacked by a person named Lebuty, whose main purpose is to obtain Yuno's Grimoire. Asta tries to fight Lebuty, but he is outmatched. Though without hope and on the brink of defeat, he finds the strength to continue when he hears Yuno's voice. Unleashing his inner emotions in a rage, Asta receives a five-leaf clover Grimoire, a ""Black Clover"" giving him enough power to defeat Lebuty. A few days later, the two friends head out into the world, both seeking the same goal—to become the Wizard King!

[Written by MAL Rewrite]","['Action', 'Fantasy', 'Shounen']"
28223,"After death, either Heaven or Hell awaits most humans. But for a select few, death brings them to Quindecim—a bar where only pairs of people who die at the same time can enter. Attending the bar is an enigmatic figure known as Decim, who also acts as the arbiter. He passes judgment on those who wind up at Quindecim by challenging them to a life-threatening game. These games determine if the patron's soul will reincarnate into a new life, or be sent into the void, never to be seen again.

From darts and bowling to fighting games, the true nature of each patron slowly comes to light as they wager their souls. Though his methods remain unchanged, the sudden appearance of a black-haired amnesiac causes Decim to reevaluate his own rulings.

[Written by MAL Rewrite]","['Drama', 'Fantasy', 'Suspense', 'Adult Cast', 'High Stakes Game', 'Psychological']"
