ID,Sypnosis,Genres
6811,"Thwarted again by Naraku, Inuyasha, Kagome Higurashi, and their friends must continue their hunt for the few remaining Shikon Jewel shards, lest they fully form into a corrupted jewel at the hands of Naraku. But Naraku has plans of his own to acquire them, and will destroy anyone and anything standing in his way—even his own underlings.

The persistent, unyielding danger posed by Naraku forces Sango and Miroku to decide what is most important to them—each other or their duty in battle. Meanwhile, Inuyasha must decide whether his heart lies with Kikyou or Kagome, before fate decides for him. Amid the race to find the shards, Inuyasha and his brother Sesshoumaru must also resolve their feud and cooperate for their final confrontation with Naraku, as it is a battle they must win in order to put a stop to his evil and cruelty once and for all.

[Written by MAL Rewrite]","['Action', 'Adventure', 'Fantasy', 'Romance', 'Historical', 'Love Polygon', 'Mythology', 'Time Travel', 'Shounen']"
37171,"During recess, Olivia, a foreign transfer student who doesn't know English, plays a game of ""look-the-other-way"" with Hanako Honda, a loud-mouthed airhead. Their rowdy behavior spurs the ire of Kasumi Nomura, a deadpan loner constantly teased by her older sister for her tendency to lose games. Not willing to compete, Kasumi declines Olivia's offer to join the fun, but eventually gets involved anyway and dispenses her own brand of mischief. Soon, a strange friendship blossoms between the peculiar trio, and they decide to form the ""Pastime Club,"" where they are free to resume their daily hijinks. 

Whether it be failing to learn English, trying desperately to become popular, or getting caught by teachers at the wrong time, school life will never be boring when the girls of Asobi Asobase are up to their hilarious antics.

[Written by MAL Rewrite]","['Comedy', 'Gag Humor', 'School', 'Seinen']"
49596,"Yoichi Isagi was mere moments away from scoring a goal that would have sent his high school soccer team to the nationals, but a split-second decision to pass the ball to his teammate cost him that reality. Bitter, confused, and disappointed, Isagi wonders if the outcome would have been different had he not made the pass. When the young striker returns home, an invitation from the Japan Football Union awaits him. Through an arbitrary and biased decision-making process, Isagi is one of three hundred U-18 strikers selected for a controversial project named Blue Lock. 

The project's ultimate goal is to turn one of the selected players into the star striker for the Japanese national team. To find the best participant, each diamond in the rough must compete against others through a series of solo and team competitions to rise to the top. Putting aside his ethical objections to the project, Isagi feels compelled to fight his way to the top, even if it means ruthlessly crushing the dreams of 299 aspiring young strikers.

[Written by MAL Rewrite]","['Sports', 'Team Sports', 'Shounen']"
36946,"Forty-one years ago on Planet Vegeta, home of the infamous Saiyan warrior race, King Vegeta noticed a baby named Broly whose latent power exceeded that of his own son. Believing that Broly's power would one day surpass that of his child, Vegeta, the king sends Broly to the desolate planet Vampa. Broly's father Paragus follows after him, intent on rescuing his son. However, his ship gets damaged, causing the two to spend years trapped on the barren world, unaware of the salvation that would one day come from an unlikely ally.

Years later on Earth, Gokuu Son and Prince Vegeta—believed to be the last survivors of the Saiyan race—are busy training on a remote island. But their sparring is interrupted when the appearance of their old enemy Frieza drives them to search for the last of the wish-granting Dragon Balls on a frozen continent. Once there, Frieza shows off his new allies: Paragus and the now extremely powerful Broly. A legendary battle that shakes the foundation of the world ensues as Gokuu and Vegeta face off against Broly, a warrior without equal whose rage is just waiting to be unleashed.

[Written by MAL Rewrite]","['Action', 'Adventure', 'Fantasy', 'Martial Arts', 'Shounen']"
813,"Five years after winning the World Martial Arts tournament, Gokuu is now living a peaceful life with his wife and son. This changes, however, with the arrival of a mysterious enemy named Raditz who presents himself as Gokuu's long-lost brother. He reveals that Gokuu is a descendant of the once powerful but now virtually extinct Saiyan race, whose homeworld was annihilated. When he was sent to Earth as a baby, Gokuu's sole purpose was to conquer and destroy the planet; but after suffering amnesia from a head injury, his violent and savage nature changed, and instead was raised as a kind and well-mannered boy, now fighting to protect others.

With his failed attempt at forcibly recruiting Gokuu as an ally, Raditz warns Gokuu's friends of a new threat that's rapidly approaching Earth—one that could plunge Earth into an intergalactic conflict and cause the heavens themselves to shake. A war will soon be fought over the seven mystical Dragon Balls, magic objects that can grant any wish. Only the strongest will survive.

[Written by MAL Rewrite]","['Action', 'Adventure', 'Comedy', 'Fantasy', 'Martial Arts', 'Shounen']"
35110,"Following the events of the Inter-High, the Karasuno High School volleyball team decides to regroup by attending an intensive boot camp organized by Nekoma High School in Tokyo. At the camp, the team continues to suffer loss upon loss to the other schools in attendance. Reaching an impasse, the players each struggle to break out of their routine to hone their skills. 

For the team's setter-and-ace duo Shouyou Hinata and Tobio Kageyama, the frustrations cause them to falter more than anyone else. While Hinata develops his own playstyle, his recklessness leads him to fall out of sync with Kageyama's sets and earns his partner's ire instead. As they search for an answer to their woes, the two find what they are lacking from two unlikely people. Will it be enough for the team to overcome their rut?

[Written by MAL Rewrite]
","['Sports', 'School', 'Team Sports', 'Shounen']"
42897,"On the surface, the thought of Kyouko Hori and Izumi Miyamura getting along would be the last thing in people's minds. After all, Hori has a perfect combination of beauty and brains, while Miyamura appears meek and distant to his fellow classmates. However, a fateful meeting between the two lays both of their hidden selves bare. Even though she is popular at school, Hori has little time to socialize with her friends due to housework. On the other hand, Miyamura lives under the noses of his peers, his body bearing secret tattoos and piercings that make him look like a gentle delinquent.

Having opposite personalities yet sharing odd similarities, the two quickly become friends and often spend time together in Hori's home. As they both emerge from their shells, they share with each other a side of themselves concealed from the outside world.

[Written by MAL Rewrite]","['Romance', 'School', 'Shounen']"
51019,"For centuries, the Demon Slayer Corps has sacredly kept the location of Swordsmith Village a secret. As the village of the greatest forgers, it provides Demon Slayers with the finest weapons, which allow them to fight night-crawling fiends and ensure the safety of humans. After his sword was chipped and deemed useless, Tanjirou Kamado, along with his precious little sister Nezuko, is escorted to the village to receive a new one.

Meanwhile, the death of an Upper Rank Demon disturbs the idle order in the demon world. As Tanjirou becomes acquainted with Mist Hashira Muichirou Tokitou and Love Hashira Mitsuri Kanroji, ferocious powers creep from the shadows and threaten to shatter the Demon Slayers' greatest line of defense.

[Written by MAL Rewrite]","['Action', 'Supernatural', 'Historical', 'Shounen']"
38234,"Monkey D. Luffy and the Straw Hats arrive aboard the Sunny to the Pirates Festival, the world's largest celebration created by and for pirates. Buena Festa, the festival organizer, invites the Straw Hats and all Worst Generation crews to partake in the festivities. Luring even Shichibukai and Marines to its shores, it seems that no pirate or sailor can resist the enticing secrets that the event hides behind its glamor.

The festival's contest is simple: find one of the treasures Gol D. Roger left behind. As the competition progresses, the various pirate crews fight each other in a free-for-all battle royale—that is, until the sudden appearance of an unexpected pirate drastically changes the game.

[Written by MAL Rewrite]
","['Action', 'Adventure', 'Fantasy', 'Shounen']"
49114,"Vanitas and Noé Archiviste head out to the town of Gévaudan in search of the ""Beast,"" an enormous wolf-like creature that has slaughtered hundreds of people. Suspecting that the Beast is a curse-bearing vampire, Vanitas primarily aims to heal it using the powers of his grimoire.

Along the way, the two get separated and suddenly travel back to the past—to the exact moment the Beast is lurking in the woods. After a battle against the gigantic wolf and a vampire hunter, Vanitas decides to team up with Jeanne in order to find Noé. Despite being allies, Jeanne's goal is the opposite of Vanitas', as she was tasked to kill the Beast—suspecting it may be someone she used to know.

Meanwhile, a severely wounded Noé is picked up by the mysterious Chloé d'Apchier and her servant. Like Noé, Chloé is a vampire whose existence was erased from the public's knowledge. She has been a guardian for future generations and once tried to find a way to become human again. While Noé is grateful to Chloé for her hospitality, little does he know that she might be siding with forces far more dangerous than the Beast itself.

[Written by MAL Rewrite]
","['Action', 'Fantasy', 'Mystery', 'Historical', 'Urban Fantasy', 'Vampire', 'Shounen']"
34537,"On a mysterious night that seems to last for a year, an ordinary college student continues to chase one of his underclassmen, a girl with black hair—the girl of his dreams. Up until now, he has been relying on a simple plan, which is to calculatingly bump into her every day while making it seem like a meaningful coincidence. However, his efforts remain futile as their relationship is not progressing at all.

Meanwhile, the black-haired girl believes that everything is connected by fate and endeavors to experience as many new things as possible, leaving it all for destiny to decide. While strolling along the lively streets of Kyoto, she discovers that the very beginning of her fateful journey—a book she had as a child—is currently being sold in a second-hand bookstore. Upon knowing this, the college student eyes another opportunity to run into her ""by chance"": this time, he hopes to get the book before she does and finally grasp the thread of fate that could connect their hearts.

[Written by MAL Rewrite]","['Comedy', 'Romance', 'Adult Cast']"
34636,"Tatara Fujita is a shy middle schooler who has no particular plan for the future. He has gotten through life by avoiding any kind of confrontation and blending in with the crowd. But blending in isn't enough to get out of trouble, as some bullies harass him for money. Luckily, he is saved by a man named Kaname Sengoku.

Kaname invites Tatara to his dance studio. Although he would normally never set foot in such a place, Tatara is captivated by Sengoku's commanding presence. Granted an opportunity to dance with fellow classmate Shizuku Hanaoka—who often practices at the studio—Tatara realizes there's something about the idea of being put in the limelight and dancing where people will see him that keeps him coming back. With an earnest, passionate drive to improve, Tatara begins his journey into the world of competitive dance.

[Written by MAL Rewrite]","['Sports', 'Performing Arts', 'Shounen']"
10800,"As a child, Chihaya Ayase had only one dream: to see her elder sister Chitose become Japan's most successful model. However, upon defending her ostracised classmate Arata Wataya from his bully—Chihaya's childhood friend Taichi Mashima—she discovers the world of competitive karuta and soon becomes enamoured with the sport.

Based on the Ogura Hundred Poets anthology, this card game where poems are studied requires excellent memory, agility, and a tremendous endurance from the players. Full of hope, Chihaya joins the Shiranami Society together with the newly reconciled Arata and Taichi, embarking on an exciting journey for the title awarded to the top-ranked female player—Queen of Karuta.

Since middle school, Chihaya grew distant from a dispassionate Taichi and separated from Arata. However, in order to improve her skills, Chihaya decides to create a karuta club in her high school. With the help of Taichi, another veteran player, and a few spirited newcomers, Chihaya's new-founded Mizusawa Karuta Club aims for victory in the Omi Shrine's national championship.

[Written by MAL Rewrite]
","['Drama', 'Sports', 'Love Polygon', 'School', 'Strategy Game', 'Josei']"
22297,"The Holy Grail War is a battle royale among seven magi who serve as Masters. Masters, through the use of the command seals they are given when they enter the war, command Heroic Spirits known as Servants to fight for them in battle. In the Fifth Holy Grail War, Rin Toosaka is among the magi entering the competition. With her Servant, Archer, she hopes to obtain the ultimate prize—the Holy Grail, a magical artifact capable of granting its wielder any wish.

One of Rin's classmates, Shirou Emiya, accidentally enters the competition and ends up commanding a Servant of his own known as Saber. As they find themselves facing mutual enemies, Rin and Shirou decide to form a temporary alliance as they challenge their opponents in the Holy Grail War. 

[Written by MAL Rewrite]","['Action', 'Fantasy', 'Urban Fantasy']"
18617,"Having won the 63rd National Sensha-dou tournament, the girls from Ooarai Girls Academy managed to prevent their school from closure by the Japanese Ministry of Education. However, new troubles loom on the horizon: a ministry official argues that the deal was not legally binding and that the Ooarai school carrier is to be decommissioned. Students and their families are frustrated with this injustice and overwhelmed with despair; it seems little can be done to save the school.

Their last glimmer of hope is a proposed match against the All-Stars University Sensha-dou team, consisting of the most talented students from all over the country. Despite Ooarai being severely outnumbered and clearly outclassed, they accept the challenge.

[Written by MAL Rewrite]","['Action', 'Award Winning', 'CGDCT', 'Military', 'School']"
1142,"Back from his journey across Japan, Yuuta Takemoto reminisces about his college life so far. He has matured significantly since his second year and is motivated to move forward.

Feeling more confident than ever before, he finally confesses to Hagumi Hanamoto, the girl he has been in love with since their first encounter. However, Hagumi has been confused by her attempts to understand the mysterious Shinobu Morita. Hiding behind a playful demeanor, Morita may be the most burdened by his own potential. Meanwhile, Takumi Mayama has become a full-fledged working adult and has landed Ayumi Yamada several pottery orders through his company in an act of friendship.

The five youths continue to face individual hardships in academics, work, love, and friendship as they push each other toward the paths that they are destined to walk.

[Written by MAL Rewrite]","['Drama', 'Romance', 'Adult Cast', 'Love Polygon', 'Visual Arts', 'Josei']"
138,"After the battle with the Spiders, the search for Ging continues as Gon and Killua decided to once again attempt to purchase the rare game ""Greed Island."" However, Gon came up with a better plan, which was to volunteer to complete the game for the billionaire who owned it. But some training must be done, as Gon and Killua's abilities are still at a developing stage and ""Greed Island"" is no simple game for anyone to play with. It is the infamous game that could easily lead to one's death. Based on the manga by Togashi Yoshihiro.","['Action', 'Adventure', 'Fantasy', 'Shounen']"
186,"Accumulating an impressive series of victories with his AE86, Takumi Fujiwara has imposed himself as street racing's newest rising star. However, his newly found confidence of winning at his home turf of Mount Akina has been put in jeopardy by a new Emperor team exclusively using a car model favored by most professional racing pilots: the Mitsubishi four-wheel drive Lancer Evolutions—also known as Lan Evos. The Emperor team leader, Kyouichi Sudou, looks down on Takumi and regards him as an inferior pilot for driving an antique car that lacks the makings of a true modern race car. Kyouichi's elitist philosophy is also the reason why his team is only made of Lan Evo drivers.

Will Takumi be able to keep his perfect track record intact against the highly skilled and mechanically superior Emperor team, or does his hot streak end here?

[Written by MAL Rewrite]","['Action', 'Drama', 'Racing', 'Seinen']"
7791,"It is the new year, which means that the senior members of the Light Music Club are now third-years, with Azusa Nakano being the only second-year. The seniors soon realize that Azusa will be the only member left once they graduate and decide to recruit new members. Despite trying many methods of attracting underclassmen—handing out fliers, bringing people into the clubroom, and performing at the welcoming ceremony—there are no signs of anyone that plans to join.

While heading to the clubroom, Azusa overhears Yui Hirasawa say that the club is fine with only five people and that they can do many fun things together. Changing her mind, she decides that they do not need to recruit any members for the time being. 

K-On!! revolves around the members of the Light Music Club as they experience their daily high school life. From rehearsing for concerts to just messing around, they are ready to make their last year together an exciting one!

[Written by MAL Rewrite]","['Award Winning', 'Comedy', 'CGDCT', 'Music', 'School']"
37514,"The movie is a compilation of episodes 1-8 of the 2017 television series with new scenes added for the introduction. It covers the period from when Riko descends into the Abyss with her robot companion Reg, reaching the second layer where they meet the White Whistle Ozen who reveals information about Riko's mother.

(Source: Wikipedia)","['Adventure', 'Drama', 'Fantasy', 'Mystery', 'Sci-Fi', 'Gore']"
40729,"Megalo Box is an advanced form of boxing where competitors wear metal frames called Gear. When the first ever Megalonia tournament took place, ""Gearless"" Joe became its champion and known to all as a legendary fighter. However, soon after, he lost an exhibition match against the second champion and vanished from the public eye.

Seven years later, Joe now goes by ""Nomad"" and keeps a low profile, occasionally fighting in a few underground matches to get by. He is haunted by hallucinations and relies on a set of painkillers to numb his mind.

During a match, Joe wins against an opponent, Chief, who purposefully loses for some extra cash from gamblers. Subsequently, Joe discovers that Chief is from a community of immigrants called the Casa. Chief is gradually trying to make enough money to purchase the land where they live illegally. At first, Joe hesitates to get involved, but eventually decides to lend the Casa a helping hand.

[Written by MAL Rewrite]","['Sci-Fi', 'Sports', 'Adult Cast', 'Combat Sports']"
23623,"Far from the hustle and bustle of urban life, and with only a single candy store and bus route to its name, the rural Asahigaoka is certainly not a place for everyone. Nevertheless, the village's children still manage to cheerfully spend their days exploring and having fun in the wilderness around them. One such child, Renge Miyauchi, the youngest of the group, looks forward to the entrance ceremony of the upcoming school year, signalling her entry into first grade and the beginning of her elementary school life. Attending the only school in town, Renge and her friends, seventh grader Natsumi Koshigaya and her eighth grade sister Komari, make the most out of their rural lifestyle, playing and studying everyday.

Meanwhile, fifth grader Hotaru Ichijou has just moved to Asahigaoka from Tokyo, unaware of the numerous adventures and memories that await her. 

[Written by MAL Rewrite]","['Slice of Life', 'CGDCT', 'Iyashikei', 'School', 'Seinen']"
18195,"Following the Little Busters after they lost their first baseball game, the team decides to have a pancake party. It has been almost one semester since the return of Kyousuke Natsume. As usual, Riki Naoe continues to help the Little Busters' members—both old and new—with confronting their inner struggles. However, strange happenings begin to occur, leading Rin Natsume and Riki closer to unraveling the truth behind the ""secret of this world.""

Little do Rin and Rikki know, their discovery will end up changing the peaceful everyday lives created by the Little Busters once and for all. Little Busters!: Refrain brings a conclusion to the colorful stories of its ensemble cast—forged with the weight of emotions and strengthened with the bond of friendship—as they come to terms with their regrets and weaknesses.

[Written by MAL Rewrite]","['Comedy', 'Drama', 'Romance', 'School']"
235,"Shinichi Kudou, a high school student of astounding talent in detective work, is well known for having solved several challenging cases. One day, when Shinichi spots two suspicious men and decides to follow them, he inadvertently becomes witness to a disturbing illegal activity. Unfortunately, he is caught in the act, so the men dose him with an experimental drug formulated by their criminal organization, leaving him to his death. However, to his own astonishment, Shinichi lives to see another day, but now in the body of a seven-year-old child.

Perfectly preserving his original intelligence, he hides his real identity from everyone, including his childhood friend Ran Mouri and her father, private detective Kogorou Mouri. To this end, he takes on the alias of Conan Edogawa, inspired by the mystery writers Arthur Conan Doyle and Ranpo Edogawa.

Shinichi, as Conan, starts secretly solving the senior Mouri's cases from behind the scenes with his still exceptional sleuthing skills, while covertly investigating the organization responsible for his current state, hoping to reverse the drug's effects someday.

[Written by MAL Rewrite]","['Adventure', 'Comedy', 'Mystery', 'Detective', 'Shounen']"
33674,"In ancient Disboard, Riku is an angry, young warrior intent on saving humanity from the warring Exceed, the 16 sentient species, fighting to establish the One True God among the Old Deus. In a lawless land, humanity's lack of magic and weak bodies have made them easy targets for the other Exceed, leaving the humans on the brink of extinction. 

One day, however, hope returns to humanity when Riku finds a powerful female Ex-Machina, whom he names Schwi, in an abandoned elf city. Exiled from her Cluster because of her research into human emotions, Schwi is convinced that humanity has only survived due to the power of these feelings and is determined to understand the human heart. Forming an unlikely partnership in the midst of the overwhelming chaos, Riku and Schwi must now find the answers to their individual shortcomings in each other, and discover for themselves what it truly means to be human as they fight for their lives together against all odds. Each with a powerful new ally in tow, it is now up to them to prevent the extinction of the human race and establish peace throughout Disboard.

[Written by MAL Rewrite]","['Drama', 'Fantasy', 'Romance', 'Isekai']"
4107,"Animation studio Gainax presented a website for the release of a movie adaptation of the Tengen Toppa Gurren Lagann TV series in the fall of 2008. Both the original director and series script editor will return to work on the new project. Gainax will also be hosting four events to celebrate this occasion at this year's Tokyo International Anime Fair, featuring voice actors from the anime.","['Action', 'Sci-Fi', 'Mecha']"
40911,"During the late 19th century, Great Britain has become the greatest empire the world has ever known. Hidden within its success, the nation's rigid economic hierarchy dictates the value of one's life solely on status and wealth. To no surprise, the system favors the aristocracy at the top and renders it impossible for the working class to ascend the ranks.

William James Moriarty, the second son of the Moriarty household, lives as a regular noble while also being a consultant for the common folk to give them a hand and solve their problems. However, deep inside him lies a desire to destroy the current structure that dominates British society and those who benefit from it. 

Alongside his brothers Albert and Louis, William will do anything it takes to change the filthy world he lives in—even if blood must be spilled.

[Written by MAL Rewrite]","['Mystery', 'Suspense', 'Adult Cast', 'Historical', 'Organized Crime', 'Psychological', 'Shounen']"
