ID,Sypnosis,Genres
42395,"Tatsuya Yoigoshi, a once nationally recognized soccer player, is now a first-year student at Noukin High School. Due to his developed hatred for sports, he has abandoned his previous aspirations to become a famous livestreamer on the internet. One day, Souma Azemichi, a first-year on the kabaddi team, seeks to recruit Yoigoshi and spontaneously interrupts his livestream.

Without any expectations, Yoigoshi follows Souma to the school gym, where he witnesses second-years Kyouhei Misumi and Shinji Date engaged in the primal contact sport of kabaddi. Despite ridiculing the rules of play, Yoigoshi is stunned by the intensity of the round. Because of an enticing deal and slight coercion, he agrees to settle the prospect of his recruitment through the most invigorating way: a battle of kabbadi, a team sport played empty-handed.

[Written by MAL Rewrite]","['Comedy', 'Sports', 'School', 'Team Sports']"
79,"In present times, Gods and Demons coexist together with Humans after the door between each of these worlds had opened. Tsuchimi Rin is a normal young high school student attending Verbena Academy, spending his days living peacefully with his childhood friend Kaede. Unexpectedly, one day the King of Gods, the King of Demons and their families move into be Rin's next door neighbors. Apparently the daughter of the Gods, Sia, and the daughter of the demons, Nerine, are both deeply in love with Rin after having met him in the past. Along with his playful friendship with upperclassmen Asa and his encounter with the silent but cute Primula, Rin has much on his hands dealing with the affections of each of these girls. Based on the eroge by Navel.","['Comedy', 'Fantasy', 'Romance', 'Ecchi', 'Harem', 'School', 'Urban Fantasy']"
18277,"Kojou Akatsuki's days as an ordinary high school student in the Demon District of Itogami Island come to an abrupt end after a fateful encounter leaves him with the remarkable abilities of a vampire.

It isn't long before he is thrust into the center of attention when it is discovered that he is the fourth primogenitor, an immensely powerful vampire whom most consider to be merely a legend. Fearing Kojou's destructive potential, the Lion King Organization sends in an apprentice sword-shaman, Yukina Himeragi, to monitor, and should he become a threat, kill the boy deemed the world's most powerful vampire. Forced together by circumstance, the two form an unlikely alliance as Kojou comes to terms with his abilities and they both struggle to protect the city from various emerging chaotic forces.

[Written by MAL Rewrite]","['Action', 'Fantasy', 'Ecchi', 'Harem', 'School', 'Urban Fantasy', 'Vampire']"
36475,"Clad in desert pink and the size of a mere child, the infamous ""Pink Devil"" mercilessly hunts down other players in the firearm-centered world of the virtual reality game Gun Gale Online. But in real life, this feared player killer is not quite who anyone would expect.

A shy university student in Tokyo, Karen Kohiruimaki stands in stark contrast to her in-game avatar—in fact, she happens to stand above everyone else too, much to her dismay. Towering above all the people around her, Karen's insecurities over her height reach the point where she turns to the virtual world for an escape. Starting game after game in hopes of manifesting as a cute, short character, she finally obtains her ideal self in the world of Gun Gale Online. Overjoyed by her new persona, she pours her time into the game as LLENN, garnering her reputation as the legendary player killer.

However, when one of LLENN's targets gets the best of her, she ends up meeting Pitohui, a skilled yet eccentric woman. Quickly becoming friends with Karen, Pitohui insists that LLENN participates in Squad Jam, a battle royale that pits teams against one another, fighting until only one remains. Thrust into the heated competition, LLENN must fight with all her wit and will if she hopes to shoot her way to the top.

[Written by MAL Rewrite]","['Action', 'Military', 'Video Game']"
10321,"Haruka Nanami, an aspiring composer from the countryside, longs to write music for her beloved idol, Hayato Ichinose. Determined to accomplish this goal, she enrolls into Saotome Academy, a highly regarded vocational school for the performing arts.

Upon her arrival, Haruka soon learns that everyone on staff, including the headmaster, is either an idol, a composer, or a poet. To top it all off, she is surrounded by incredibly talented future idols and composers, and the competition among the students is fierce; with the possibility of recruitment by the Shining Agency upon graduation, the stakes are incredibly high. As she strives to reach her dream at the academy, one fateful night, a series of events lead Haruka to a mysterious man standing in the moonlight, and he seems a bit familiar...

[Written by MAL Rewrite]","['Comedy', 'Romance', 'Idols (Male)', 'Music', 'Reverse Harem', 'School', 'Josei']"
58426,"Torako Koshi is the epitome of perfection. With her peerless beauty, top-notch grades, and position as student council president, her popularity in school is unrivaled. However, she harbors a dark secret—she was a delinquent back in middle school—and this is something she conceals to the best of her abilities.

Unfortunately, when she meets the mysterious deer girl Noko Shikanoko, Torako's hidden shame is constantly on the precipice of being exposed due to Shikanoko's rather weird antics. To maintain the reputation she worked so hard for, Torako must go along with Shikanoko's whims, even going so far as to become president of the newly established Deer Club. All her efforts will be rewarded if she can prevent the menacing doe from accidentally blurting out damaging details about her personal history that will undoubtedly unleash Torako's greatest nightmare.

[Written by MAL Rewrite]","['Comedy', 'Gag Humor', 'School', 'Shounen']"
50175,"When Demon Queen Echidna begins her invasion of the human realm, the people turn to the hero Leo Demonheart to protect them. Blessed with insurmountable power, Leo easily repels Echidna's army, thereby saving the world. But instead of gratitude or admiration, Leo is met with disdain and scorn from his fellow humans, who fear his overwhelming strength and believe that it may eventually cause humanity's demise.

Banished from the kingdom he once called home, Leo wanders aimlessly throughout the land until, one day, he hears rumors of Echidna's efforts to rebuild her army. Hoping that demonkind might accept him as an ally, he returns to the demon queen's castle and offers Echidna his help.

Naturally, Echidna immediately rejects him. Still, not all hope is lost, as Leo manages to convince Echidna's four generals to let him secretly work under their supervision. Donning the identity of a masked dark knight named Onyx, Leo solves the demon army's problems one by one—gradually improving the quality of life around the castle. Above all else, however, Leo wants to accomplish one goal: to learn why Echidna started the war in the first place.

[Written by MAL Rewrite]
","['Action', 'Adventure', 'Comedy', 'Fantasy']"
10456,"In the far future, humans abandon a devastated Earth and traveled to outer space. However, due to unknown phenomenon that prevents them from traveling into space, humanity returns to Earth only to find it inhospitable except for Japan.

To accommodate the entire human population, pocket dimensions are created around Japan to house in the populace. In order to find a way to return to outer space, the humans began reenacting human history according to the Holy book Testament. But in the year 1413 of the Testament Era, the nations of the pocket dimensions invade and conquer Japan, dividing the territory into feudal fiefdoms and forcing the original inhabitants of Japan to leave.

It is now the year 1648 of the Testament Era, the refugees of Japan now live in the city ship Musashi, where it constantly travels around Japan while being watched by the Testament Union, the authority that runs the re-enactment of history. However, rumors of an apocalypse and war begin to spread when the Testament stops revealing what happens next after 1648.

Taking advantage of this situation, Toori Aoi, head of Musashi Ariadust Academy's Supreme Federation and President of the student council, leads his fellow classmates to use this opportunity to regain their homeland.

(Source: Wikipedia)","['Action', 'Fantasy', 'Sci-Fi']"
16890,"Seventeen-year-old William Twining takes pride in his lineage as well as his devotion to modern science. When he learns that his family has gone bankrupt, the pompous noble is faced with the reality that he can no longer afford his tuition or the lifestyle he is accustomed to. In a desperate search for valuables in his manor, William discovers a hidden room and accidentally summons the arrogant demon Dantalion, the Grand Duke of Hell.

Apparently, Lucifer—the ruler of Hell—has fallen into a deep slumber. In his absence, only the human ""Elector"" has power to select a temporary successor, which is the cause of tension among demonkind. Although told that he is the direct descendant of King Solomon and has unshakable authority in the underworld, William refuses to believe it. While denying the existence of magic and the supernatural altogether, the defiant realist fails to recognize that he is at the center of the ongoing battle between Heaven and Hell.

[Written by MAL Rewrite]
","['Comedy', 'Fantasy', 'Mystery', 'Historical', 'Mythology', 'School', 'Josei']"
23673,"Erika Shinohara has taken to lying about her romantic exploits to earn the respect of her new friends. So when they ask for a picture of her ""boyfriend,"" she hastily snaps a photo of a handsome stranger, whom her friends recognize as the popular and kind-hearted Kyouya Sata.

Trapped in her own web of lies and desperately trying to avoid humiliation, Erika explains her predicament to Kyouya, hoping he will pretend to be her boyfriend. But Kyouya is not the angel he appears to be: he is actually a mean-spirited sadist who forces Erika to become his ""dog"" in exchange for keeping her secret.

Begrudgingly accepting his deal, Erika soon begins to see glimpses of the real Kyouya beneath the multiple layers of his outer persona. As she finds herself falling for him, she can't help but question if he will ever feel the same way about her. Will Kyouya finally make an honest woman out of Erika, or is she destined to be a ""wolf girl"" forever?

[Written by MAL Rewrite]","['Comedy', 'Romance', 'School', 'Shoujo']"
16742,"After living 50 simulated high school lives and dating over 100 virtual boys, Tomoko Kuroki believes that she is ready to conquer her first year of high school. Little does she know that she is much less prepared than she would like to think. In reality, Tomoko is an introverted and awkward young girl, and she herself is the only one who doesn't realize it! With the help of her best friend, Yuu Naruse, and the support and love of her brother Tomoki, Tomoko attempts to brave the new world of high school life.

Watashi ga Motenai no wa Dou Kangaetemo Omaera ga Warui! chronicles the life of a socially awkward and relatively friendless high school otaku as she attempts to overcome her personal barriers in order to live a fulfilling life.

[Written by MAL Rewrite]","['Comedy', 'Otaku Culture', 'School']"
19383,"The mysterious, yellow-masked Storyteller is a man whose true name and origin are both unknown. He appears at dusk where children gather and recites sinister tales based on Japanese urban legends, to which his young audience eerily intakes. However, the Storyteller is no ordinary teller of tales. He incorporates a kamishibai, a traditional paper-scrolling device, to add visuals to his already demented narration.

A series of short horror stories, Yami Shibai begins with a bachelor who, after moving into a new apartment, immediately starts sensing a malevolent glare being pressed into him. A single talisman rests on his ceiling, but he has no way of knowing it is one of the few safeguards that separate him from a bottomless pit of suffering. Each story is more terrifying, more appalling, and more sickening than the last as the Storyteller's audience find themselves being sucked into the vicious world of his words.

[Written by MAL Rewrite]","['Avant Garde', 'Horror', 'Supernatural']"
21563,"After discovering a mysterious sword in the storehouse of her home, third-year high school student Yui Kusanagi finds herself suddenly transported to a different world. While exploring her new surroundings, she meets five strange yet handsome men before coming face to face with Zeus: the king of the gods. 

In order to restore the deteriorating relationship between the gods and humans, Zeus has created the Academy of the gods and has chosen Yui to be its one and only instructor. She has one year to educate the young and reluctant deities—including the five strangers she met earlier—on what it means to be human while learning about the gods herself; otherwise, they will all be trapped in Zeus' realm forever.

[Written by MAL Rewrite]","['Fantasy', 'Romance', 'Isekai', 'Mythology', 'Reverse Harem', 'Josei']"
5030,"In search of true love, Kanako Miyamae transfers to Ame no Kisaki Catholic school, inspired by how her parents fell in love with each other there. There is just one difference, though: because men make Kanako break into hives, she has actually come to the all-girls school to find a partner of the same sex.

When she meets the beautiful Mariya Shidou, Kanako believes she has found that special someone; however, there's more to Mariya than meets the eye—it turns out that Kanako's first love is actually a cross-dressing boy. Mariya threatens to expose Kanako's impure intentions unless she keeps his real gender a secret, and to make things worse, he also replaces her original roommate so that he can now keep a close eye on her.

Maria†Holic follows Kanako as she looks for love in all the wrong places and searches for the girl of her dreams—that is, if she can survive being Mariya's roommate!

[Written by MAL Rewrite]","['Comedy', 'Girls Love', 'Crossdressing', 'Parody', 'School', 'Seinen']"
36548,"After presumably failing 19 job interviews in one day, Juri Yukawa's dreams of moving out of her parents' home are utterly dashed. Stuck living with her working mother Nobuko, NEET brother Tsubasa, laid-off father Takafumi, and single-parent sister Sanae, the only hope for this family to raise a decent adult is her little nephew Makoto. However, this struggling family's life takes a turn for the worse when Makoto and Tsubasa are violently kidnapped by a mysterious organization and held for ransom. With only 30 minutes to deliver five million yen to the criminals, Juri's grandfather reveals a dangerously powerful secret to her and Takafumi.

By offering blood to her grandfather's mystical stone, the three enter the world of ""Stasis,"" a version of their world where time stops for everyone but the users. Having arrived at their destination, their rescue efforts go awry when they are assailed by a surprising group of people who are somehow able to move around within Stasis. While all hope seems lost, a monstrous giant known as the Herald appears amidst the chaos, its intent and motivations as cryptic as the very nature of this timeless world.

[Written by MAL Rewrite]","['Drama', 'Mystery', 'Supernatural', 'Suspense', 'Adult Cast', 'Psychological', 'Seinen']"
1122,"High-tech LaRousse City is a pretty impressive place to visit—and a pretty impressive place for a Pokémon battle, too! Satoshi heads straight for their renowned Battle Tower, but things don't turn out too well when his battle partner turns out to be a scared boy named Tooi. Because of a frightening childhood incident, Tooi is scared of all Pokémon—even cute ones like Pikachu!

There's a lot more to be frightened by when Deoxys shows up and takes control of the city, shutting down the machines and taking everyone captive. One Pokémon that is not amused is the Legendary Rayquaza, and it will do whatever it takes to remove this invader from its territory! Meanwhile, Satoshi, Tooi, and all their friends may be caught in the middle, but they're certainly not out of the fight!

(Source: Official site)","['Action', 'Adventure', 'Comedy', 'Fantasy', 'Sci-Fi', 'Kids']"
36873,"After failing their boss for the last time, yakuza members Kentarou, Ryou, and Kazuhiko are faced with one of two choices: have their organs harvested and sold or take a trip to Thailand for sex reassignment surgery and become pop idols. Now, after a year of excruciating training, the three thugs have been reborn as Airi, Chika, and Mari. Debuting as the amateur idol group The Goku Dolls, the three strive towards becoming top idols.

However, despite the hours of feminizing brainwashing they were forced to endure, the three idols have managed to keep the yakuza spirit alive in their hearts. In order to fix this, their yakuza boss hires Mandarin Kinoshita, a legendary manager who has never had an idol group fail under his management. With their lives now on the line, the reluctant yakuza must work with their new manager to unleash their inner cuteness and become the successful idols that their tyrannical boss can truly be proud of. 

[Written by MAL Rewrite]","['Comedy', 'Ecchi', 'Gag Humor', 'Magical Sex Shift', 'Organized Crime', 'Workplace', 'Seinen']"
11783,"Cinque returns to the land of Flonyard in Dog Days' to resume his duties as the hero of the Biscotti Republic and it's as though he never left!

The difference this time is that he's brought two friends with him who become heroes in their own right: childhood best friend Rebecca Anderson, who becomes the hero for the Principality of Pastillage at the urging of their leader Princess Couvert Eschenbach Pastillage, and his cousin Nanami Takatsuki, who becomes the hero for the Galette Lion Dominion.

As with the first season though, with so many secrets to be uncovered and mysteries to be solved, will there even be time for the athletic events that these three hyper and athletic teenagers love to participate in so much?","['Action', 'Adventure', 'Fantasy', 'Isekai']"
31737,"Gakusen Toshi Asterisk 2nd Season continues the story of Genestella students Ayato Amagiri and Julis-Alexia von Riessfeld, who have progressed to the next round of the Phoenix Festa after a long and strenuous battle with sisters Irene and Priscilla Urzaiz.

Despite Julis and Ayato's best attempts, the fact that Ayato's powers have been sealed is no longer a secret. Now at a major disadvantage, the duo must come up with a plan if they are to have any hope of winning the Phoenix Festa. Only one thing is for sure: the troubles heading their way are only going to get more insurmountable from here on.

[Written by MAL Rewrite]","['Action', 'Comedy', 'Fantasy', 'Romance', 'Ecchi', 'Harem', 'School', 'Urban Fantasy']"
22687,"During the 21st century, humanity attempted to colonize Mars by sending two species which could endure the harsh environment of the planet to terraform it—algae and cockroaches. However, they did not anticipate the species' remarkable ability to adapt. Now in the 26th century, a lethal disease known as the Alien Engine Virus has arrived on Earth, and the cure is suspected to be found only on Mars. The problem is, Mars in the present is overrun by creatures known as ""Terraformars,"" incredibly powerful and intelligent humanoid cockroaches that mutated from those originally sent to the planet. 

The Annex I team, consisting of a hundred men and women genetically enhanced with characteristics of powerful organisms from earth, has been sent to Mars on a mission to find the cause of the Alien Engine Virus and to help cure humanity—signalling the start of the crew's fight for survival.

[Written by MAL Rewrite]","['Action', 'Horror', 'Sci-Fi', 'Suspense', 'Gore', 'Space', 'Survival', 'Seinen']"
21085,"Even though they shared the same bus every morning and sat next to each other in class, Ayaka Kagari, the ""Princess"" of Tougetsu High School, was nothing more than an unreachable idol for Honoka Takamiya. The horde of students who worshipped the ""Princess"" was merely a nuisance to Honoka, living his lazy, regular high school life.

Everything seemed perfectly normal until, one day, Honoka is attacked out of the blue by a mysterious witch. To his surprise, Ayaka saves his life, revealing herself to be a fire witch on a covert mission to protect Honoka.

From that fateful day, the ordinary life of Honoka is turned upside down as he is thrown into the war between the Workshop Witches, who strive to protect the citizens, and the Tower Witches, who desire to steal a power hidden within him.

[Written by MAL Rewrite]","['Action', 'Supernatural', 'School', 'Seinen']"
36726,"Once a hot springs inn, now a boarding house with extraordinarily cheap rent, Yuragi-sou is virtually uninhabited save for a few peculiar residents. As rumor has it, it is haunted by a vile ghost which scares away all potential tenants. Therefore, it is the perfect refuge for Fuyuzora Kogarashi—a broke, homeless psychic seeking an affordable roof to stay under and ghosts to exorcise.

Kogarashi prepares for a face-off against the ghost, only to find out it is not as malicious as the rumors made it out to be. Instead, it is the ghost of a beautiful, silver-haired girl whose only recollection of her life before death is her name: Yuuna. Even more baffling is that the other tenants of Yuragi-sou not only are able to see Yuuna as well, but each has their own supernatural ability.

Amidst the chaos caused by his quirky fellow residents, Kogarashi attempts to uncover the regret that keeps Yuuna anchored to the world of the living, lest she become an evil spirit sentenced to spend her afterlife in hell.

[Written by MAL Rewrite]","['Comedy', 'Romance', 'Supernatural', 'Ecchi', 'Harem', 'Shounen']"
37449,"It was announced at a Dengeki Game Festival stage event that the Strike the Blood light novel series will get a third OVA release. It will cover until the end of Seisen-hen.

(Source: MAL news)","['Action', 'Fantasy', 'Ecchi', 'Harem', 'School', 'Urban Fantasy', 'Vampire']"
3455,"Timid 16-year-old Rito Yuuki has yet to profess his love to Haruna Sairenji—a classmate and object of his infatuation since junior high. Sadly, his situation becomes even more challenging when one night, a mysterious, stark-naked girl crash-lands right on top of a bathing Rito.

To add to the confusion, Rito discovers that the girl, Lala Satalin Deviluke, is the crown princess of an alien empire and has run away from her home. Despite her position as the heiress to the most dominant power in the entire galaxy, Lala is surprisingly more than willing to marry the decidedly average Rito in order to avoid an unwanted political marriage.

To LOVE-Ru depicts Rito's daily struggles with the bizarre chaos that begins upon the arrival of Lala. With an evergrowing legion of swooning beauties that continuously foil his attempted confessions to Haruna, To LOVE-Ru  is a romantic comedy full of slapstick humor, sexy girls, and outlandishly lewd moments that defy the laws of physics.

[Written by MAL Rewrite]","['Comedy', 'Romance', 'Sci-Fi', 'Ecchi', 'Harem', 'School', 'Shounen']"
41226,"At the start of her freshman year in college, Hana Uzaki reunites with Shinichi Sakurai, an upperclassman who was in the same club as her during her high school days. However, much to her surprise, the once active senior has ended up becoming a ""lonesome"" student, preferring to spend his free time in quiet peace.

Uzaki does whatever she can to keep Sakurai from being ""alone,"" from convincing him to go to the movies to going to his part-time workplace. While Sakurai finds her irritating and tiresome, he still goes along with Uzaki's hijinks and shenanigans, even if he knows that her perky personality will only lead the two of them into various comical situations.

Even so, as the days pass by, their relationship only gets better, to the point where people around them misinterpret them to be a couple. At any rate, whenever Uzaki wants to hang out with her upperclassman, fun and adorable wackiness is sure to follow!

[Written by MAL Rewrite]","['Comedy', 'Romance', 'Adult Cast', 'Love Status Quo']"
41312,"Deep in the forest, far from any human contact, there lives a child named Ryouma Takebayashi. He engages in the rather strange hobby of keeping various types of slimes as pets. Furthermore, despite his young age, he has a sturdy physique and good compatibility for magic. All of this is because, having endured much hardship in his previous life, three gods grace Ryouma with a second chance to pursue one goal: savor the wonders of life.

After three years of comfortable solitude pass by, Ryouma meets people that will change his current life forever. When he encounters and helps some soldiers tend to their wounded comrade, the group convinces him to accompany them to visit the nearby town's ducal family. Ryouma agrees and soon embarks on a journey to explore the vast world beyond his home.

[Written by MAL Rewrite]","['Fantasy', 'Slice of Life', 'Isekai', 'Iyashikei', 'Reincarnation']"
834,A Shinigami named Baishin who was sealed by Soul Society long ago is set free on Earth. On a fateful day Ichigo encounters him and has roughly half of his reiatsu drained. Its now up to Ichigo and the Soul Society to finally put a stop to Baishin and his destruction.,"['Action', 'Adventure', 'Supernatural', 'Shounen']"
