ID,Sypnosis,Genres
34019,"In Japanese folklore, a ""tsukumogami"" is an object that has gained a soul, becoming alive and self-aware. There are two types of tsukumogami: the mature ""tsugumomo,"" who have developed through long years of harmony with their owners, and the aberrant ""amasogi,"" premature spirits that are only born to grant the destructive wishes of certain people.

Kazuya Kagami has never gone without his mother's obi after her death. Be it at home or school, he keeps it safe with him at all times. One day, he nearly loses his life when a wig amasogi attacks him. When all seems to be over, his treasured obi defends him, transforming into a beautiful girl. She introduces herself as Kiriha, a tsugumomo owned by Kazuya's mother. 

With Kiriha's arrival, Kazuya enters a reality he has never seen before, a world with gods and tsukumogami.

[Written by MAL Rewrite]","['Action', 'Comedy', 'Supernatural', 'Ecchi', 'Harem', 'Mythology', 'School']"
6974,"The story revolves around Maya, the daughter of the former Headmaster of Waldstein Academy, and a time traveling agent Fumiaki Uchida. In the year 2012, the world had been invaded by aliens and time travelers were sent back to the year 1999 in order to find and destroy the Nostradamus Key, which Nostradamus Prophecy foretold as what would bring about the apocalypse. The series then turns to the year 1999, where Maya returns to the Academy with the intention of destroying the Academy by superseding her late father's position as the principal. Her plan was interrupted when she meets Fumiaki and learns of the forthcoming destruction. Despite being distrusting towards Fumiaki, they form a pact to look for the Nostradamus Key.

In order to find the Nostradamus Key, time agents were provided with specially created cell phones. When a user finds an object of interest, by thinking of destroying it and taking a photo, and if the resulting image is that of a peaceful world, then the subject is the Nostradamus Key. Conversely, if the subject is not the Nostradamus Key, then the photo displays destruction. By using the phone, Maya and Fumiaki investigates occult occurrences as they occur in the town.

(Source: Wikipedia)","['Comedy', 'Mystery', 'Sci-Fi', 'Supernatural', 'School', 'Time Travel']"
20973,"Asuta Jimon, a runaway, is wandering the streets at night when he has a chance encounter with a young girl collapsed beside her tricycle. After he offers her some food, she is moved by his kindness and asks him to join her organization, offering him a face mask and a sweet bun. In need of a place to stay, Asuta decides to play along and accepts her offer, adopting the nickname ""Dva."" 

Little does Dva know, this cute girl is Kate Hoshimiya, the leader of Zvezda, a secret organization bent on world conquest. However, he soon realizes the true weight of her words as peculiar happenings rope him deeper into Zvezda and its eccentric members—the samurai-like vanguard Itsuka Shikabane, tech-genius Natalia ""Natasha"" Vasylchenko, troublesome Yasubee ""Yasu"" Morozumi, ex-gangster Gorou Shikabane, and multi-purpose robot Roboko Tsujii. 

With ""White Light,"" a powerful organization of justice, and the entire Japanese government against them, can Zvezda really dominate all humanity and let their light shine throughout the world?

[Written by MAL Rewrite]","['Action', 'Comedy', 'Sci-Fi', 'Super Power']"
25157,"One day, the bright red sun stopped shining, causing the ""Breakdown Phenomenon""—the destruction of Arata Kasuga's town and the disappearance of the people inhabiting it. All, however, is not yet lost; by utilizing the magical grimoire given to him by his childhood friend and cousin Hijiri Kasuga, Arata's world gets artificially reconstructed.

In order to investigate the phenomenon, Lilith Asami appears before Arata, whose artificial world suddenly disintegrates. He is given two choices: hand over the book, or die. However, Arata chooses the third option—enrolling in the top-secret magic school Royal Biblia Academy, where six other magical users await him. Together with Lilith, these six form the Trinity Seven, the elite of the school who each bolster their own power and skill.

With the ambition to save Hijiri and the help of his newfound friends, Arata stops at nothing to prevent the destruction of his beloved hometown and to bring his best friend back.

[Written by MAL Rewrite]","['Action', 'Comedy', 'Fantasy', 'Romance', 'Ecchi', 'Harem', 'School', 'Shounen']"
26165,"In the past, humanoid bears coexisted with humans. However, a meteor shower that fell onto Earth had a strange effect on bears throughout the world: they suddenly became violent and hungry for human flesh, spurring an endless cycle of bloodshed in which bear ate man and man shot bear, forgetting the lively relationship they once had. The ""Wall of Severance"" was thus built, separating the two civilizations and keeping peace.

Kureha Tsubaki and Sumika Izumino are two lovers attending Arashigaoka Academy, who, upon the arrival of two bears that have sneaked through the Wall of Severance and infiltrated the academy, find their relationship under a grave threat. The hungering yet affectionate bears, Ginko Yurishiro and Lulu Yurigasaki, seem to see the bear-hating Kureha as more than just another meal, and in getting closer to her, trigger an unraveling of secrets that Kureha may not be able to bear.

When their relationships provoke the Invisible Storm, a group that keeps order within the ideological school, the girls must stand on trial with their love, embarking on a journey of self-discovery en route to attaining true love's ""promised kiss.""

[Written by MAL Rewrite]","['Avant Garde', 'Drama', 'Fantasy', 'Girls Love', 'Ecchi', 'Anthropomorphic', 'Psychological', 'School']"
50803,"Fumiya Tomozaki is now cruising through the game of life—all thanks to the guidance of Aoi Hinami, his popular classmate and rival in the online game Attack Families, widely known as ""Tackfam."" As the summer holiday draws to a close and a new term commences, Tomozaki reunites with Aoi, who reminds him of his ultimate goals: to become well-liked among his peers and find himself a girlfriend.

However, Tomozaki puts his ambitions on hold when his innocent friend, Hanabi Natsubayashi, starts being bullied. To make matters worse, Aoi is characteristically out of touch with the situation. But Tomozaki is not alone in resolving this issue—he now has a group of loyal friends who are all determined to help Hanabi and ensure they enjoy their youths together to the fullest.

[Written by MAL Rewrite]","['Drama', 'Romance', 'School']"
53050,"With her late grandfather's inspiring words in mind, Chizuru Mizuhara teams up with her friend Kazuya Kinoshita to launch a crowdfunding campaign for an amateur film. The two hope that with the success of the project, Chizuru can honor her grandparents' wishes before she loses her grandmother as well. After their wild encounters with three girls—Kazuya's clingy ""trial"" girlfriend, Ruka Sarashina; their nosy new next-door neighbor, Mini Yaemori; and Chizuru's shy work friend, Sumi Sakurasawa—they all collaborate together to reach the campaign goal and begin production of the film. As their ambitious endeavor progresses, Chizuru and Kazuya grow closer and begin to struggle with their mutual feelings.

[Written by MAL Rewrite]","['Comedy', 'Romance', 'Adult Cast', 'Harem', 'Shounen']"
17247,"The Walpurgis Royal Academy of Machinart was founded alongside the development of ""Machinart,"" machine magic capable of giving life and intelligence to mechanical dolls subsequently called as ""automaton."" Its aim: train skilled puppeteers to control the automatons, as militaries across the globe have begun incorporating Machinart into their armies.

After miserably failing the academy's entrance exams, Raishin Akabane and his humanoid automaton Yaya must defeat one of the top one hundred students to earn the right to take part in the Evening Party, a fight for supremacy between puppeteers using their automatons. The last one standing is bestowed the title of ""Wiseman"" and granted access to the powerful forbidden arts.

Thus, Raishin challenges Charlotte Belew and her automaton Sigmund to a duel, but before they even begin, Sigmund is attacked by other students. After saving his opponents from their assaulters, Raishin cancels the duel but is forced to search for a new way to gain access to the Party. Driven by the tragedies of his past, Raishin fights alongside Yaya to rise to the top and claim the title of Wiseman.

[Written by MAL Rewrite]","['Action', 'Fantasy', 'Ecchi', 'School']"
25389,"Earth is finally peaceful again, but this calm is short-lived. The remnants of Frieza's army, led by Sorbet and his right hand Tagoma, arrive on Earth in order to summon Shen Long with the goal of resurrecting their old master. To do so, they threaten Emperor Pilaf, Shuu, and Mai for the Dragon Balls in their possession.

Once successfully revived, Frieza—who had been stoking his hatred for Gokuu Son and Future Trunks in Hell—proclaims that he will not be content until they are dead by his hand. Sorbet informs him that Future Trunks has not been heard of in years, and Gokuu's power has far surpassed even that of the mighty Majin Buu. Unfazed, Frieza responds that he only requires a few months of training before being capable of defeating Gokuu.

Will Frieza be able to exact revenge upon his nemesis, or will Gokuu, Vegeta, and their friends prevail against adversity, saving Earth once more?

[Written by MAL Rewrite]","['Action', 'Adventure', 'Comedy', 'Fantasy', 'Martial Arts', 'Shounen']"
32086,"A young girl named Zuru sets out on an expedition through a post-apocalyptic city controlled by machines in a desperate hunt for food. Things go awry when her team accidently triggers the city's AI defense program called the Safeguard. Attacked by the machines, her companions are on the verge of being annihilated when a mysterious man named Killy arrives and exterminates the hostile units.

Despite his heroic intervention, Zuru is hesitant to trust Killy and questions his motives. He reveals to have come from thousands of levels below the city in order to find humans possessing the Net Terminal Genes—a trait that would allow humans to regain control of their civilization and shut down the Safeguard. After hearing his story, Zuru and the rest of her team join Killy and embark on a journey in search of the Genes that could prove to be mankind's last hope of survival.

[Written by MAL Rewrite]","['Action', 'Drama', 'Sci-Fi', 'Suspense', 'Mecha', 'Psychological', 'Survival', 'Seinen']"
14027,"When the Neighbor's Club struggles to find an activity to do, Kodaka Hasegawa suggests they pass the time by writing a round-robin story—a narrative where everyone takes turns writing a section. But as they begin the project, chaos ensues as every member writes the story according to their personal preferences while trying to outdo each other. At this rate, will the story ever reach a fitting conclusion?

[Written by MAL Rewrite]
","['Comedy', 'Romance', 'Ecchi', 'Love Polygon', 'School']"
4063,"Struggling yet brilliant 19-year-old Minato Sahashi has failed his college entrance exams for the second time, resulting in him being regarded as worthless by those around him. However, the course of his seemingly bleak future is altered dramatically when a beautiful, supernatural woman falls from the sky and into his life. That woman, Musubi, is a unique being known as a ""Sekirei,"" a humanoid extraterrestrial with extraordinary abilities. These aliens are known for kissing humans carrying the Ashikabi gene in order to awaken additional latent powers deep within.

Recognizing the potential within the seemingly insignificant youth, Musubi kisses the bewildered Minato, initiating a bond between the two of them. This drags him into the high-stakes world of the Sekirei, where he and his new partner must compete against others in a battle for survival called the ""Sekirei Plan."" However, unbeknownst to the contestants, there is far more at risk that what the competition initially entailed.

[Written by MAL Rewrite]","['Action', 'Comedy', 'Romance', 'Ecchi', 'Harem', 'Super Power', 'Seinen']"
45653,"When middle school kendo champion Ayumu Tanaka begins his first year in high school, he does not take the expected route of joining the Kendo Club; he signs up for the unofficial Shogi Club instead. His sole motive is falling in love at first sight with Urushi Yaotome—the club's president and only member—and will do anything to get closer to her. However, Ayumu decides not to confess to Urushi until he can beat her in a match of shogi fair and square.

Naturally, this self-imposed hurdle is a formidable challenge for Ayumu to overcome, as Urushi is far more experienced at the game and sees through his every strategy. Nevertheless, this does not stop him from praising her looks, her skill, or even her smile, which, coupled with Ayumu's expressionless face and direct approach, makes Urushi constantly blush beet red. Learning more about shogi and the charming player sitting across from him, Ayumu inches toward making his confession with each exciting round they play together—even if it is one pawn at a time!

[Written by MAL Rewrite]
","['Comedy', 'Romance', 'Love Status Quo', 'School', 'Strategy Game', 'Shounen']"
27899,"Ken Kaneki has finally come to accept the monstrous, flesh-craving part of himself that he has feared and despised for so long. After escaping captivity and torture, Kaneki joins Aogiri Tree—the very militant ghoul organization that had abducted him, leading his friends to question his true motive and loyalty.

As tension between the government and the ghouls continues to rise, the Commission of Counter Ghoul, the government's specialized anti-ghoul agency, has intensified their efforts to completely purge Tokyo of ghouls. This threatens the transient peace of Kaneki's friends and former comrades—the ghouls at the Anteiku coffee shop. Aware of the dangerous situation, Kaneki faces several battles that puts his precious fleeting humanity on the line.

[Written by MAL Rewrite]","['Action', 'Fantasy', 'Horror', 'Suspense', 'Gore', 'Psychological', 'Urban Fantasy', 'Seinen']"
4896,"Considered as the third installment in the highly popular When They Cry series by 07th Expansion, Umineko no Naku Koro ni takes place on the island of Rokkenjima, owned by the immensely wealthy Ushiromiya family. As customary per year, the entire family is gathering on the island for a conference that discusses the current financial situations of each respective person. Because of the family head's poor health, this year involves the topic of the head of the family's inheritance and how it will be distributed.

However, the family is unaware that the distribution of his wealth is the least of Ushiromiya Kinzou's (family head) concerns for this year's family conference. After being told that his end was approaching by his longtime friend and physician, Kinzou is desperate to meet his life's true love one last time: the Golden Witch, Beatrice. Having immersed himself in black magic for many of the later years in his life, Kinzou instigates a ceremony to revive his beloved upon his family's arrival on Rokkenjima. Soon after, a violent typhoon traps the family on the island and a string of mysterious murders commence, forcing the eighteen people on the island to fight for their lives in a deadly struggle between fantasy and reality.

[Written by MAL Rewrite]","['Horror', 'Mystery', 'Supernatural', 'Suspense', 'Gore', 'Psychological']"
31405,"With World War II right around the corner, intelligence on other countries' social and economic situation has become a valuable asset. As a result, Japan has established a new spy organization known as the ""D Agency"" to obtain this weapon.

Under the command of Lieutenant Colonel Yuuki, eight agents have been assigned to infiltrate and observe some of the most powerful countries, reporting on any developments associated with the war. In order to carry out these dangerous tasks, these men have trained their bodies to survive in extreme conditions and studied numerous fields such as communications and languages. However, their greatest strength lies in their ability to manipulate people in order to obtain the information necessary to give their nation the upper hand.

[Written by MAL Rewrite]","['Drama', 'Mystery', 'Suspense', 'Historical', 'Military']"
48753,"The great Jahy will not be defeated! Simultaneously combating starvation, the lack of A/C, and the unavoidable weakness of turning child-sized, Jahy—previously the second strongest being in the Dark Realm—is under great stress. If it weren't for the destruction of the mana crystal which used to power the Dark Realm, Jahy would still be living a life of power and luxury. 

And yet, at the moment, brawling with the landlady over rent is a recurring event for Jahy. Just to have a place to stay and food to eat, Jahy must work part-time. However, her immense pride will not allow her to live under such poor conditions for any longer than necessary. Vowing to reinstate the Dark Realm to its former glory, Jahy continues her journey to reassemble the mana crystal.

[Written by MAL Rewrite]","['Comedy', 'Supernatural', 'Shounen']"
52446,"For more than 30 years, Dariel has been a loyal soldier in the Demon King's army, having been raised by Granbarza, one of the Four Heavenly Generals. However, as Dariel lacks any magical potential, he is nothing but a disgrace in the eyes of Granbarza's son, Bashbarza, who fires Dariel right after assuming his father's position as a general.

Stripped of a home and a job, Dariel wanders the forests, where he stumbles upon a human girl named Malika running from a monster. After Dariel intervenes to help Malika, she invites him to stay at her village in return. There, he discovers that the reason he has zero suitability for magic as a demon is that he is, in fact, a human.

However, Dariel is no ordinary human. Possessing potential that far outweighs even heroes, Dariel may soon find himself involved in the humans and demons' seemingly never-ending conflict, facing against the race he once considered allies.

[Written by MAL Rewrite]","['Comedy', 'Fantasy']"
53040,"Naoya Mukai's crazy lifestyle of balancing his time between both of his girlfriends, Saki Saki and Nagisa Minase, is still as hectic as ever. Additionally, the blonde bombshell Rika Hoshizaki also has her sights on Naoya, complicating his already convoluted love life.

As if things could not get more ridiculous, another girl inserts herself into the situation: Shino Kiryuu, who is determined to end Naoya's two-timing and ensure Saki's happiness. However, Shino harbors secret feelings for Naoya—a longing she believes she must forsake—yet simply cannot due to the deep attraction he inspires.

[Written by MAL Rewrite]","['Comedy', 'Romance', 'Harem', 'School', 'Shounen']"
10397,"When boys suddenly get into places where they've never been allowed before, some girls tend to get upset. So when the decision is made to merge the elite Yuihime Girls' Private Academy and the coeducational Kagamidai Private Academy, everyone wants to take extra care in avoiding trouble while bringing the two Privates together. Therefore, rather than just bringing the Kagamidai boys into the Yuihime girls' school all at once, a plan is concocted in which a group of test males will be inserted into the Girls' Private Academy first.

Thus, poor young Shingo finds himself being thrown as a sacrificial lamb to the lionesses of Yuihime, who aren't exactly waiting for him with open arms. Will Shingo manage to survive the estrogen soaked death pit that is Yuihime? Can the girls learn to be more receptive to the boys? And just how long until something involving panties will cause emotions to flare, sparks to fly and the battle of the sexes to explode?

(Source: Sentai Filmworks, edited)","['Drama', 'Romance', 'Harem', 'School']"
11761,"Medaka Kurokami is, in the truest sense of the word, perfect. Beautiful, intelligent, and athletic, Medaka's dream is to make others happy. So when she runs for Student Council President of the prestigious Hakoniwa Academy, winning the election with 98% of the votes is only to be expected. 

The very first thing the boisterous new president does is set up the ""Medaka Box,"" a suggestion box allowing students to submit any kind of request for assistance. Together with the cynical Zenkichi Hitoyoshi, her childhood friend who has been strong-armed into helping, Medaka fulfills these requests at a ridiculous rate. For every job completed, she adds flowers to the student council room, with the aim of filling the entire school. However, the two are about to find out that helping others may be a lot harder than they think as they begin to uncover a devastating plan centering on the academy and even Medaka herself!

[Written by MAL Rewrite]","['Action', 'Comedy', 'Ecchi', 'Martial Arts', 'School', 'Super Power', 'Shounen']"
21603,"On the hot summer day of August 14, Shintarou Kisaragi is forced to leave his room for the first time in two years. While arguing with the cyber girl Ene who lives in his computer, Shintarou Kisaragi accidentally spills soda all over his keyboard. Though they try to find a replacement online, most stores are closed due to the Obon festival, leaving them with no other choice but to visit the local department store. Venturing outside makes Shintarou extremely anxious, but the thought of living without his computer is even worse. It's just his luck that on the day he finally goes out, he's caught in a terrifying hostage situation.

Luckily, a group of teenagers with mysterious eye powers, who call themselves the ""Mekakushi Dan,"" assist Shintarou in resolving the situation. As a result, he is forced to join their group, along with Ene. Their abilities seem to be like pieces of a puzzle, connecting one another, and as each member's past is unveiled, the secret that ties them together is slowly brought to light.

[Written by MAL Rewrite]","['Sci-Fi', 'Supernatural', 'Super Power']"
8424,"Taro Sado is a high school student who lives his day to day life with a big secret—he's a masochist! Encouraged by his cross-dressing best friend Tatsukichi Hayama, Taro asks the Second Voluntary Club for help with his problem and ends up joining the club after they vow to ""fix"" him.

However, it turns out that all of the members of the club have some serious issues. The club leader Mio Isurugi is a self-designated god who is afraid of cats, Arashiko Yuuno has a severe fear of men, and the club advisor Michiru Onigawara is a sadist who enjoys making people cosplay. 

Together with other wacky characters such as Yumi Mamiya, a talented masseuse and Yuuno's best friend, and Noa Hiiragi, the president of the invention club, they all learn about the importance of acceptance and kindness.

[Written by MAL Rewrite]","['Comedy', 'Ecchi', 'Harem', 'School']"
32013,"At first glance, Galko, Otako, and Ojou are three high school girls who seem like they wouldn’t have anything to do with each other. Galko is a social butterfly with a reputation for being a party animal, even though she is actually innocent and good-hearted despite her appearance. Otako is a plain-looking girl with a sarcastic personality and a rabid love of manga. And Ojou is a wealthy young lady with excellent social graces, though she can be a bit absent-minded at times. Despite their differences, the three are best friends, and together they love to talk about various myths and ask candid questions about the female body.

Oshiete! Galko-chan is a lighthearted and humorous look at three very different girls and their frank conversations about themselves and everyday life. No topic is too safe or too sensitive for them to joke about—even though every so often, Galko seems to get a bit embarrassed by their discussions!

[Written by MAL Rewrite]","['Comedy', 'School']"
14829,"Mage's Association members Rin Toosaka and Luviagelita ""Luvia"" Edelfelt are tasked with finding and retrieving seven Class Cards, medieval artifacts containing the life essence of legendary Heroic Spirits. To aid them in their mission, they are granted the power of Ruby and Sapphire, two sentient Kaleidosticks that would enable them to transform themselves into magical girls and drastically increase their abilities. However, the two mages are on anything but good terms, prompting the Kaleidosticks to abandon them in search for new masters. They stumble upon two young schoolgirls—Illyasviel von Einzbern and Miyu—and quickly convince them to form a contract. With their new powers and responsibilities, Illya and Miyu set forth to collect all the Class Cards.

[Written by MAL Rewrite]
","['Action', 'Comedy', 'Mahou Shoujo']"
395,"Despite having seemingly returned to their normal lives, Kei Kurono, Masaru Katou, and Kei Kishimoto are forced back into the lethal game after Gantz's recent activity. The black sphere continues to summon recently deceased people to fight alien invaders. And having survived the two previous encounters, the trio are more than prepared for the upcoming missions.

As they progress through the tournament's stages, the three proceed in their attempt to earn 100 points, which is said to be the only way to leave the parallel dimension for good. However, with the constant onslaught of alien invaders and the threat of imminent death, they must first focus on the task at hand—immediate survival.

[Written by MAL Rewrite]","['Action', 'Drama', 'Horror', 'Sci-Fi', 'Suspense', 'Gore', 'High Stakes Game', 'Psychological', 'Survival', 'Seinen']"
