ID,Sypnosis,Genres
25,"The Great Kanto Desert, a sweltering wasteland of nothing but ruins and sand, is all that remains of post-apocalyptic Japan. The once fair population has been left to cling to the inhospitable dunes for survival. At least, that is the case for normal people. For those who have spent a little too long in the Kanto sun, the desert offers a wondrous opportunity to make a name for themselves.

One such person is the masked handyman ""Sunabouzu,"" or Desert Punk, who has forged a legendary reputation for always finishing his jobs, no matter the nature or cost. Cunning and ruthless, he has become a force of crude destruction to the other desert people. However, the ""Vixen of the Desert,"" Junko Asagiri, discovers that Sunabouzu is not without his weaknesses—he is easily swayed by his insatiable lust for large-breasted desert babes. 

Following their chaotic adventures through the Kanto Desert, Sunabouzu features a bizarre cast of personalities who entertain themselves with senseless violence and perversion in a world long destroyed by their forefathers. And just like them, they have not learned a damn thing.

[Written by MAL Rewrite]","['Action', 'Adventure', 'Comedy', 'Sci-Fi', 'Ecchi', 'Seinen']"
25519,"In her everyday life, Yuuna Yuuki is a hero. As proof, she is in her middle school's Hero Club, where she does her best to help others and bring a smile to everyone's face.

But Yuuna, always up to any task, is about to become an even bigger hero. Mysterious destructive forces called Vertexes begin threatening the world she loves, and the Hero Club is called upon by a strange phone app to save it. Along with her best friend Mimori Tougou, as well as sisters Fuu and Itsuki Inubouzaki, they must transform into magical girls in order to battle the Vertexes.

In between studying and putting on shows for kids, Yuuna and the Hero Club must fight for the very existence of their world and face the harsh truths behind their own powers, all the while discovering what it truly means to be a hero.

[Written by MAL Rewrite]","['Drama', 'Mahou Shoujo']"
39988,"Despite completing all the tasks given to them, Ainz Ooal Gown, Tanya Degurechaff, Kazuma Satou, Subaru Natsuki, and the other members of Class 2 are surprised to find out that their role as students is far from over. With no means of returning home, the class of eccentric personalities is still mysteriously stuck in the unfamiliar world. Although, as they are becoming quite fond of each other, spending more time together does not sound that bad.

With the unexpected arrival of new transfer students, the comedic antics of our beloved characters continue to grow. Thus, their bizarre yet nonchalant school life continues.

[Written by MAL Rewrite]","['Comedy', 'Fantasy', 'Isekai', 'Parody']"
10298,"As she strives to be an upstanding student council president, Misaki Ayuzawa maintains the same dedication to her secret part-time job at a maid cafe. As if Misaki's everyday life is not busy enough, the people around her only make it more hectic. Each colorful member of the cast has a story to tell, expressing their personalities further by putting their own twist on familiar scenes.

[Written by MAL Rewrite]","['Comedy', 'School', 'Shoujo']"
40908,"Kohachi Inugami, a detective who specializes in the occult, arrives at a remote village in the Japanese countryside, tasked by a hostess at a local inn to investigate a string of incidents involving rotting and mutilated livestock corpses that have been appearing for seemingly no reason. While surveying, Inugami notices a peculiar young boy working in the fields. Evaded by his peers and called ""Dorotabou"" for his stench, the young farmhand is surprised that anybody would take an interest in him.

Inugami, piqued with curiosity, enlists Dorotabou in helping him with the investigation, despite scorned looks from the villagers. Unbeknownst to Dorotabou, this investigation will reveal a strange new world to him—one of the beast-like entities known as Kemono existing in tandem with humans—along with breathing new purpose into his previously empty life.

[Written by MAL Rewrite]","['Action', 'Mystery', 'Supernatural', 'Detective', 'Mythology', 'Shounen']"
31798,"Katsuhira Agata is a quiet and reserved teenage boy whose sense of pain has all but vanished. His friend, Chidori Takashiro, can only faintly remember the days before Katsuhira had undergone this profound change. Now, his muffled and complacent demeanor make Katsuhira a constant target for bullies, who exploit him for egregious sums of money. But their fists only just manage to make him blink, as even emotions are far from his grasp.

However, one day Katsuhira, Chidori, and four other teenagers are abducted and forced to join the Kizuna System as official ""Kiznaivers."" Those taking part are connected through pain: if one member is injured, the others will feel an equal amount of agony. These individuals must become the lab rats and scapegoats of an incomplete system designed with world peace in mind. With their fates literally intertwined, the Kiznaivers must expose their true selves to each other, or risk failing much more than just the Kizuna System.

[Written by MAL Rewrite]","['Drama', 'Romance', 'Sci-Fi']"
10209,Two OVAs released with the 8th and 10th volumes of the original novel. They fall chronologically between the first and second seasons.,"['Action', 'Comedy', 'Supernatural', 'Ecchi', 'Harem', 'Vampire']"
44204,"During a blizzard, Masayuki Muroi's old high school friend pushes him off a mountain to certain death. However, Masayuki survives the fall and escapes to safety thanks to Yuki-Onna, the spirit of a beautiful young woman who is said to lead men to their demise—but all she asks in return is money.

Eleven years later, Masayuki has lived a successful life, having gotten married and amassing a great fortune. But when his company collapses and his wife cheats on him, Masayuki retreats to the city where Yuki-Onna once saved him, and he reconnects with her by offering her money and tasty meals. While Masayuki recovers from his misfortunes, another one knocks on his door: his ex-wife is found beaten to death, and now only Yuki-Onna—who cannot reveal herself—can corroborate his alibi.

With no one to turn to, Yuki-Onna enlists the help of the spirits' God of Wisdom, Kotoko Iwanaga. Revered by the various spirits that wander the earth, Kotoko uses her extraordinary wits and cunning to solve all quarrels they may have. In her duty to protect spirits and humans from colliding, Kotoko drags along her immortal boyfriend, Kurou Sakuragawa, and promises to prove Masayuki's innocence without exposing Yuki-Onna's existence.

[Written by MAL Rewrite]","['Mystery', 'Romance', 'Supernatural', 'Adult Cast', 'Mythology', 'Shounen']"
20541,"Just an ordinary teenager, Kobeni Yonomori receives quite the surprise on her 16th birthday—a fiancé and a sister-in-law she never even knew she had. As a result of an arrangement that her late grandfather made, Hakuya Mitsumine and his younger sister Mashiro have moved from their countryside home to the Yonomori household in order to deepen their relationship with their new family members.

Mikakunin de Shinkoukei follows Kobeni's ""love life"" with Hakuya as she tries her best to adjust to the abrupt changes forced upon her. However, as some extraordinary secrets regarding the siblings come to light, Kobeni will find her life changed forever.

[Written by MAL Rewrite]","['Comedy', 'Romance', 'Supernatural', 'School']"
24227,"1. Funshitsu / Miko-san
2. Oshigoto / Henbou
3. Sentou / Service","['Comedy', 'Romance', 'Harem', 'School', 'Shounen']"
32485,"Hachimitsu Private Academy's five male students have been released from their oppressive prison captors, allowing them to return to their ideal school lives surrounded by short-skirted girls.

With their freedom restored, things could not be going better for the gang. Kiyoshi Fujino and Shingo Wakamoto have formed close bonds with their female classmates; Reiji Andou is the center of attention due to his masochistic quirks; and even Takehito ""Gakuto"" Morokuzu—notorious for defecating himself during class—befriends the klutzy yet like-minded Mitsuko Yokoyama. 

However, in contrast to his fellow ex-convicts, Jouji ""Joe"" Nezu struggles to readjust to student life, and the unlikely romantic success of his friend Gakuto pushes him to his wit's end. Feeling ostracized, he begins to wonder if life was better behind bars.

[Written by MAL Rewrite]
","['Comedy', 'Ecchi', 'Gag Humor', 'School', 'Seinen']"
35756,"Kaoruko ""Chaos"" Moeta is a young manga artist who is down on her luck. She wants to draw manga about high school girls, but her storyboards are bland, her art uninspired, and her premises weak. Her concerned, exasperated editor comes up with an idea: push Chaos to be more social. So, by her recommendation, Chaos moves into a dormitory for female manga artists. She soon meets the other residents: Tsubasa Katsuki, a shounen manga artist; Ruki Irokawa, who draws erotic manga popular with women; and Koyume Koizuka, a shoujo artist who, like Chaos, has yet to be serialized. Quickly striking up a friendship with these girls, Chaos finds new inspiration for her manga and continues to grow her creativity.

Comic Girls is a showcase of the daily lives of these manga artists. Will Chaos finally be able to make her debut and become serialized? None of the girls know, but they will all do their best to help each other become the best artists they can be.

[Written by MAL Rewrite]","['Slice of Life', 'CGDCT', 'Otaku Culture']"
906,"The Z Warriors discover an unopenable music box and are told to open it with the dragon balls. The contents turn out to be a warrior named Tapion who had sealed himself inside along with a monster called Hildegarn. Goku must now perfect a new technique to defeat the evil monster. 

(Source: ANN)","['Action', 'Adventure', 'Comedy', 'Fantasy', 'Sci-Fi', 'Shounen']"
35889,"Although the city of Fukuoka might look relatively peaceful at first glance, in actuality it houses a thriving mixture of dangerous individuals such as killers, detectives, and professional revenge seekers right beneath its surface. Among their number is Zenji Banba, a laidback and observant detective who is investigating the work of other hitmen companies in the area. However, Banba might not be the only one with a bone to pick with these organizations, as Xianming Lin, a crossdressing male hitman in the employ of one such company begins getting fed up with his lack of jobs and pay.

One day, after Lin's current target commits suicide before the hitman could reach him, his company refuses to pay him even half the amount they were originally supposed to for the assassination. Frustrated, Lin requests another mission and is offered the job of taking out Banba, whom his organization believes has been interfering with their business. However, when Banba arrives at his home and finds the hitman inside, Lin surprisingly doesn't even attempt to kill him. Instead, he offers the detective another option: to join him and form a team. With the offer on the table, exactly how will Banba respond, and just what plans does Lin have in store for the underground world of Fukuoka?

[Written by MAL Rewrite]","['Action', 'Mystery', 'Adult Cast', 'Crossdressing', 'Detective', 'Organized Crime']"
38476,"During an Outdoor Activities Club meeting, Nadeshiko Kagamihara, Aoi Inuyama, and Chiaki Oogaki debate what it means to be a real Yamanashi native. Somewhere along the line, Chiaki brings up the Yamanashi Kids' Stamp Rally, which Nadeshiko has never heard of. The rally encourages one to visit famous places in the prefecture and collect stamps; those who complete the rally will win a year's worth of Minobu steamed buns. Enticed by the humongous food prize, Nadeshiko is set on participating.

Follow the Outdoor Activities Club as they travel around the Yamanashi prefecture to collect stamps and explore what the region has to offer!

[Written by MAL Rewrite]","['Slice of Life', 'CGDCT', 'Iyashikei']"
11013,"Ririchiyo Shirakiin is the sheltered daughter of a renowned family. With her petite build and wealthy status, Ririchiyo has been a protected and dependent girl her entire life, but now she has decided to change all that. However, there is just one problem—the young girl has a sharp tongue she can't control, and terrible communication skills.

With some help from a childhood friend, Ririchiyo takes up residence in Maison de Ayakashi, a secluded high-security apartment complex that, as the unsociable 15-year-old soon discovers, is home to a host of bizarre individuals. Furthermore, their quirky personalities are not the strangest things about them: each inhabitant of the Maison de Ayakashi, including Ririchiyo, is actually half-human, half-youkai.

But Ririchiyo's troubles have only just begun. As a requirement of staying in her new home, she must be accompanied by a Secret Service agent. Ririchiyo's new partner, Soushi Miketsukami, is handsome, quiet... but ridiculously clingy and creepily submissive. With Soushi, her new supernatural neighbors, and the beginning of high school, Ririchiyo definitely seems to have a difficult path ahead of her.

[Written by MAL Rewrite]","['Comedy', 'Romance', 'Supernatural', 'Mythology', 'Shounen']"
41587,"UA Academy's Class 1-A has been the focus of a substantial amount of public attention due to the multiple villain attacks they have faced over the past school year. This attention has left Class 1-A's rivals, Class 1-B, feeling quite bitter. Desiring to prove their skills, they look forward to the opportunity that has been given to them: a set of mock battles between the students of each class.

The classes are split into squads of four, each of which is tasked with capturing the other group members. The winner is the group who first secures all of the opposing team. While this sounds simple, a curveball is thrown into the mix with the inclusion of General Course Student Hitoshi Shinsou, who wishes to transfer into the Hero Course. Despite using his training with Class 1-A's homeroom teacher Shouta ""Eraserhead"" Aizawa to prove that he's capable of being a real hero, he is still far behind the others due to his lack of experience. However, Shinsou is determined to overcome this challenge.

Thus begins the fiery competition between Class 1-A and 1-B as each tries to prove that they are superior to the other.

[Written by MAL Rewrite]","['Action', 'School', 'Super Power', 'Shounen']"
37597,"Takato Saijou has held the title of ""Sexiest Man of the Year"" for five years running. He is an accomplished actor, with 20 years of experience under his belt, and is aware his good looks are well above average. Proud of his career, Takato regards the title as an appropriate indicator of his success.

But when his reign is ended by acting newbie Junta Azumaya, who debuted only three years ago, Takato's initial shock gives way to jealous hostility. Even in the new drama that he has been cast in, Junta seems to have suddenly surpassed him; snatching Takato's usual spot of lead actor, Junta continually manages to get on his nerves. Most infuriating of all are the bright smile and kind words that accompany everything Junta does.

All this animosity comes to a head, however, when Junta catches Takato in a rather vulnerable drunken state. Endangering his own public image, Takato confronts the junior actor with harsh words and angry comments—an opportunity Junta takes every advantage of. With the famous actor Takato Saijou now on video picking a fight with a co-star, Junta has the perfect means to blackmail him.

Asking the price of his enemy's silence, Takato is shocked to find that his motivation lies far from advancing his career; instead, Junta's terms are those that can only be realized in the bedroom!

[Written by MAL Rewrite]
","['Boys Love', 'Comedy', 'Drama', 'Adult Cast', 'Showbiz']"
33028,"Hope's Peak Academy's unconventional class 77-B is about to have an even more eccentric addition: Chisa Yukizome, an alumna with the title of Super High School-Level Housekeeper—and their new homeroom teacher. Cheerful, passionate, and capable, Chisa immediately sets about correcting the students' problematic behavior and strengthening their relationships. It may not be easy dealing with diverse pupils ranging from princesses and nurses to yakuza and impossibly lucky students, but anything is possible with the power of hope.

Meanwhile, Hajime Hinata, an unremarkable boy from the school's Reserve Course, longs for a talent. One day, he has an unexpected meeting with class 77-B's Super High School-Level Gamer Chiaki Nanami, who presents to him a new, hope-filled outlook on life. However, unbeknownst to him, the school's upper echelon is about to execute a sinister project centered around Hajime that will bring Hope's Peak—and the rest of the world—to its knees.

Zetsubou-hen chronicles the daily lives carried out at the talent-cultivating academy, and the darkness that lurks beneath. As despair slowly infects hope, plans are put into motion to start the Biggest, Most Awful, Most Tragic Event in Human History, and the end begins.

[Written by MAL Rewrite]","['Action', 'Horror', 'Mystery', 'Suspense', 'High Stakes Game', 'Psychological', 'School', 'Survival']"
40056,"Far in the future, the lifeforms known as Gadoll suddenly arose as a threat to humanity. The last surviving humans on Earth confine themselves to the Tank, a lower district in the giant mobile fortress Deca-Dence. While the Gears who live on the upper floors are warriors who go out to fight as part of the Power, most Tankers are content to provide support from the backlines, butchering Gadoll meat and reinforcing defenses. Natsume is among those who would rather go to the front lines; undeterred by her prosthetic right arm, she seeks to join the small number of Tanker soldiers who join the Gears in combat. 

But despite her peers at the orphanage each receiving their work assignments, Natsume’s enlistment to the Power remains unapproved. In the meantime, she begins a job as a cleaner in an armor repair team led by the hard-nosed and apathetic Kaburagi, who seems to be more than he lets on. Though initially cold to his idealistic subordinate, he soon recognizes in her the potential to upset the status quo of the world. As Natsume’s new mentor, Kaburagi prepares her for the special and unique role as a game-changing bug in the system.

[Written by MAL Rewrite]","['Action', 'Adventure', 'Sci-Fi']"
