ID,Sypnosis,Genres
384,"Knowing that he is risking his life, Kei Kurono makes the uncharacteristic decision to jump onto train tracks to save a homeless man from death, only to perish in the process. But when he comes to, Kei finds himself in a room with several other recently deceased people, as well as a large, mysterious black ball. While the people in the room are trying to make sense of their situation, the ball suddenly opens, revealing a cache of weapons and strange black suits. The ball then instructs everyone that they have to hunt down an alien and teleports them to an unknown location.

With very little information to work off of, Kei teams up with his childhood friend Masaru Katou and an unfamiliar woman, and the trio explore their new surroundings. It quickly becomes apparent, however, that they have stumbled into a dark and dangerous world where anything could happen to them.

[Written by MAL Rewrite]","['Action', 'Drama', 'Horror', 'Sci-Fi', 'Suspense', 'Gore', 'High Stakes Game', 'Psychological', 'Survival', 'Seinen']"
11785,"Mahiro Yasaka is just an ordinary high school student, until one day he is suddenly attacked by a dangerous monster. Just when everything seems to be lost, he is saved by a silver-haired girl named Nyaruko, who claims to be the shape-shifting deity Nyarlathotep from horror author H. P. Lovecraft's Cthulhu Mythos, sent by the Space Defense Agency to Earth. She explains to Mahiro that the creature chasing him was an alien called Nightgaunt, who had planned on abducting and selling him as a slave.

After rescuing him from the alien, the Lovecraftian deity falls madly in love with Mahiro and forces herself into his household, much to his chagrin. Moreover, they are soon joined by two others from the fictional universe: Cthuko, a girl obsessed with Nyaruko, and Hasuta, a young boy easily mistaken for a beautiful female. Together, the three eccentric aliens protect Mahiro from the various extraterrestrial dangers that threaten both his and Earth's well-being, all the while making his life a living hell.

[Written by MAL Rewrite]","['Comedy', 'Sci-Fi', 'Parody']"
30383,"In Martian colony Fourth Tokyo lies a classroom of Kirishina Corporation's brightest minds spearheading aerospace development: A-TEC, led by genius engineer Kaito Sera, eagerly anticipating the arrival of their newest member. It soon becomes clear, however, that the transfer student is hardly ordinary—Nagisa Kiryuu, newly appointed chief of A-TEC and the younger brother of the corporation's CEO, is sent to shut the program down. To keep the classroom alive, Kaito and his students desperately work to develop a successor to their most powerful rocket, the X-2; meanwhile, Nagisa climbs the corporate ladder in pursuit of his own mission. In spite of this, their separate battles soon reveal that much more is going on in Kirishina Corporation than meets the eye.

Classroom☆Crisis follows Kaito and Nagisa, as well as Kaito's younger sister Mizuki and A-TEC's test pilot Iris Shirasaki, in a story of intrigue, political warfare, and, against all odds, romance. As Nagisa and A-TEC are dragged further and further into Kirishina Corporation's conspiracies, friendships grow and pasts are unveiled as they fight to avert their classroom crisis.

[Written by MAL Rewrite]","['Drama', 'Romance', 'Sci-Fi', 'School', 'Space']"
6747,"On live television, Mina Tepes, the ruler of all vampires, reveals the existence of her species to the world and states her plan to build a sanctuary in Japan for vampires, called the Vampire Bund. Using her family's wealth to pay off the nation's debt, they have agreed to let her build this safe-haven for her fellow creatures of the night. But not everyone is so easily swayed by Mina's influence, as her announcement brings about conflict with humans who believe that the queen's quest for peace is a façade.

Akira Kaburagi does not believe in vampires and gets uneasy whenever they are brought up, although he has yet to realize why. Apart from suffering a head injury a year ago, he lives on blissfully until he meets Mina. She triggers within him memories of a life he had long forgotten, and he soon begins protecting her without understanding why. But Akira's secret is far stranger than he could have ever thought possible—he discovers that he is a werewolf, sworn from birth to protect the vampire queen, even if it costs him his life. Now, as these two dance a rondo of death in the Vampire Bund, Mina and Akira find out just how deep their bond goes.

[Written by MAL Rewrite]","['Action', 'Drama', 'Romance', 'Supernatural', 'Vampire', 'Seinen']"
39463,"Shuuichi Kagaya is what one would consider an average high school student, but sometimes, he turns into a monster. He doesn't know how or why he got his abilities, only that he would prefer no one knows about them. One night, he finds a building ablaze with a girl trapped inside. Deciding to save her, he transforms and carries her to safety, but accidentally drops his phone.

The next day, the girl he saved—Claire Aoki—finds him and confronts him about his monster identity. She even goes so far as to push him off the school roof to prove her theory after Shuuichi denies her allegations. Desperate to save himself, he transforms, and Claire snaps a picture in order to blackmail him into telling her everything he knows about monsters, which, ironically, isn't much.

As it turns out, Claire has a secret of her own: she has been searching for her sister, who also became a monster. She enlists Shuuichi's help to track her down, but they aren't the only ones searching for answers.

[Written by MAL Rewrite]
","['Action', 'Mystery', 'Ecchi', 'Super Power', 'Seinen']"
37719,"Alternative version of final four episodes of High School DxD BorN.
","['Action', 'Comedy', 'Romance', 'Supernatural', 'Ecchi', 'Harem', 'Mythology', 'School']"
35994,"With dead and lifeless eyes, Rachel Gardner wishes only to die. Waking up in the basement of a building, she has no idea how or why she's there. She stumbles across a bandaged murderer named Zack, who is trying to escape. After promising to kill her as soon as he is free, Rachel and Zack set out to ascend through the building floor by floor until they escape.

However, as they progress upward, they meet more twisted people, and all of them seem familiar with Rachel. What is her connection to the building, and why was she placed in it? Facing a new boss on each floor, can Rachel and Zack both achieve their wishes?

[Written by MAL Rewrite]","['Adventure', 'Horror', 'Suspense', 'Gore', 'Psychological']"
37569,"In the year 1930, vampires have infiltrated Tokyo to feast upon its unsuspecting citizens. As the number of victims continues to rise, the city's authorities decide to hire the Jaegers—a strange, diverse group of individuals tasked by the V Shipping Company to hunt down vampires around the world. Carrying musical instrument cases to disguise their identity, the Jaegers battle the vampires with the same mercilessness demonstrated by their foes.

Yuliy, the Jaeger's most skilled warrior, is the sole survivor of a vampire raid on his home village. Using the strength granted by his werewolf blood, he works with his team to assist Tokyo's law enforcement with the city's vampire problem. Though under the pretense of helping the police, the Jaegers are actually fighting the vampires over the mystical Ark of Sirius. With its power to change the fate of the world, Yuliy and his friends must locate the artifact before the vampires can use it to achieve their destructive goals.

[Written by MAL Rewrite]","['Action', 'Supernatural', 'Historical', 'Vampire']"
12175,"Yuuki Oojima is a member of his high school's Food Research Club, whose main activity is eating snacks bought with funds allocated to them by the school. However, this peaceful and wasteful lifestyle is under threat as the upcoming student election draws near. Satsuki Shinonome, a major candidate and the head of the department of financial affairs, campaigns on a platform that includes disbanding meritless clubs such as the Food Research Club and redirecting their budgets to proper ones.

Understandably, the Food Research Club is in an uproar over this development, with president Chisato Sumiyoshi vowing to preserve it. But what can they even do to stop the highly competent and popular Satsuki from getting elected?

[Written by MAL Rewrite]
","['Drama', 'Romance', 'Harem', 'School']"
35484,"Chisato Mizusawa is a calm and collected assistant office manager who apparently dislikes drinking alcohol. But she actually likes it and has a secret side to her that emerges only when drunk: her cute persona, which she only reveals to her husband, the bartender Sora. Each day when Chisato comes home, Sora takes care of his beloved wife, providing her with a good meal and a fresh drink. These drinks include Plum Splet, Irish Coffee, Orange Breeze, and many more tasty concoctions that she eagerly gulps down. But as much as she likes alcohol, she loves her kindhearted husband more. Together, they share a life that is filled with happiness—and the more-than-occasional cocktail.

[Written by MAL Rewrite]","['Comedy', 'Gourmet', 'Romance', 'Adult Cast']"
34034,"After his mother wins a free trip to the islands, Pokémon trainer Satoshi and his partner Pikachu head for Melemele Island of the beautiful Alola region, which is filled with lots of new Pokémon and even variations of familiar faces. Eager to explore the island, Satoshi and Pikachu run wild with excitement, quickly losing their way while chasing after a Pokémon. The pair eventually stumbles upon the Pokémon School, an institution where students come to learn more about these fascinating creatures.

At the school, when he and one of the students—the no-nonsense Kaki—have a run-in with the nefarious thugs of Team Skull, Satoshi discovers the overwhelming might of the Z-Moves, powerful attacks originating from the Alola region that require the trainer and Pokémon to be in sync. Later that night, he and Pikachu have an encounter with the guardian deity Pokémon of Melemele Island, the mysterious Kapu Kokeko. The Pokémon of legend bestows upon them a Z-Ring, a necessary tool in using the Z-Moves. Dazzled by their earlier battle and now in possession of a Z-Ring, Satoshi and Pikachu decide to stay behind in the Alola Region to learn and master the strength of these powerful new attacks.

Enrolling in the Pokémon School, Satoshi is joined by classmates such as Lillie, who loves Pokémon but cannot bring herself to touch them, Kaki, and many others. Between attending classes, fending off the pesky Team Rocket—who themselves have arrived in Alola to pave the way for their organization's future plans—and taking on the Island Challenge that is necessary to master the Z-Moves, Satoshi and Pikachu are in for an exciting new adventure.

[Written by MAL Rewrite]","['Action', 'Fantasy', 'School', 'Strategy Game', 'Kids']"
34825,"He is charming, cool, athletic, a good cook, but more importantly, he's a clean freak. Aoyama is idolized and respected by everyone, but they can only admire him from afar due to his mysophobia. Despite that, he plays soccer—a rather dirty sport!

As the playmaker for Fujimi High School's soccer club, Aoyama avoids physical contact at all cost and cleanly dribbles toward victory. However, the path to Nationals will not be easy for Fujimi's underdog team. But alongside striker Kaoru Zaizen, Aoyama will show everyone that even as a clean freak, there are things he's willing to get dirty for.

[Written by MAL Rewrite]","['Comedy', 'Sports', 'Gag Humor', 'School', 'Team Sports', 'Seinen']"
48239,"The previously bedridden Keina Kagami finds herself in the world of her favorite VRMMORPG—titled Leadale—after the life support keeping her alive fails. Reincarnated in the body of her high-level character, ""Cayna,"" she notices that the world of Leadale is different from what she remembers playing.

As she comes to learn, two hundred years have passed since she last interacted with the world. However, this does not sadden Cayna—as it means that a new journey awaits her, filled with exciting prospects and unfamiliar faces all waiting to be discovered.

[Written by MAL Rewrite]","['Adventure', 'Comedy', 'Fantasy', 'Isekai', 'Reincarnation']"
31722,"The Seven Deadly Sins, along with Elizabeth Liones and Hawk, have won the Kingdom of Leones back from the Holy Knights. At long last, it's their time to indulge in the peaceful lives they fought for. From inedible meat pies, overdue battles, unexpected stalkers, and the butterflies of first love, the Sins are accompanied by their friends in their carefree, fun-filled time together. However, the calm is broken with the premonition of a new threat, bringing upon the signs of Holy War and threatening to shatter the peace of the Sins' easygoing days.

[Written by MAL Rewrite]","['Action', 'Adventure', 'Fantasy', 'Shounen']"
33203,"Every day, a young girl wearing a mask stands by the beach and sings a nostalgic melody. After experiencing two sudden heart-wrenching partings when she was only a child, Nino Arisugawa has been singing her songs to the ocean, bound by a promise made with her two childhood friends—her first love, Momo Sakaki, and a boy who composed music, Kanade ""Yuzu"" Yuzuriha. Having never met each other, the boys both individually promised that if Nino was ever separated from them, her voice would be the beacon to reunite them once again.

After six long years, destiny has finally placed Nino, Momo, and Yuzu in the same high school. However, the passage of time has changed many things in their lives—while Nino relentlessly attempts to fulfill her childhood promise with the boys, Yuzu's feelings for her from the past resurface, and Momo goes to great lengths to prevent a reunion with Nino. Through music, will they be able to mend their friendship and overcome all the feelings involved in this complicated love triangle?

[Written by MAL Rewrite]","['Drama', 'Romance', 'Love Polygon', 'Music', 'School', 'Shoujo']"
33286,"The second season of Strike the Blood which adapts three arcs from the 9th, 11th, and 12th light novel volumes. ","['Action', 'Fantasy', 'Ecchi', 'Harem', 'School', 'Urban Fantasy', 'Vampire']"
20047,"Having been best friends since middle school, Haruka Takayama and Yuu Sonoda plan to attend Misato West High School together. However, despite being assigned to the same class, a cruel twist of fate has them seated on the opposite ends of their classroom! To make matters worse, their school will shut down in three years, making them the final intake of first-year students. Undeterred by this chain of unfortunate events, Haruka is set on sticking with Yuu, striving to create many wonderful memories with her.

Much to Haruka's jealousy however, Yuu's easygoing demeanor quickly attracts the attention of their female classmates. Sympathizing with her friend's growing insecurity, Yuu ends up sharing a deep, affectionate kiss with her in an empty classroom. The act intensifies their bond as ""special friends,"" gradually revealing a different aspect to their unique friendship while also inviting new conflicts.

[Written by MAL Rewrite]","['Comedy', 'Girls Love', 'School', 'Seinen']"
33003,"For many girls in N-City, playing the popular social role-playing game Magical Girl Raising Project is as close as they could come to being a real magical girl. However, for some rare players, that dream can become a reality. One such girl is Koyuki Himekawa, who receives a notification one night that she has been selected to become a magical girl, her in-game avatar Snow White.

As Koyuki and other chosen players in the city begin helping those in need, they all receive yet another notification: the admins have decided that they want to reduce the number of magical girls. Whoever collects the least amount of Magical Candies—which are awarded for their magical girl activities—in their competition each week will lose their powers. But when a real-world tragedy happens to the first player that drops out, they are shown the repercussions of losing their abilities. As more participants inevitably lose the competition and more twisted rules are added, the girls soon realize that their ""contest"" is actually a desperate fight for survival.

[Written by MAL Rewrite]","['Action', 'Suspense', 'Gore', 'High Stakes Game', 'Mahou Shoujo', 'Survival']"
52461,"Mitsuha Yamano could not have had it worse. After failing to enter her university of choice and losing her entire family in an accident, she finds herself plummeting off a cliff due to an especially fragile guardrail. Through what seems to be the only bit of the fortune left in her life, Mitsuha's firm unwillingness to die allows her to be transported to another world, where she ends up surviving.

In this foreign land, Mitsuha wanders around for days before collapsing from exhaustion and being rescued by a little girl named Colette. Not long after, she finds herself in yet another life-threatening situation, and her indomitable will shines once more, granting her an audience with a divine cosmic being. The entity reveals to Mitsuha that she has acquired not only superhuman regeneration but also the ability to transport between worlds at will.

Armed with this new information, Mitsuha brainstorms ways to utilize her newfound power to its full potential. Realizing that she can take goods from Earth and resell them to the other world at a higher price, she resolves to save up eighty thousand gold coins to be able to retire comfortably.

[Written by MAL Rewrite]","['Fantasy', 'Isekai']"
48,"A young wavemaster, only known by the alias of Tsukasa, wakes up in an MMORPG called The World, with slight amnesia. He does not know what he has previously done before he woke up. In The World, the Crimson Knights suspects him of being a hacker, as he was seen accompanying a tweaked character in the form of a cat. Unable to log out from the game, he wanders around looking for answers, avoiding the knights and other players he meets along the way.

As Tsukasa explores The World, he stumbles upon a magical item that takes the form of a ""guardian,"" which promises him protection from all harm. Subaru, the leader of the Crimson Knights, along with several other players who became acquainted with Tsukasa, set out to investigate why Tsukasa is unable to log out, and attempt to get to the bottom of the problem before it gets out of hand.

[Written by MAL Rewrite]","['Adventure', 'Fantasy', 'Mystery', 'Video Game']"
1726,"Patty Lowell—the lost heir of a prestigious family—is found at an orphanage, and J.D. Morrison brings her to his acquaintance Dante, the owner of a business called ""Devil May Cry."" Dante takes on so-called ""odd jobs,"" and at Morrison's request, he agrees to become a bodyguard for Patty. Begrudgingly, he sets out to deliver Patty to her family, though he is a bit annoyed with a job that essentially amounts to babysitting.

While Dante seems like a lazy good-for-nothing, he is actually a prolific demon hunter, which comes in handy when demons begin pursuing Patty. Soon enough, Dante realizes that there is more to this case than meets the eye, and he makes use of his particular skill set in order to keep Patty safe.

[Written by MAL Rewrite]
","['Action', 'Fantasy', 'Gore', 'Mythology']"
9776,"Forgetful and good-natured Run Momoki has been best friends with Tooru Ichii since childhood. Despite Run being one year older, her carefree attitude and popularity with the boys is a constant headache for the overprotective Tooru. To complicate matters further, when Tooru applies to the same high school as Run, she finds out that their little circle of two has grown into a quartet.

Their new acquaintances—Nagisa Tennouji and Yuuko Nishi—are classmates of Run and, in Tooru's eyes, the two must prove they are trustworthy. As a new high school year begins, the girls balance their friendship with the exhilarating opportunities of school life.

[Written by MAL Rewrite]","['Comedy', 'CGDCT', 'School']"
3667,"In the year 1939, humanity was on the verge of destruction. Equipped with weapons of devastating power, a mysterious alien race, known as the Neuroi, began an invasion of the Earth, ravaging the planet, obliterating countries, and vanquishing human armies. To counter this seemingly unstoppable force, the world's powers united. A new device was produced, called the Striker Unit, capable of facing Neuroi technology. Girls equipped with the Striker Unit became known as the Witches, forming humanity's last line of defense. They began their fight against the Neuroi, utilizing their now-enhanced magical abilities, flaunting destructive weapons no human could manage.

Fast forward to 1944—Yoshika Miyafuji is a young teenage girl who eventually decides to join the 501st Joint Fighter Wing, known as the ""Strike Witches."" With no formal training however, can Miyafuji learn to cooperate with her fellow Strike Witches? And if so, can she save humanity from the Neuroi onslaught?

[Written by MAL Rewrite]","['Action', 'Sci-Fi', 'Ecchi', 'Military']"
32899,"Kae Serinuma is a very kind second-year high school student and a devoted otaku. A little known fact about her, though, is that she's obsessed with BL, or Boy's Love. Serinuma can't help but to fantasize about her male classmates falling for each other and enjoys imagining them together. A more known fact about Serinuma, however, is that she’s noticeably overweight. 

While watching her favorite show one day, Serinuma witnesses the death of her most beloved character. Utterly depressed, she can't muster up the energy to eat her meals, let alone attend school. After an entire week, she finally recovers. But now there's something unusual about her—during the time she refused to leave her room, she ended up losing a large amount of weight and has somehow become strikingly beautiful!

Now catching the eye of everyone who sees her, she finds herself at the center of attention of four boys she has always known at her school. Though they all wish to spend time with her, Serinuma would much rather they spend time falling in love with one another. How will Serinuma deal with the four boys pursuing her BL-obsessed self?

[Written by MAL Rewrite]","['Comedy', 'Romance', 'Otaku Culture', 'Reverse Harem', 'School', 'Shoujo']"
45613,"Yuu Izumi leads a high school life filled with one mishap after another. No matter how improbable the situation, unfortunate events strike him at every turn. In possession of such terrible luck, Izumi enters his second year with a single wish in mind—to spend more time with his affectionate girlfriend, Micchon Shikimori.

Cute, athletic, and caring, Shikimori is immensely popular at their school. But since they began dating a year ago, Izumi has witnessed a surprising side to his otherwise adorable girlfriend: when the need arises, she turns incredibly cool! His misfortunes are easily avoided when she is there to protect him with an awe-inspiring look on her face. Charming in every way, she never ceases to make his heart skip a beat. Unfortunate as he may be, Izumi is sure to see his days of bad luck end thanks to the cute yet cool Shikimori.

[Written by MAL Rewrite]
","['Comedy', 'Romance', 'School']"
30307,"With his parents abroad, Kimihito Kurusu lived a quiet, unremarkable life alone until monster girls came crowding in! This alternate reality presents cutting-edge Japan, the first country to promote the integration of non-human species into society. After the incompetence of interspecies exchange coordinator Agent Smith leaves Kimihito as the homestay caretaker of a Lamia named Miia, the newly-minted ""Darling"" quickly attracts girls of various breeds, resulting in an ever-growing harem flush with eroticism and attraction.

Unfortunately for him and the ladies, sexual interactions between species is forbidden by the Interspecies Exchange Act! The only loophole is through an experimental marriage provision. Kimihito's life becomes fraught with an abundance of creature-specific caveats and sensitive interspecies law as the passionate, affectionate, and lusty women hound his every move, seeking his romantic and sexual affections. With new species often appearing and events materializing out of thin air, where Kimihito and his harem go is anyone's guess!

[Written by MAL Rewrite]","['Comedy', 'Fantasy', 'Romance', 'Ecchi', 'Anthropomorphic', 'Harem', 'Urban Fantasy', 'Seinen']"
8769,"Kirino Kousaka embodies the ideal student with equally entrancing looks. Her grades are near perfect, and to cover her personal expenses, she works as a professional model alongside her best friend Ayase Aragaki, who abhors liars and all things otaku. But what Ayase doesn't know is that Kirino harbors a deep, entrenched secret that will soon be brought to light.

At home one day, Kyousuke, Kirino's perfectly average brother, stumbles upon an erotic game that belongs to none other than his seemingly flawless little sister. With her reputation at stake, Kirino places a gag order on her sibling while simultaneously introducing him to the world of eroge and anime. Through Kirino, Kyousuke encounters the gothic lolita Ruri Gokou and the bespectacled otaku Saori Makishima, thus jump-starting an entirely new lifestyle. But as he becomes more and more involved in his little sister's secret life, it becomes that much harder to keep under wraps. 

[Written by MAL Rewrite]","['Comedy', 'Otaku Culture']"
