ID,Sypnosis,Genres
50612,"Now that brains and brawns have united forces, the next step in Senkuu's plan to unravel the mystery behind the green light that once petrified humanity is to go to the other side of the Earth and investigate its origin. However, to achieve this, Senkuu must first build a ship.

With the help of Tsukasa Shishiou's former underlings, the base of the ship is rapidly assembled, but there is one missing piece: a skilled captain. During their search, Senkuu and his crew come across a petrified Ryuusui Nanami—the heir of the biggest maritime conglomerate, known for his vast knowledge of sailboats but unpleasant personality. Despite this, Senkuu takes the risk and revives Ryuusui.

Ryuusui, upon realizing there are no ownership rights in this new civilization, is excited at the prospect of claiming everything for himself. But before he agrees to play a crucial part in their upcoming journey and command the vessel through the restless seas, he and Senkuu must find the king of fuels to power the ship—oil.

[Written by MAL Rewrite]","['Adventure', 'Comedy', 'Sci-Fi', 'Shounen']"
39792,"Midori Asakusa sees the world a bit differently. Always having her nose in a sketchbook, Asakusa draws detailed landscapes and backgrounds of both the world around her and the one within her boundless imagination. Even the simple act of doodling on a wall evolves into an emergency repair on the outer hull of her spaceship. She is only brought back to reality by her best friend Sayaka Kanamori. The pair are stark opposites, with Asakusa's childlike wonder contrasted by Kanamori's calculated approach to life. 

After a chance encounter where the two ""save"" the young model Tsubame Misuzaki from her overprotective bodyguard, a connection instantly sparks between Asakusa and Misuzaki, as both share an intense passion for art and animation. Whereas Asakusa is interested in backgrounds and settings, Misuzaki loves drawing the human form. Sensing a money-making opportunity, Kanamori suggests that they start an animation club, which they disguise as a motion picture club since the school already has an anime club. Thus begins the trio's journey of producing animation that will awe the world. 

From the brilliant mind of Masaaki Yuasa, Eizouken ni wa Te wo Dasu na! is a love letter to animation, wildly creative in its approach, and a testament to the potential of the medium.

[Written by MAL Rewrite]","['Adventure', 'Award Winning', 'Comedy', 'Otaku Culture', 'School', 'Seinen']"
28171,"Souma Yukihira has been cooking alongside his father Jouichirou for as long as he can remember. As a sous chef at his father's restaurant, he has spent years developing his culinary expertise and inventing new dishes to amaze their customers. He aspires to exceed his father's skill and take over the restaurant one day, but he is shocked to learn that Jouichirou is closing up the shop to take a job in New York.

Rather than tagging along with his father, Souma finds himself enrolling at the prestigious Tootsuki Culinary Academy, where only 10 percent of its students end up graduating. The school is famous for its ""Shokugeki""—intense cooking competitions between students often used to settle debates and arguments. Jouichirou tells Souma that to surpass him and survive the next three years at Tootsuki and graduate there.

The academy's brutal curriculum and fiercely competitive student body await the young chef, who must learn to navigate the treacherous environment if he wants to stand a chance at realizing his dreams. But is skill alone enough to let him rise to the top?

[Written by MAL Rewrite]","['Gourmet', 'Ecchi', 'School', 'Shounen']"
53888,"Loid Forger, an elite spy, is warned by his handler that he may potentially be reassigned from his ongoing mission, Operation Strix. To maintain his position, he must make significant progress toward the operation's objectives, which involves having his adoptive daughter Anya earn sufficient Stella Stars to become an Imperial Scholar at Eden Academy.

After learning of a cooking contest that awards the winning student with a Stella Star, Loid researches the judge's preferred dessert to help increase Anya's odds. However, perfectly recreating the judge's favorite meremere requires more than just following a recipe. Thus, the Forgers embark on a vacation to the Frigis region to try an authentic meremere. Not all goes smoothly on the trip, as the Forger family ends up entwined in a sinister plot to reignite war between the countries of Ostania and Westalis.

[Written by MAL Rewrite]","['Action', 'Comedy', 'Childcare', 'Super Power', 'Shounen']"
31715,"The light-hearted Working!! franchise comes to a close in this final episode of the concluding season. Will Aoi Yamada get the closure she so desperately needs with her distant mother? Will the relationship between Yachiyo Todoroki and Jun Satou continue to remain stagnant and awkward? Perhaps even Souta Takanashi and Mahiru Inami will take a step forward in deepening their eccentric friendship. And in the end, Wagnaria Restaurant might finally get a new chief!

Beautifully connected, all these events intertwine to give these characters a final ending to their stories.

[Written by MAL Rewrite]","['Comedy', 'Romance', 'Love Status Quo', 'Workplace', 'Seinen']"
57524,"Despite not understanding much about fleeting teen romance, first-year high school student Kazuhiko Nukumizu still wonders how he would react if his life were to be turned into a love story. Regardless, as a self-proclaimed ""background character,"" Nukumizu is satisfied continuing his life as an introvert with a negligible social life. However, he suddenly finds himself too close to the spotlight when he witnesses his popular classmate Anna Yanami be rejected by her childhood friend in the middle of a family restaurant. 

While Nukumizu wishes he could just forget what he saw and move on, Anna ends up forcefully confiding herself in Nukumizu, lamenting her status as a childhood friend fated to have her beloved stolen. As he becomes dragged into Anna's situation, Nukumizu soon gets caught up in the relationship drama of two more girls: Lemon Yakishio, an outgoing member of the track and field club; and Chika Komari, a shy member of the literature club. Now thrust out of his comfort zone, Nukumizu finds himself a major character in the lives of too many losing heroines. 

[Written by MAL Rewrite]","['Comedy', 'Romance', 'School']"
11597,"Koyomi Araragi has recently survived a vampire attack and met several girls plagued by supernatural entities. On top of all this, he wakes up one morning to find himself kidnapped and tied up by his girlfriend Hitagi Senjougahara. Araragi's sister Karen has run afoul of Deishuu Kaiki, a swindler who once conned Senjougahara's family. As a result, Senjougahara has imprisoned Araragi to keep him safe from the devious Kaiki. But when Araragi receives a frantic message from Karen, he sets out to rescue her.

Along with Karen's troubles, Tsukihi, Araragi's other server, faces issues of her own. And when two mysterious women step into their lives, not even Araragi can anticipate their true goals, nor the catastrophic truths about his family soon to be revealed.

[Written by MAL Rewrite]","['Comedy', 'Mystery', 'Supernatural', 'Ecchi']"
4477,"Shinichi Chiaki conquers his fear of flying, and Megumi ""Nodame"" Noda's exceptional performance at a piano competition earns her an invitation to study at the prestigious Conservatoire de Paris. The pair go to Paris together to take the next step in their careers: Chiaki as a new rising conductor under the wing of the great maestro Franz von Stresemann, and Nodame as a pupil of the esteemed piano professor Charles Auclair.

But, of course, the music world is much bigger than the two of them could have ever imagined. Chiaki and Nodame, alongside old friends and new rivals, must fight and persevere to reach the dazzling musical heights that await them while never losing sight of what matters most.

[Written by MAL Rewrite]
","['Comedy', 'Romance', 'Adult Cast', 'Music', 'Josei']"
14713,"High schooler Nanami Momozono has quite a few problems of late, beginning with her absentee father being in such extreme debt that they lose everything. Downtrodden and homeless, she runs into a man being harassed by a dog. After helping him, she explains her situation, and to her surprise, he offers her his home in gratitude. But when she discovers that said home is a rundown shrine, she tries to leave; however, she is caught by two shrine spirits and a fox familiar named Tomoe. They mistake her for the man Nanami rescued—the land god of the shrine, Mikage. Realizing that Mikage must have sent her there as a replacement god, Tomoe leaves abruptly, refusing to serve a human.

Rather than going back to being homeless, Nanami immerses herself in her divine duties. But if she must keep things running smoothly, she will need the help of a certain hot-headed fox. In her fumbling attempt to seek out Tomoe, she lands in trouble and ends up sealing a contract with him. Now the two must traverse the path of godhood together as god and familiar; but it will not be easy, for new threats arise in the form of a youkai who wants to devour the girl, a snake that wants to marry her, and Nanami's own unexpected feelings for her new familiar.

[Written by MAL Rewrite]","['Comedy', 'Romance', 'Supernatural', 'Mythology', 'Shoujo']"
1604,"There is no putting it lightly—Tsunayoshi Sawada is just no good. He is clumsy, talentless, and desperately in love with the school idol Kyouko Sasagawa, a girl so completely out of his league. Dubbed ""Loser Tsuna"" by his classmates, he seems to be the very personification of failure in the guise of a middle-schooler.

Tsuna's boring life takes an extraordinary twist when he encounters the mysterious Reborn, who happens to be a hitman... and shockingly, a baby! Sent from the strongest Mafia family in Italy, Reborn is assigned the daunting mission of preparing the dull middle schooler to succeed the ninth boss of the notorious Vongola family, who is on the brink of retirement. The dull boy has a grueling road ahead, but with the help of his new criminal affiliates and his peculiar home tutor, perhaps even Loser Tsuna can achieve greatness.

[Written by MAL Rewrite]","['Action', 'Comedy', 'Organized Crime', 'Super Power', 'Shounen']"
16662,"Although Jirou Horikoshi's nearsightedness prevents him from ever becoming a pilot, he leaves his hometown to study aeronautical engineering at Tokyo Imperial University for one simple purpose: to design and build planes just like his hero, Italian aircraft pioneer Giovanni Battista Caproni. His arrival in the capital coincides with the Great Kanto Earthquake of 1923, during which he saves a maid serving the family of a young girl named Naoko Satomi; this disastrous event marks the beginning of over two decades of social unrest and malaise leading up to Japan's eventual surrender in World War II.

For Jirou, the years leading up to the production of his infamous Mitsubishi A6M Zero fighter aircraft will test every fiber of his being. His many travels and life experiences only urge him onward⁠—even as he realizes both the role of his creations in the war and the harsh realities of his personal life. As time marches on, he must confront an impossible question: at what cost does he chase his beautiful dream?

[Written by MAL Rewrite]
","['Award Winning', 'Drama', 'Romance', 'Historical']"
40421,"The band ""given""—comprised of Ritsuka Uenoyama, Mafuyu Satou, Haruki Nakayama, and Akihiko Kaji—has advanced to the final screening of the Countdown-fes Amateur Contest, in which they will be judged on their live act. Although enthusiastic, they worry about having only one original song to perform.

Mafuyu embraces the idea of learning more about music in order to create new, emotionally resonant songs. In this regard, he unexpectedly receives help from Ugetsu Murata, Akihiko's on-again, off-again lover. Ugetsu has unsuccessfully tried to let go of Akihiko, who himself is torn between lingering feelings for his past and an uncertain resolve for the future.

As the competition draws near, Haruki uncharacteristically begins to doubt his place in the band and the trust he shares with Akihiko. It is a given that not all attachments last forever, but it remains to be seen what can be salvaged from the ruins of heartbreak—or if only regrets will endure.

[Written by MAL Rewrite]","['Boys Love', 'Drama', 'Music']"
50528,"The race to obtain the lost Ainu gold is nearing its peak, as even more formidable ex-prisoners are set on keeping their tattooed skins intact. Saichi ""The Immortal"" Sugimoto and Asirpa can finally move forward together, but Asirpa's time with Kiroranke and Ogata Hyakunosuke has slightly altered her ambition and strengthened her determination. As their party leaves the Russian territory, they gain a peculiar follower.

Meanwhile, Toshizou Hijikata's crew makes major moves to get invaluable skins, falling into the poisonous trap of a dangerous convict. Although each group possesses a strong advantage over the others, even First Lieutenant Tokushirou Tsurumi—the most powerful and ruthless contender—cannot advance without Asirpa's help. However, his ominous plans for when they will inevitably meet remain a mystery.

[Written by MAL Rewrite]","['Action', 'Adventure', 'Adult Cast', 'Historical', 'Military', 'Seinen']"
36296,"While reveling in the successful clinching of a prized vase for his collection, Yoshifumi Nitta, a yakuza member, is rudely interrupted when a large, peculiar capsule suddenly materializes and falls on his head. He opens the capsule to reveal a young, blue-haired girl, who doesn't divulge anything about herself but her name—Hina—and the fact that she possesses immense powers. As if things couldn't get any worse, she loses control and unleashes an explosion if her powers remain unused. Faced with no other choice, Nitta finds himself becoming her caregiver. 

To let her use her powers freely, Nitta asks Hina to help out with a construction deal, which goes smoothly. But while this is happening, a rival yakuza group covertly attacks his boss. To Nitta's shock, his colleagues later pin the blame on him! Tasked with attacking the rival group in retaliation, Nitta steels himself and arrives at their hideout. But suddenly, Hina unexpectedly steps in and helps him wipe out the entire group. As it turns out, Hina might just become a valuable asset to Nitta and his yakuza business, provided she does not use her powers on him first! And so the strange life of this unusual duo begins.

[Written by MAL Rewrite]","['Comedy', 'Childcare', 'Organized Crime', 'Super Power', 'Seinen']"
1827,"On the precipice of a cataclysmic drought, the Star Readers of the Shin Yogo Empire must devise a plan to avoid widespread famine. It is written in ancient myths that the first emperor, along with eight warriors, slew a water demon to avoid a great drought and save the land that was to become Shin Yogo. If a water demon was to appear once more, its death could bring salvation. However, the water demon manifests itself within the body of the emperor's son, Prince Chagum—by the emperor's order, Chagum is to be sacrificed to save the empire.

Meanwhile, a mysterious spear-wielding mercenary named Balsa arrives in Shin Yogo on business. After saving Chagum from a thinly veiled assassination attempt, she is tasked by Chagum's mother to protect him from the emperor and his hunters. Bound by a sacred vow she once made, Balsa accepts.

Seirei no Moribito follows Balsa as she embarks on her journey to protect Chagum, exploring the beauty of life, nature, family, and the bonds that form between strangers.

[Written by MAL Rewrite]","['Action', 'Adventure', 'Fantasy']"
50416,"In order to pursue her dream of bringing positive changes to Japan, Mitsumi Iwakura leaves her countryside town to attend a prestigious high school in the hustle and bustle of Tokyo. As she has already mapped a clear life plan, she has absolute confidence that there will be zero mishaps from then onwards.

Despite her ambitious promise, the country girl ends up running late on the first day when she gets lost on her way to school. Fortunately, she meets a fellow first-year student, Sousuke Shima, who is in the same situation and offers to go with her. They eventually make it to school, but the misfortunes do not end there, as Mitsumi leaves an unfavorable first impression in front of her classmates.

Nevertheless, the class soon takes notice of her friendship with Sousuke despite their opposing personalities. Only time will tell whether Mitsumi will be able to forge fruitful relationships with her classmates, and she will certainly not be alone.

[Written by MAL Rewrite]","['Drama', 'School', 'Seinen']"
20899,"Years after an ancient evil was salvaged from the depths of the sea, Joutarou Kuujou sits peacefully within a Japanese jail cell. He's committed no crime yet demands he not be released, believing he's been possessed by an evil spirit capable of harming those around him. Concerned for her son, Holy Kuujou asks her father, Joseph Joestar, to convince Joutarou to leave the prison. Joseph informs his grandson that the ""evil spirit"" is in fact something called a ""Stand,"" the physical manifestation of one's fighting spirit which can adopt a variety of deadly forms. After a fiery brawl with Joseph's friend Muhammad Avdol, Joutarou is forced out of his cell and begins learning how to control the power of his Stand.

However, when a Stand awakens within Holy and threatens to consume her in 50 days, Joutarou, his grandfather, and their allies must seek out and destroy the immortal vampire responsible for her condition. They must travel halfway across the world to Cairo, Egypt and along the way, do battle with ferocious Stand users set on thwarting them. If Joutarou and his allies fail in their mission, humanity is destined for a grim fate.

[Written by MAL Rewrite]","['Action', 'Adventure', 'Super Power', 'Shounen']"
8129,"Ever since her late mother took her to an aquarium when she was young, Tsukimi Kurashita has been obsessed with jellyfish, comparing their flowing tentacles to a princess's white dress. Now living with five other unemployed otaku women, 19-year-old Tsukimi spends her days as a social outcast dreaming of becoming an illustrator.

However, her life changes forever when one day, a beautiful woman unexpectedly helps her save a jellyfish in a local pet store. From then on, the stranger—confident, fashionable, and the complete opposite of Tsukimi and her roommates—begins to regularly visit the girls' building. This trendy hipster, though appearing shallow at first, harbors some secrets of her own, starting with the fact that ""she"" isn't really a girl at all, but a wealthy male college student named Kuranosuke Koibuchi!

[Written by MAL Rewrite]","['Comedy', 'Adult Cast', 'Crossdressing', 'Visual Arts', 'Josei']"
12859,"The Straw Hat Pirates enter the rough seas of the New World in search of the hidden treasures of the Pirate King, Gol D. Roger－One Piece. On their voyage, the pirates come across a terrifying, powerful man, former Marine Admiral Z.

Z is accused of having stolen the ""Dyna Stones"", weapons believed to have the power to shake up the New World. The Marine Headquarters believes Z is about to use it to end the pirate era, and with it, the lives of many innocent people. In fear of such a phenomenal event, marines start to take action against the former admiral.

Even if it means stumbling upon marines and the navy, the Straw Hat Pirates decided to chase after Z and stop him from causing havoc. As they continue to embark on their ventures, the pirates bump into new and familiar acquaintances.","['Action', 'Adventure', 'Fantasy', 'Shounen']"
51122,"With a cartload of fur pelts in tow, traveling merchant Kraft Lawrence stops by the village of Pasloe. According to local folklore, centuries ago, one of the villagers made a promise with the wolf deity Holo, who swore to bless Pasloe with bountiful harvests of wheat. Yet, as time passed, such stories became little more than relics of the past.

After quickly finishing his business in the village, Lawrence sets out to his next destination. His journey, however, takes an unexpected turn when he discovers a nude, animal-eared girl sleeping among his pelts. Even more surprisingly, the youthful-looking woman claims to be Holo—the wolf of legend.

Holo wishes to return to her hometown in the north, and though their first encounter is rocky, she convinces Lawrence to accompany her on her travels. In return, she vows to earn her keep, using her quick wits and lifetime of experience to help her newfound companion in his dealings. As they continue their journey, Lawrence and Holo take advantage of whatever economic opportunities they come across, often landing in situations that put both their business skills and their relationship to the test.

[Written by MAL Rewrite]","['Adventure', 'Drama', 'Romance', 'Supernatural', 'Adult Cast']"
50380,"Zhuge Kongming earned a reputation as one of the greatest tacticians of the Three Kingdoms period of third-century China. Having led his army through countless grueling victories, Kongming falls gravely ill during the Battle of Wuzhang Plains. The weariness and regret stemming from the seemingly never-ending war catch up to him, and as he draws his final breath, Kongming wishes that if he were to reincarnate, he would be reborn in a more peaceful era.

His wish comes true, and Kongming wakes up in modern-day Tokyo with a younger body and his memories intact. Thrust into an unfamiliar world, he finds his way into a nightclub and meets Eiko Tsukimi, an aspiring singer whose performance immediately captivates him. Pitying his confusion, Eiko takes Kongming under her wing and teaches him about the current world, which leads to Kongming's interest in contemporary music. Seeing Eiko's immense musical potential, Kongming vows to make the world recognize her and soon takes on the role of her manager.

Unsurprisingly, the music industry is unforgiving to those who make even the slightest mistakes. Still, Kongming is determined to accomplish his goals—even if he must utilize the war stratagems he famously used in his previous life!

[Written by MAL Rewrite]
","['Comedy', 'Adult Cast', 'Music', 'Reincarnation', 'Showbiz']"
40542,"Kusuo Saiki is a high school student who possesses a wide range of psychic abilities. While many may believe these abilities to be a gift, to Kusuo, they are a curse as he must fight strange odds in order to try to live a normal life. Forced to use his psychic powers to protect his secret or to make up for his father's incompetence at work, will Saiki eventually come to realize how his powers can actually help his friends and family?

[Written by MAL Rewrite]","['Comedy', 'Gag Humor', 'School', 'Super Power', 'Shounen']"
