ID,Sypnosis,Genres
585,"Shizuku Tsukishima is an energetic 14-year-old girl who enjoys reading and writing poetry in her free time. Glancing at the checkout cards of her books one evening, she notices that her library books are frequently checked out by a boy named Seiji Amasawa. Curiosity strikes Shizuku, and she decides to search for the boy who shares her love for literature.

Meeting a peculiar cat on the train, Shizuku follows the animal and is eventually led to a quaint antique shop, where she learns about a cat statuette known as ""The Baron."" Taking an interest in the shop, she surprisingly finds Seiji, and the two quickly befriend one another. Shizuku learns while acquainting herself with Seiji that he has a dream that he would like to fulfill, causing her dismay as she remains uncertain of her future and has yet to recognize her talents.

However, as her relationship with Seiji grows, Shizuku becomes determined to work toward a goal. Guided by the whispers of her heart and inspiration from The Baron, she resolves to carve out her own potential and dreams.

[Written by MAL Rewrite]
","['Drama', 'Romance', 'Shoujo']"
51179,"After his relationship with Eris Boreas Greyrat reaches new heights, Rudeus Greyrat is ecstatic. Unfortunately, his joy is short-lived, as Eris suddenly abandons him to embark on her own journey. Believing that Eris has lost all interest in him, a heartbroken and depressed Rudeus sets forth to the Northern Territories. With his sole goal being to locate his mother on the vast continent, Rudeus wonders if persisting through daily life is worth the pain, falling into a robotic routine as he endlessly ruminates on his lost love.

However, the dangers of the North soon prove that one cannot survive with a dulled mind. While on a quest with the party Counter Arrow, with whom he recently became acquainted, Rudeus has a brush with death—an experience that forces him to finally snap out of his despair. With his newfound teammates, Rudeus rediscovers the pleasure of daily adventuring and moves forward with his original goal of living his second lease on life to the fullest.

[Written by MAL Rewrite]","['Adventure', 'Drama', 'Fantasy', 'Ecchi', 'Isekai', 'Reincarnation']"
5690,"Shinichi Chiaki is quickly making a name for himself as the principal conductor of the revitalized Roux-Marlet Orchestra, and Megumi ""Nodame"" Noda has made leaps and bounds as a pianist at the Conservatoire de Paris. However, tensions mount between the two as Nodame feels left behind by Chiaki's growing success and his close friendship with legendary piano prodigy Rui Son. Disregarding her teacher Professor Charles Auclair's advice, Nodame enters another piano competition in an attempt to jumpstart her own performance career. 

Meanwhile, those around Chiaki and Nodame are at their own crossroads. Rui begins to doubt herself after hearing Nodame's playing and being denied tutelage from Auclair; Maestro Franz von Stresemann faces the reality of his mortality; pianists Yunlong Li and Tatiana Vishneva feverishly prepare for a competition, while the latter also struggles with her growing feelings for oboist and fellow student Yasunori Kuroki. 

As Chiaki, Nodame, and their friends continue on their respective journeys, they must not only strive to stay true to themselves, but also remember where it all started.

[Written by MAL Rewrite]","['Comedy', 'Romance', 'Adult Cast', 'Music', 'Josei']"
440,"Years ago, a tragic incident befell a young princess when both her parents died. Devastated, it seemed nothing would calm this poor soul. However, a prince traveling through the area came to see the princess, hoping to cheer her up. After wiping her sorrowful tears, the prince gave her a ring carrying a rose emblem and told her as long as she holds onto the ring, they are destined to meet again. The event leaves a deep impression on the girl, Utena Tenjou, leading her to become a prince herself. 

Years later, Utena attends Ootori Academy, recognized by the same rose emblem as her precious ring's. There, attracted by the scent of roses, she witnesses Anthy Himemiya tending the flowers, accompanied by the Student Council President Touga Kiryuu and Vice President Kyouichi Saionji, who seem to be arguing over Anthy. While Utena thinks nothing of the occurrence, the Student Council gathers to discuss an important matter. 

Subsequently, a misunderstanding leads to Utena being dragged into the world of Duelists—those with rings similar to her own. The Duelists fight for the ownership of the Rose Bride, Anthy Himemiya, who is said to possess great power. Wanting to prove her capabilities as a prince, and enraged that Anthy is being wronged and objectified, Utena resolves to fight against the Duelists to save her from the cruel fate.

[Written by MAL Rewrite]
","['Award Winning', 'Drama', 'Fantasy', 'Mystery', 'Suspense', 'Mahou Shoujo', 'Psychological', 'School']"
50602,"With Anya Forger successfully enrolled at the renowned Eden Academy, Operation Strix advances to its second phase. To investigate Ostanian politician Donovan Desmond, Anya must either befriend his son Damian or collect eight Stella Stars to become an Imperial Scholar. Fortunately, Anya has already acquired her first star. In celebration, her adoptive father, Loid, decides to fulfill her wish to adopt a dog.

During their canine search, Loid receives new orders from his superiors, who have found that a band of Berlint University students is plotting to assassinate Westalis' Minister Brantz using bombs worn by trained dogs. While Loid tries to stop their plans, Anya stumbles upon the terrorists' base of operations. There, she befriends a kindhearted, clairvoyant dog who the family later names Bond.

Although the Forgers continue to lead their individual lives in secrecy, the family—with a new fluffy addition—remains united through all of the unusual obstacles thrown their way.

[Written by MAL Rewrite]","['Action', 'Comedy', 'Childcare', 'Super Power', 'Shounen']"
6,"Vash the Stampede is the man with a $$60,000,000,000 bounty on his head. The reason: he's a merciless villain who lays waste to all those that oppose him and flattens entire cities for fun, garnering him the title ""The Humanoid Typhoon."" He leaves a trail of death and destruction wherever he goes, and anyone can count themselves dead if they so much as make eye contact—or so the rumors say. In actuality, Vash is a huge softie who claims to have never taken a life and avoids violence at all costs.

With his crazy doughnut obsession and buffoonish attitude in tow, Vash traverses the wasteland of the planet Gunsmoke, all the while followed by two insurance agents, Meryl Stryfe and Milly Thompson, who attempt to minimize his impact on the public. But soon, their misadventures evolve into life-or-death situations as a group of legendary assassins are summoned to bring about suffering to the trio. Vash's agonizing past will be unraveled and his morality and principles pushed to the breaking point.

[Written by MAL Rewrite]","['Action', 'Adventure', 'Sci-Fi', 'Adult Cast', 'Shounen']"
53393,"Fifteen years ago, disaster struck human civilization, and now dangerous man-eating monsters roam the ravaged lands, posing an existential threat to the remaining survivors. Amid this turmoil, an isolated facility shelters children and nurtures them in peace. However, as a few among them find out about the world beyond the narrow periphery of their nursery's walls, their curiosity about it slowly grows.

Meanwhile, in the outside world, young survivors Maru and Kiruko band together to search for a special place called Heaven, each for their own reasons. Carrying past burdens and tragic secrets, the two hope to find answers to the cruelty they have experienced in their lives and in the world, which still remains in tatters.

[Written by MAL Rewrite]","['Adventure', 'Mystery', 'Sci-Fi', 'Seinen']"
55866,"For hearing-impaired university student Yuki Itose, silence has been a natural part of life since birth. Her world is small and isolated; she commutes to campus, interacts with her best friend Rin Fujishiro, and communicates through writing and text messages—a lifestyle that offers little to no change. One day, during her commute, Yuki meets fellow student Itsuomi Nagi, a multilingual travel enthusiast and friend of Rin. When Itsuomi learns of Yuki's condition, he takes it in stride, moving Yuki's heart. From this one simple gesture, Yuki and Itsuomi's lives start changing day by day as they let each other into their own worlds.

[Written by MAL Rewrite]","['Romance', 'Adult Cast', 'Shoujo']"
12115,"The Band of the Hawk has dwindled in the year since Guts left them on his journey to forge his own destiny. Unaware of their fate, Guts returns to the Hawks—now being led by his former ally Casca—after a rumor about them passes his way. Once the saviors of the kingdom of Midland, the Band of the Hawk are now hunted as they desperately fight for their lives while plotting to free their leader, Griffith, after he was imprisoned for committing treason. But the man they save is far from the Griffith they remember.

Griffith is a shell of his former charismatic self after a year of continuous, horrific torture. No longer able to walk, speak, or even hold a sword, he has nothing but the small, strange trinket, the Crimson Behelit, that will not leave him. The entire Band of the Hawk want to rise to greatness once more, but how much are they willing to sacrifice to return to their past glory? It doesn't seem possible, but when Griffith's heart darkens and a solar eclipse blackens the sky, the Behelit offers a choice that will leave the Band of the Hawk with a blood-soaked fate that will haunt them for the rest of their days.

[Written by MAL Rewrite]","['Action', 'Adventure', 'Drama', 'Fantasy', 'Horror', 'Gore', 'Military', 'Psychological', 'Seinen']"
372,"For this year's Nadeshiko Festival, Sakura Kinomoto's elementary school class is presenting a play. She will portray a princess who struggles to respond to the love confession of the neighboring country's prince. Sakura empathizes with her character all too well, since she herself still owes an answer to the boy who confessed his love for her four months ago.

When cousins Shaoran and Meiling Li return from Hong Kong to pay a surprise visit to their friends in Japan, Sakura receives further encouragement to finally declare her feelings. However, she is repeatedly distracted by a presence reminiscent of a Clow Card as well as unexplained disappearances around town.

Eventually, Sakura learns of another of Clow Reed's creations—the ""Nothing""—which was formerly sealed away beneath the magician's old house. It has power equal to all 52 cards Sakura possesses, and furthermore, it wants to take those cards away from her! Objects, space, and people disappear from Tomoeda with each card that is stolen. Sakura sets out to capture the Nothing so everything will return to normal, but what must she sacrifice in the process?

[Written by MAL Rewrite]
","['Award Winning', 'Comedy', 'Drama', 'Romance', 'Mahou Shoujo', 'Shoujo']"
38680,"Tooru Honda has always been fascinated by the story of the Chinese zodiac that her beloved mother told her as a child. However, a sudden family tragedy changes her life, and subsequent circumstances leave her all alone. Tooru is now forced to live in a tent, but little does she know that her temporary home resides on the private property of the esteemed Souma family. Stumbling upon their home one day, she encounters Shigure, an older Souma cousin, and Yuki, the ""prince"" of her school. Tooru explains that she lives nearby, but the Soumas eventually discover her well-kept secret of being homeless when they see her walking back to her tent one night.

Things start to look up for Tooru as they kindly offer to take her in after hearing about her situation. But soon after, she is caught up in a fight between Yuki and his hot-tempered cousin, Kyou. While trying to stop them, she learns that the Souma family has a well-kept secret of their own: whenever they are hugged by a member of the opposite sex, they transform into the animals of the Chinese zodiac.

With this new revelation, Tooru will find that living with the Soumas is an unexpected adventure filled with laughter and romance.

[Written by MAL Rewrite]","['Drama', 'Romance', 'Supernatural', 'Love Polygon', 'School', 'Shoujo']"
16664,"Deep in the countryside, a man named Okina works as a bamboo cutter in a forest, chopping away at the hollow plants day after day. One day, he discovers a small baby inside a glowing shoot. He immediately takes her home, convinced that she is a princess sent to Earth as a divine blessing from heaven. Okina and his wife Ouna take it upon themselves to raise the infant as their own, watching over her as she quickly grows into an energetic young girl. Given the name Kaguya, she fits right in with the village she has come to call home, going on adventures with the other children and enjoying what youth has to offer.

But when Okina finds a large fortune of gold and treasure in the forest, Kaguya's life is completely changed. Believing this to be yet another gift from heaven, he takes it upon himself to turn his daughter into a real princess using the wealth he has just obtained, relocating the family to a mansion in the capital. As she leaves her friends behind to enter into an unwanted life of royalty, Kaguya's origins and purpose slowly come to light.

[Written by MAL Rewrite]","['Award Winning', 'Fantasy', 'Historical']"
2966,"Holo is a powerful wolf deity who is revered in the small town of Pasloe for blessing the annual harvest. Yet as years go by and the villagers become more self-sufficient, Holo has been reduced to a mere folktale. When a traveling merchant named Kraft Lawrence stops at the settlement, Holo offers to become his business partner if he takes her to her northern home of Yoitsu. The savvy trader recognizes Holo's unusual ability to evaluate a person's character and accepts her proposition. 

Now in the possession of both sharp bargaining skills and a charismatic negotiator, Lawrence inches closer to his goal of opening his own shop. However, as Lawrence travels the countryside with Holo in search of economic opportunities, he begins to realize that his aspirations are slowly morphing into something unexpected.

[Written by MAL Rewrite]
","['Adventure', 'Drama', 'Romance', 'Supernatural', 'Adult Cast']"
16894,"With the Interhigh Championship finally over, Seirin's basketball team refocuses their efforts, training harder than ever to get the chance to participate in the Winter Cup. Both Tetsuya Kuroko and Taiga Kagami see old friends walk back into their lives, providing a challenge both on and off the court.

As new skills are developed and new alliances created, enemies from various teams—giants of high school basketball such as Yousen, Shuutoku, and Touou—stand in the way of Seirin's steadfast attempts to get to the top. All of these schools prove to be formidable foes whose abilities progress exponentially, while Kuroko struggles to find a balance between his resolve to play as part of a team and his desire to win. 

With old wounds reopening, new challenges to face on the court, and a new set of foes—the ""Uncrowned Kings""—vowing to defeat the new hopefuls, will Seirin ever be able to achieve their dream of beating the Generation of Miracles?

[Written by MAL Rewrite]","['Sports', 'School', 'Team Sports', 'Shounen']"
18115,"After celebrating their victory against Al-Thamen, Aladdin and his friends depart the land of Sindria. With the end of the battle, however, comes the time for each of them to go their separate ways. Hakuryuu and Kougyoku are ordered to go back to their home country, the Kou Empire. Meanwhile Aladdin announces he needs to head for Magnostadt—a mysterious country ruled by magicians—to investigate the mysterious events occurring in this new kingdom and become more proficient in magic. For their part, encouraged by Aladdin's words, Alibaba and Morgiana also set off in pursuit of their own goals: training and going to her homeland, respectively.

Magi: The Kingdom of Magic follows these friends as they all go about their separate adventures, each facing their own challenges. However, a new threat begins to rise as a great war looms over the horizon...

[Written by MAL Rewrite]","['Action', 'Adventure', 'Fantasy', 'Shounen']"
627,"Gorou Honda, a little boy obsessed with baseball, has always admired his father, Shigeharu. Wishing to follow in his father's footsteps, Gorou dreams of becoming a professional baseball player. In turn, his son's starry-eyed admiration encourages Shigeharu to keep persevering, despite his late wife's death and his unsatisfying position on the second-string team Blue Ocean.

Unfortunately, an elbow injury forces Shigeharu off the team, and he falls into despair. However, after an offhand joke from his childhood friend, Shigeharu reevaluates his choices and decides to keep playing, leaving behind his prime position as pitcher and taking up the bat. Now motivated more than ever, Gorou works hard to carve his way in the Japanese Little League.

[Written by MAL Rewrite]","['Sports', 'Team Sports', 'Shounen']"
37078,"The All-Star Tournament is a three-day event that allows e-sports participants from various professional clubs to display their skills, while also giving casual Glory players the chance to interact with pros in the flesh.

Retired top-tier Glory player Ye Xiu agrees to watch the tournament together with Tang Rou and Chen Guo after the latter manages to get ahold of three tickets. It is a strange sensation for Ye Xiu, as unlike previous occasions, this time he attends the tournament as a spectator, not a participant. However, despite his attempts to keep a low profile, events in the All-Star Tournament may force the former Glory legend back into the limelight.

[Written by MAL Rewrite]","['Action', 'Video Game']"
35466,"After reliving the life of a high school student through the ReLIFE experiment, 27-year-old Arata Kaizaki cannot believe how quickly it has changed him. He has begun to see the world through a different perspective that he had completely forgotten as an adult. He has made friends and formed deep relationships with each one of them. However his support, Ryou Yoake, reminds him that the experiment is all an illusion; after his experiment ends, he will be forgotten by all of them.

The experiment of another ReLIFE subject is also coming to an end. After spending two years with ReLIFE, Chizuru Hishiro has developed into a more open, more thoughtful person than she could have ever imagined. She has met people who have changed her life, her perspective, and ultimately her. However, now that their ReLIFE is coming to an end, will they be able to let go of the memories they have made?

[Written by MAL Rewrite]","['Drama', 'Romance', 'School']"
38249,"The ground shakes, a rumble follows, and before anyone in Japan can prepare themselves, a cataclysmic volcanic eruption engulfs the country in molten lava and suffocating ashes. Of course, high school student Kusou Saiki repeatedly uses his psychic powers to prevent this harrowing catastrophe.

But between restoring the planet and watching his friends discuss their aspirations, Saiki finally resolves to stop the eruption and allow the world to continue spinning. However, this straightforward task is challenging even for the most powerful of psychics, let alone one who must deal with the usual shenanigans his ludicrous friends present.

[Written by MAL Rewrite]","['Comedy', 'Gag Humor', 'School', 'Super Power', 'Shounen']"
44055,"Yoshikazu Miyano's troubles first start one hot summer day when Shuumei Sasaki steps into his life. Sasaki saves Miyano's classmate from a group of bullies, and after that, Miyano cannot seem to shake off his eccentric upperclassman. His silent admiration for Sasaki gradually sours into annoyance each time the so-called delinquent refuses to leave him alone. Constantly being called by cute nicknames and having his boundaries ignored, Miyano wonders why Sasaki wants to get close to him.

The shy and easily flustered Miyano harbors an embarrassing secret—he is a ""fudanshi,"" a boy who likes boys' love (BL) manga. The last thing he wants is for other students to find out, but through a slip of the tongue, he reveals the truth to Sasaki. Intrigued, the clueless Sasaki asks to borrow a book to read, which he is given very reluctantly. To Miyano's surprise, Sasaki enjoys the BL that he receives and asks for more, marking a shift in their strange dynamic.

Although Sasaki appears to possess some personal agenda, his feelings for Miyano become complicated the more time they spend together. As they now share a common interest, their relationship is poised to change and further develop.

[Written by MAL Rewrite]
","['Boys Love', 'Otaku Culture', 'School']"
9863,"At Kaimei High School there is a special club dedicated to helping others known as the SKET Brigade. The brains of the group is Kazuyoshi ""Switch"" Usui, a tech-savvy otaku who speaks through speech synthesis software, while the brawn is provided by Hime ""Himeko"" Onizuka, the hockey stick-wielding girl once known as ""Onihime.""  And last but not least, their leader is Yuusuke ""Bossun"" Fujisaki, whose latent ability is evoked by his goggles, allowing him to summon the awesome power of extraordinary concentration.  

However, most of the school only know them as the club that handles odd jobs. Many of their days are spent in the clubroom slacking off, but when there is something to be done, they give their all to help others—usually in sincere, but unintentionally hilarious, ways. The SKET Brigade do all they can to provide support, kindness, encouragement, and troubleshooting to any students crazy enough to ask for their services.  

[Written by MAL Rewrite]","['Comedy', 'School', 'Shounen']"
3091,"Kimihiro Watanuki's life was never really normal. But in addition to his ability to see spirits, this sequel to xxxHOLiC finds him still slaving away for Yuuko, the bizarre owner of a strange shop, who promised to rid him of this ability. However, this otherworldly woman can only do so when he has worked enough to earn his wish. Such is the way for anyone who finds their way into the shop to have their request granted: a compensation equal to their wish must be paid. 

In this odd shop that straddles the world of the living and the dead, Watanuki finds himself doing household chores for the seemingly lazy Yuuko and her companions, while also helping out clients. Along with his classmates, supposed romantic rival Shizuka Doumeki and his crush Himawari Kunogi, Watanuki deals with the many misfortunes surrounding Yuuko's customers, as well as those that closely follow him and his friends.

[Written by MAL Rewrite]","['Comedy', 'Drama', 'Mystery', 'Supernatural', 'Seinen']"
23847,"With the Volunteer Service Club now firmly established, it is receiving more requests from students in search of solutions to their various issues. However, the club members often struggle to see eye to eye when it comes to their problem-solving ideals. The suggestions that Hachiman Hikigaya recommends frequently clash with those of Yukino Yukinoshita, fracturing the relationships within the club. 

Despite their differences, with the trio constantly trying to find common ground, they may soon reach a point where they discover something genuine.

[Written by MAL Rewrite]
","['Comedy', 'Romance', 'Love Polygon', 'School']"
38003,"Following the conclusion of the three-way organizational war, government bureaucrat Ango Sakaguchi recalls an event that transpired years ago, after the death of the former Port Mafia boss. Osamu Dazai, still a new recruit at the time, was tasked with investigating rumors related to a mysterious explosion that decimated part of the city years ago—and its connection to the alleged reappearance of the former boss.

Due to circumstances out of his control, he is partnered with Chuuya Nakahara, the gifted yet impulsive leader of a rival clan known as the Sheep, to uncover the truth behind the case and shine a light on the myth of Arahabaki—the god of fire who might just lead Dazai to the case's solution.

Meanwhile, in the present day, it is business as usual once again for the Armed Detective Agency. Their peaceful break will not last for long, however, as enemies old and new gather their strength and prepare for another face-off.

[Written by MAL Rewrite]","['Action', 'Mystery', 'Adult Cast', 'Detective', 'Organized Crime', 'Super Power', 'Seinen']"
40052,"A series of unfortunate events has led Makoto Edamura to adopt the life of crime—pickpocketing and scamming others for a living. However, after swindling a seemingly clueless tourist, Makoto discovers that he was the one tricked and, to make matters worse, that the police are now after him. 

While making his escape, he runs into the tourist once again, who turns out to be a fellow con man named Laurent Thierry, and ends up following him to Los Angeles. In an attempt to defend his self-proclaimed title of ""Japan's Greatest Swindler,"" Makoto challenges his rival to determine the better scammer. Accepting the competition, Laurent drops them off outside a huge mansion and claims that their target will be the biggest mafia boss on the West Coast.

As Makoto becomes increasingly involved with the cunning Laurent, his colorful associates, and the world of international high-stakes fraud, he soon realizes that he got more than what he bargained for as his self-declared skills are continually put to the test.

[Written by MAL Rewrite]","['Action', 'Adventure', 'Mystery', 'Adult Cast', 'Organized Crime']"
