ID,Sypnosis,Genres
98,"While taking a ferry to Fuuka Academy, new students Mai Tokiha and her sickly younger brother, Takumi, spot a girl adrift on the water. Shortly after bringing her aboard, the ferry comes under attack from an assailant who summons a mechanical monster. Despite still recovering from her injuries, Mikoto Minagi fends off the monster using a supernatural sword.

Mai soon discovers that Mikoto is a fellow Fuuka Academy student with abilities called HiME (Highly-advanced Materializing Equipment). Female students with HiME are responsible for defending the academy and the local city from the monstrous ""Orphans."" After several incidents at the school involving battles against these mysterious creatures, Mai learns that she is a HiME herself and is capable of summoning a Child, a mechanical creature capable of great utility and firepower.

Now burdened with new responsibilities, Mai joins 12 other HiME as they safeguard the school from a threat they know little about all while protecting the ones closest to them.

[Written by MAL Rewrite]","['Action', 'Fantasy', 'Girls Love', 'Mahou Shoujo', 'School']"
36616,A summary episode of Mob Psycho 100 which features commentary from Reigen Arataka.,"['Action', 'Comedy', 'Supernatural']"
39705,Short anime specials included in the One Punch Man 2nd Season BD & DVD.,"['Action', 'Comedy', 'Adult Cast', 'Parody', 'Super Power', 'Seinen']"
527,"Pokémon are peculiar creatures with a vast array of different abilities and appearances; many people, known as Pokémon trainers, capture and train them, often with the intent of battling others. Young Satoshi has not only dreamed of becoming a Pokémon trainer but also a ""Pokémon Master,"" and on the arrival of his 10th birthday, he finally has a chance to make that dream a reality. Unfortunately for him, all three Pokémon available to beginning trainers have already been claimed and only Pikachu, a rebellious Electric-type Pokémon, remains. However, this chance encounter would mark the start of a lifelong friendship and an epic adventure!

Setting off on a journey to become the very best, Satoshi and Pikachu travel across beautiful, sprawling regions with their friends Kasumi, a Water-type trainer, and Takeshi, a Rock-type trainer. But danger lurks around every corner. The infamous Team Rocket is always nearby, seeking to steal powerful Pokémon through nefarious schemes. It'll be up to Satoshi and his friends to thwart their efforts as he also strives to earn the eight Pokémon Gym Badges he'll need to challenge the Pokémon League, and eventually claim the title of Pokémon Master. 

[Written by MAL Rewrite]","['Action', 'Adventure', 'Comedy', 'Fantasy', 'Kids']"
23281,"A year and a half after the events of the original sci-fi psychological thriller, Akane Tsunemori continues her work as an inspector—enforcing the Sibyl System's judgments. Joining her are new enforcers and junior inspector Mika Shimotsuki, a young woman blindly and inflexibly loyal to Sibyl. As Akane ponders both the nature of her job and the legitimacy of Sibyl's verdicts, a disturbing new menace emerges.

A mysterious figure has discovered a way to control the Crime Coefficient—a number compiled from mental scans that allows Sibyl to gauge psychological health and identify potential criminals. Through these means, he is able to murder an enforcer, leaving behind a cryptic clue: ""WC?"" scrawled in blood on a wall.

Akane and the rest of Division 01 soon find themselves playing a deadly game against their new foe, coming face-to-face with a conspiracy threatening not only the authority of the Sibyl System, but the very foundation of Akane's own convictions.

[Written by MAL Rewrite]","['Action', 'Mystery', 'Sci-Fi', 'Suspense', 'Adult Cast', 'Detective', 'Psychological']"
64,"Traumatized by school, Jun Sakurada spends his days at home as a shut-in, purchasing things online, only to send them back before the free trial period ends. So when a note appears on his desk, asking whether or not he would wind something, he assumes it was something he ordered and carelessly circles ""yes,"" changing his life forever.

A box arrives with a wind up doll inside, but this is no ordinary toy: after Jun winds her up, she begins walking and talking as if a normal person. With a haughty attitude, she introduces herself as Shinku, the fifth doll in the Rozen Maiden collection, a group of special dolls made by the legendary dollmaker Rozen. These sisters must battle each other in a competition called the Alice Game with the help of a human to ensure victory. The winner becomes Alice, a real girl who is worthy of meeting their creator.

As more sentient dolls end up taking residence in Jun's house, and a foe from Shinku's past makes her appearance, Jun's life becomes far more complicated than he ever thought possible.

[Written by MAL Rewrite]","['Action', 'Drama', 'Supernatural', 'Seinen']"
11433,"While testing out his camera on a bridge one summer night, Kaito Kirishima sees a blue light streaking across the sky, only to be blown off the railing seconds later. Just before succumbing to unconsciousness, a hand reaches down to grab ahold of his own. Dazed and confused, Kaito wakes up the next morning wondering how he ended up back in his own room with no apparent injuries or any recollection of the night before. As he proceeds with his normal school life, Kaito and his friends discuss what to do with his camera, finally deciding to make a film with it over their upcoming summer break. Noticing that Kaito has an interest in the new upperclassmen Ichika Takatsuki, his friend Tetsurou Ishigaki decides to invite her, as well as her friend Remon Yamano, to join them in their movie project.

In what becomes one of the most entertaining and exciting summers of their lives, Kaito and his friends find that their time spent together is not just about creating a film, but something much more meaningful that will force them to confront their true feelings and each other.

[Written by MAL Rewrite]","['Drama', 'Romance', 'Sci-Fi', 'Love Polygon']"
32071,"Death does not have to be the end; one can live again, but only through beating the game posed by the black ball called Gantz.

On his way home to celebrate his younger brother's birthday, brave and kind-hearted student named Masaru Katou is stabbed to death. He awakes in a small room with a cityscape view in the heart of Tokyo—and he is not alone. To his surprise, it is not the afterlife, but the waiting room for a high stakes game with their lives on the line. Before he has the chance to process the situation, Masaru is handed a gun and teleported into the center of Osaka to carry out one simple task: eliminate any alien on sight.

Accompanied by the aged Yoshikazu Suzuki, the stunning idol Reika Shimohira, and the cold but experienced Jouichirou Nishi, Masaru must overcome his fears in order to survive the game and return home to his waiting brother.

[Written by MAL Rewrite]","['Action', 'Drama', 'Horror', 'Sci-Fi', 'Suspense', 'Gore', 'High Stakes Game', 'Psychological', 'Survival', 'Seinen']"
10793,"On December 24, 2029—the day colloquially known as the ""Lost Christmas""—the Apocalypse Virus spread across Japan, bringing death to its citizens and plunging the country into utter chaos. In an effort to establish order, the United Nations sends the GHQ to assist with the crisis by containing the outbreak while removing all political autonomy in the process. A decade later, the country still lives under their control, unable to break free from their draconian rule.

Frustrated with the state of the nation, a resistance group named the Funeral Parlor aims to liberate Japan from the GHQ. Led by the charismatic Gai Tsutsugami, the group plots to steal a vial containing the ""Void Genome"" to further their goals. The vial falls into the hands of internet vocalist Inori Yuzuriha, who ends up being hunted by the GHQ's Anti-Bodies forces. Having nowhere to go, she seeks refuge in a warehouse where she meets Shuu Ouma—a socially awkward high school student who is a huge fan of her music.

Shuu gets dragged into the conflict the moment he rescues Inori, and the Void Genome shatters in his hand, granting him the ""Power of the Kings."" While learning how to control his grand new ability, Shuu must now fight to liberate Japan from its cruel oppressors.

[Written by MAL Rewrite]
","['Action', 'Drama', 'Sci-Fi', 'Mecha', 'Super Power']"
3652,"The infamous series of unexplainable murders in Hinamizawa have been solved and the chains of fate have broken due to the efforts of Rika Furude and her friends. Rika believes she has finally obtained the normal and peaceful life she desired with her friends; however, she is proven wrong when the wheels of fate begin turning once again after an unfortunate accident.

Rika suddenly finds herself in a ""perfect"" world, the constant cycle of brutal killings having never taken place, where all of her friends are content and satisfied. Not wanting to abandon the world that she fought so hard for, she learns she must destroy an essential ""key"" to get back. But can Rika abandon the faultless world she is given the chance to live in, after all of her battles have brought her this far?

[Written by MAL Rewrite]","['Horror', 'Mystery', 'Suspense', 'Gore', 'Psychological']"
16417,"Inside the Usagiyama Shopping District lies an eccentric but close-knit community of business owners. Tamako Kitashirakawa, a clumsy though adorable teenage girl, belongs to a family of mochi bakers who own a quaint shop called Tama-ya. One day, Tamako stumbles upon a talking bird that presents himself as royalty from a distant land. Dera Mochimazzi, as he calls himself, states that he’s seeking a bride for his country’s prince. Intent on his mission, Dera follows Tamako home and develops an addiction to mochi, becoming painfully overweight and subsequently unable to fly back to his homeland; thus, he takes up residence with Tamako's family and becomes the community’s beloved mascot.

Meanwhile, Tamako's friend, Mochizou Ooji, continues to hide his true feelings for her. Their fathers are fierce mochi rivals, but will it be enough to drive a wedge between Tamako and Mochizou? And just what will happen to Dera's task of finding his prince’s destined bride?

[Written by MAL Rewrite]","['Slice of Life', 'Iyashikei']"
11743,"In the scientifically advanced Academy City, a miracle is about to occur: the completion of the world's first space elevator, ""Endymion."" Meanwhile, a certain high school student, Touma Kamijou, and his companion Index are going about their daily lives when they encounter and befriend Arisa Meigo, a cheerful and ambitious singer. When strange occurrences begin taking place throughout the city, they lead to the discovery of an intricate plot surrounding Arisa and Endymion. Things only get more complicated when the Stiyl Magnus appears, signifying that the magical world is somehow involved too...

[Written by MAL Rewrite]","['Action', 'Fantasy', 'Sci-Fi', 'Super Power', 'Urban Fantasy']"
16011,"Onmyoudou magic was once a powerful technique used by the Japanese during the second World War in order for them to gain the upper hand and establish their nation as a formidable force. But Japan was quickly defeated after the revered onmyouji Yakou Tsuchimikado caused the ""Great Spiritual Disaster,"" an event which plagues Tokyo to this very day. As a result of this mishap, the Onmyou Agency was established in order to exorcise further spiritual disasters and combat the demons that would make their way into the world.

Now, Onmyoudou has become far more modern, simplified, and refined for use in a wide variety of applications such as medicine and technology. However, not everyone is able to utilize the magic, as is the case with Harutora, a member of the Tsuchimikado's branch family. Despite an old promise to protect Natsume, the heir of the Tsuchimikado's main family and Yakou's supposed reincarnation, as her familiar, Harutora has no talent and chooses to live a normal life instead. But when a prominent member of the Onmyou Agency attempts to recreate the same experiment which led to Japan's downfall, he decides to make good on his word and fight by Natsume's side.

[Written by MAL Rewrite]","['Action', 'Fantasy', 'Romance', 'School', 'Urban Fantasy']"
2596,"Strange things are happening around the town of Suiten. The daughter of a priest begins to see strange visions, spirits have started to roam the mountains, and Tarou Komori is having unsettling dreams. Due to the trauma of being kidnapped 11 years ago, he has repressed most of the memories that could shed light on what really happened. But they return in his sleep, combined with encounters beyond the realm of dreams.

As the supernatural and psychological collide, three children struggle to face their demons and repair the breach between the spiritual and corporeal worlds.

[Written by MAL Rewrite]
","['Mystery', 'Supernatural', 'Suspense', 'Psychological']"
14289,"Friends will only let you down—that is the sad truth Mei Tachibana lives with, ever since she was wrongfully blamed for the death of a class pet by her so-called friends in grade school. Since then, she has stayed away from people in order to avoid ever being hurt again. However, Mei's life begins to change drastically when a misunderstanding in high school causes her to encounter popular student Yamato Kurosawa.

Yamato finds her intriguing and insists on being her friend, even though Mei wants nothing to do with him. But when a dangerous situation ends with Yamato kissing Mei to save her from the unwanted attention of a stalker, Mei begins to develop feelings for him. On the heels of her discovery that their feelings are mutual, they start dating and she gains not only a boyfriend, but friends as well. Mei, however, finds it very hard to adapt to this new lifestyle, especially in expressing her true feelings towards Yamato.

Throughout misunderstandings of their new relationship, each other, and the attentions of other girls, Mei and Yamato slowly grow closer and learn the true meaning of those three little words: ""I love you.""

[Written by MAL Rewrite]","['Drama', 'Romance', 'School', 'Shoujo']"
19021,"Summary of the first season of the show, as seen from Rikka's perspective with new elements.","['Comedy', 'Romance', 'School']"
47159,"The king of Natra has fallen ill, leaving the only hope for his kingdom to his son, Prince Wein Salema Arbalest. Known to be capable and wise, he is the perfect candidate to become the prince regent. However, if the prince has anything to say about the matter, he would rather sell off the Kingdom of Natra to the highest bidder!

Since he wields the authority of the throne, no one can stop Wein from auctioning off the country and using the profits to retire in comfort. All he needs to do is raise the value of the small kingdom to maximize his gains. But whether Wein's grand plan will succeed remains to be seen, as his wit often surpasses even his own expectations—much to the benefit of the oblivious citizens of Natra.

[Written by MAL Rewrite]
","['Comedy', 'Fantasy']"
1840,"Revered as heroes for their role in defending Tristain, Louise Françoise and her familiar Saito Hiraga face heavy pressure to continue protecting the Kingdom. With an uneasy peace now established within Albion, the newly crowned Queen Henrietta must deal with a political struggle brewing on the horizon. To make matters worse, a new villain has begun plotting in the shadows against the Crown.

With the continuing threats that face the Kingdom, Louise and Saito are compelled to work together once more. No longer ""Louise the Zero,"" the young mage's newfound aptitude for Void magic gives her enough power to wipe out an entire village; however, wielding these abilities comes with its share of challenges. As more conflicts arise, the idea of placing honor above oneself is put into question—regardless of their answer, their only choice is to see it through until the end.

[Written by MAL Rewrite]","['Action', 'Adventure', 'Comedy', 'Fantasy', 'Romance', 'Ecchi', 'Harem', 'Isekai', 'School']"
3731,"When her newly-built home is razed to the ground by an earthquake, low-achieving, clumsy, and troublesome third-year high school student Kotoko Aihara is forced to share a roof with the school's—and possibly Japan's—smartest student, Naoki Irie. Kotoko is not actually a complete stranger to Irie-kun; unfortunately, a single love letter that she tried to give him in the past has already sealed her fate as far as he is concerned. Throw in some quirky friends and a meddlesome mother, and Kotoko might not even have a snowball's chance in hell of winning the older Irie boy's heart. Yet Kotoko remains optimistic that, because she now lives in his house, her unattainable crush on the genius since the beginning of high school has never been more within reach.

[Written by MAL Rewrite]","['Comedy', 'Romance', 'School', 'Shoujo']"
48643,"Fudou Aikawa and Desumi Magahara have just started dating, but no one is allowed to know! Nicknamed ""Red Gelato,"" Fudou is the leader of ""Gelato 5,"" a group of heroes dedicated to protecting Japan. On the other hand, the ""Reaper Princess"" Desumi is one of the combatant leaders of ""Gekko,"" an evil secret society bent on world domination and considered Gelato 5's greatest foe. As they pretend to be mortal enemies, Fudou and Desumi sneak away from battle to spend time together.

Despite their inexperience with romance, Fudou and Desumi strive to make their relationship work while avoiding suspicion from their comrades. With their loyalties divided between each other and their respective sides, the couple will have to stay on guard if they want to keep their love a secret from the rest of the world.

[Written by MAL Rewrite]
","['Action', 'Comedy', 'Fantasy', 'Romance', 'Parody', 'Urban Fantasy', 'Shounen']"
9136,"According to the Kuroshitsuji website, there are 6 OVAs included in the DVD releases.

DVD 2: Ciel in Wonderland (Part 1)
This re-imagines the cast of Kuroshitsuji II as characters in Lewis Carroll's Alice in Wonderland story.

DVD 3: Welcome to the Phantomhive's
This is meant to be like a simulation game. Elizabeth invites a lady (perhaps the viewer) to join her at a ball held at the Phantomhive mansion.

DVD 5: The Making of Kuroshitsuji II
This is a Hollywood style documentary with behind the scenes interviews with Sebastian, Ciel, Claude and Alois etc.

DVD 6: Ciel in Wonderland (Part 2)
This re-imagines the cast of Kuroshitsuji II as characters in Lewis Carroll's Alice in Wonderland story.

DVD 8: The Tale of William the Shinigami
William and Grell have to train new shinigami and reminisce about when they were training partners.

DVD 9: The Spider's Intention
The life in Trancy household and how those work under Alois is caring for him.","['Comedy', 'Supernatural', 'Parody', 'Shounen']"
32526,"Chika Takami, a self-proclaimed normal girl, has never been involved in any clubs and lacked any notable talents. However, after a visit to Tokyo, she discovers a stage where even an ordinary girl like her could shine—the world of school idols. Inspired by the former superstar school idol group μ's, Chika is determined to start her own school idol club in her seaside hometown at Uranohoshi Girl's High School. But even before gathering any students to join the group, the aspiring school idol finds her greatest obstacle to be student council president Dia Kurosawa who stands firmly against the creation of the club.

Just when it seems there is no hope, Chika meets Riko Sakurauchi, a transfer student from Otonokizaka High School, home of μ's. Somewhat shy but a talented piano player, Chika believes her to be a promising recruit, though convincing her to join is easier said than done. In spite of that, Chika chooses to charge forward and overcome the obstacles keeping her from forming a school idol group that shines as bright as the nine that came before her.

[Written by MAL Rewrite]","['Slice of Life', 'Idols (Female)', 'Music', 'School']"
48483,"Miko Yotsuya's eyes water as she fixates on a single spot on her phone—she ignores yet another dreadful, horrific monster that is in her face, uttering the disturbing words: ""Can you see me?"" Before now, Miko enjoyed her unassuming high school days, with late-night horror shows serving only as a form of entertainment. But ever since one fateful day, she is the only person aware of the invisible monsters walking freely among humans.

Courageously, Miko makes a bold decision: she will never, under any condition, acknowledge the presence of the horrid specters. However, even though she pretends they do not exist, she can still see how they disturb the people around her, especially her best friend, the energetic and lovely Hana Yurikawa. In order to protect them from the monsters' annoyances, Miko gives it her best to continue her school life and avoid every troublesome crisis—even when they scare her to tears. 

[Written by MAL Rewrite]","['Comedy', 'Horror', 'School']"
10620,"Yukiteru Amano is a shy middle schooler who regularly keeps track of what he does in his daily life by writing down all of his activities on his phone—a digital diary. Despite having no friends at school, Yukiteru is frequently seen talking to his supposedly imaginary friends Deus Ex Machina, the god of time and space; and Deus' servant, Mur Mur.

One day, Yukiteru wakes up and discovers that certain events of his day are preemptively displayed on his cellphone. While initially dismissing it as a coincidence, he slowly realizes that the incidents written in his phone actually take place in the near future. After spending the day benefiting from this new asset, Yukiteru learns that his classmate Yuno Gasai possesses a similar diary.

As the two team up to defeat an odd pursuer and head back to their respective homes, Deus Ex Machina explains that they—alongside 10 other contestants—have been drawn into a survival game whose victor will become the deity's successor. With no other options, Yukiteru and Yuno must use their cellphones—now called ""Future Diaries""—to survive this unforgiving battle royale.

[Written by MAL Rewrite]
","['Action', 'Supernatural', 'Suspense', 'Gore', 'High Stakes Game', 'Psychological', 'Survival', 'Shounen']"
50854,"Despite being a handyman with a wide range of skills, Saitou is severely undervalued and underpaid. When he complains, his boss fires him, claiming that he is easily replaceable. As if his luck was not bad enough, Saitou soon finds himself about to be run over by a truck on his way home.

Surprisingly enough, Saitou does not die; instead, he is transported to another world. There, he meets a party composed of the female knight Raelza, the moonlight fairy Lafanpan, and the mage Morlock, who are all coincidentally looking to recruit a new member with a skill set like Saitou's.

Throughout their time together, Saitou uses his expertise to assist his fellow party members and soon comes to receive the recognition he never thought was possible. However, Saitou's presence may just be the catalyst that will connect a diverse cast of people from different places, slowly uncovering the fate that could bring a great change to this world.

[Written by MAL Rewrite]","['Adventure', 'Comedy', 'Fantasy', 'Isekai']"
40904,"Life is not going well for 28-year-old Kyouya Hashiba. Having left his office job to pursue a career in the video game industry, his internship at a popular game studio abruptly ends, leaving him unemployed and forcing him to move back in with his parents. Additionally, his jealousy toward the success of the ""Platinum Generation""—a group of similarly-aged creators—has caused him to regret his decision to attend a traditional university instead of an arts college. Even though he believes there are no second chances in life, Kyouya is suddenly given one when he wakes up one day and finds himself 10 years in the past.

Instead of choosing business school like he originally had, Kyouya decides to pursue his passions and attends the Oonaka University of Art. There, he meets classmate Eiko Kawasegawa, the woman who had hired him as an intern in the present, alongside his new housemates and future Platinum Generation members: underachieving artist Aki Shino, aspiring singer and actress Nanako Kogure, and naturally-gifted writer Tsurayuki Rokuonji.

With each project they complete together, Kyouya and his friends venture closer to discovering their true potential as creators and remaking their lives into the ideal versions they desire.

[Written by MAL Rewrite]","['Drama', 'Romance', 'Adult Cast', 'Time Travel']"
59,"When computers start to look like humans, can love remain the same?

Hideki Motosuwa is a young country boy who is studying hard to get into college. Coming from a poor background, he can barely afford the expenses, let alone the newest fad: Persocoms, personal computers that look exactly like human beings. One evening while walking home, he finds an abandoned Persocom. After taking her home and managing to activate her, she seems to be defective, as she can only say one word, ""Chii,"" which eventually becomes her name. Unlike other Persocoms, however, Chii cannot download information onto her hard drive, so Hideki decides to teach her about the world the old-fashioned way, while studying for his college entrance exams at the same time.

Along with his friends, Hideki tries to unravel the mystery of Chii, who may be a ""Chobit,"" an urban legend about special units that have real human emotions and thoughts, and love toward their owner. But can romance flourish between a Persocom and a human? 

[Written by MAL Rewrite]","['Comedy', 'Drama', 'Romance', 'Sci-Fi', 'Ecchi', 'Seinen']"
