ID,Sypnosis,Genres
53149,"Violence, name-calling, and humiliation are a daily reality for high school student Park Hyung Suk. Chubby and insecure, he is often used as a plaything and punching bag for bullies, which leads him to wish he could just disappear. Unexpectedly, when he transfers schools in the hopes of starting anew, a miraculous opportunity emerges: he awakens in a tall, handsome, and strangely athletic body. Hyung Suk quickly realizes that he is now the owner of two disparate bodies; when one falls asleep, he wakes up in the other.

Feeling like he has won the lottery of life, Hyung Suk enters his new school as this attractive and strong young man. However, it soon becomes evident that being a popular student is not all smooth sailing. From girls wanting him only for his good looks to delinquents picking fights out of jealousy, he can never seem to escape trouble. In trying to balance his two different lives, Hyung Suk may find both of them to be sources of ceaseless challenges.

[Written by MAL Rewrite]","['Action', 'Drama', 'Supernatural', 'School']"
8476,"Second Lieutenant Kei Agemaki, the son of a famous general, has hidden his extreme fear of paranormal beings all his life. However, when he and two others are reassigned to live and work with youkai in the Ministry of Spirit Affairs, he is brought face-to-face with his worst nightmare. Now with the help of the fox spirit Kushimatsu, he and his fellow officers must learn to work alongside youkai maidens—Zakuro, Susukihotaru, Hoozuki, and Bonbori—to solve paranormal cases.

Set in the midst of an alternate version of Japanese Westernization, Otome Youkai Zakuro explores the clashes and unions that can occur when east meets west, local meets foreign, and women meet men. The unusual alliance of the youkai maidens and human officers must learn to work together in a world that is changing around them.

[Written by MAL Rewrite]","['Romance', 'Supernatural', 'Historical', 'Military', 'Mythology', 'Seinen']"
30296,"There exist few humans in this world with the ability to manipulate their souls to form powerful weapons. Dubbed ""Blazers,"" these people study and train at the prestigious Hagun Academy to become Mage-Knights; among the students is so-called failure Ikki Kurogane, the sole F-rated Blazer. However, when the worst student in the academy sees Stella Vermillion, an A-ranked Blazer who also happens to be a princess, naked, she challenges him to a duel with dire stakes—the loser becomes the slave of the winner. There's no possible way that Stella can lose, right?

As he tries to prove his strength to a world that believes him to be the weakest, Ikki gains new friends, wisdom, and experience.

[Written by MAL Rewrite]","['Action', 'Fantasy', 'Romance', 'Ecchi', 'School', 'Urban Fantasy']"
2889,"Assigned to protect a royal procession transporting a powerful artifact called the ""Ouin,"" Squad 10 gathers in the human world as Captain Toushirou Hitsugaya and Lieutenant Rangiku Matsumoto observe the area cautiously. However, the caravan is suddenly struck by a group of assailants who wreak havoc on the procession, stealing the Ouin in the process. After a brief clash with one of the attackers, the distraught Hitsugaya pursues the escaping thieves, leaving behind Matsumoto and the disoriented squad. Following the incident, the Seireitei brands Hitsugaya a traitor for abandoning his post and puts Squad 10 on indefinite lockdown.

In the human world, Ichigo Kurosaki is investigating a spiritual abnormality when he stumbles across the injured Captain, but is caught off guard when Hitsugaya suddenly flees. Soon learning of the situation, Ichigo, Rukia Kuchiki, Renji Abarai, and Matsumoto set off to prove Hitsugaya's innocence and uncover the truth behind the theft of the Ouin. Meanwhile, a ghost from Hitsugaya's past haunts his thoughts as he chases down the true culprit.

[Written by MAL Rewrite]","['Action', 'Adventure', 'Supernatural', 'Shounen']"
6573,"One night, as meteors streak across the star-studded sky, Shion Pavlichenko becomes a Contractor. Despite her brother's transformation, Shion's twin sister Suou continues to live a fairly ordinary life, attending middle school with her friends and getting caught up in the awkwardness of growing up. However, everything changes when her home is invaded by a masked man cloaked in black, destroying any sense of normality she once had. Revealed to possess latent Contractor abilities of her own, Suou is caught between family, friends, and her own sense of purpose as she ventures into the ruthless world of cutthroats and espionage that Contractors call home.

Meanwhile in Tokyo, investigation surrounding Hell's Gate's sudden collapse is underway, and prophetic signs of doom point in the direction of a silver-haired doll.

[Written by MAL Rewrite]","['Action', 'Mystery', 'Sci-Fi', 'Super Power']"
32696,"The start of Hanae Ashiya's high school career has not been easy—he has spent all of the first week in the infirmary, and his inexplicable condition is only getting worse. The cause of his torment is the mysterious fuzzy creature that has attached itself to him ever since he stumbled upon it the day before school began.

As his health continues to decline and the creature grows in size, Hanae comes across a flyer advertising an exorcist who expels youkai. Desperate and with nothing left to lose, he calls the number and is led to the Mononokean, a tea room which suddenly appears next to the infirmary. A morose-sounding man, Haruitsuki Abeno, reluctantly helps Hanae but demands payment afterward. Much to Hanae's dismay, he cannot afford the fee and must become an employee at the Mononokean to work off his debt. And to make things worse, his new boss is actually one of his classmates. If Hanae ever hopes to settle his debt, he must work together with Abeno to guide a variety of dangerous, strange, and interesting youkai back to the Underworld.

[Written by MAL Rewrite]","['Comedy', 'Supernatural', 'Mythology']"
37349,"Goblins are known for their ferocity, cunning, and rapid reproduction, but their reputation as the lowliest of monsters causes their threat to be overlooked. Raiding rural civilizations to kidnap females of other species for breeding, these vile creatures are free to continue their onslaught as adventurers turn a blind eye in favor of more rewarding assignments with larger bounties.

To commemorate her first day as a Porcelain-ranked adventurer, the 15-year-old Priestess joins a band of young, enthusiastic rookies to investigate a tribe of goblins responsible for the disappearance of several village women. Unprepared and inexperienced, the group soon faces its inevitable demise from an ambush while exploring a cave. With no one else left standing, the terrified Priestess accepts her fate—until the Goblin Slayer unexpectedly appears to not only rescue her with little effort, but destroy the entire goblin nest. 

As a holder of the prestigious Silver rank, the Goblin Slayer allows her to accompany him as he assists the Adventurer's Guild in all goblin-related matters. Together with the Priestess, High Elf, Dwarf, and Lizardman, the armored warrior will not rest until every single goblin in the frontier lands has been eradicated for good.

[Written by MAL Rewrite]","['Action', 'Adventure', 'Fantasy', 'Gore']"
14753,"Within everyone there exists a side preferably kept hidden, even from close friends. For the smart and popular Kyouko Hori, it's the fact that she has to do all the housework and care for her little brother, Souta, because of her parents' busy work schedules. For the gentle Izumi Miyamura, whom everybody sees as an otaku, it's his nine hidden piercings and large body tattoo.

So what happens when they accidentally discover each other's hidden sides? Sharing parts of themselves that they couldn't with anyone else, strong bonds of friendship soon begin to form between Miyamura and Hori, as well as those around them. As their hidden personas start to dissipate, they slowly learn how to open up to others.

[Written by MAL Rewrite]","['Romance', 'School']"
14837,"Following the defeat of a great adversary, Gokuu Son and his friends live peaceful lives on Earth. Meanwhile, in space, Beerus the God of Destruction awakens from his long slumber, having dreamed of an entity known as a Super Saiyan God. With the help of his assistant, Whis, Beerus looks for this powerful being, as he wishes to fight a worthy opponent. After discovering that the Saiyan home planet was destroyed, he tracks down the remaining Saiyans on Earth, looking for Gokuu specifically.

Having only heard of the Super Saiyan God in legends, Gokuu and his comrades summon Shen Long the Eternal Dragon, who they find out is afraid of Beerus. After learning the secret of the Super Saiyan God, an intense battle between Gokuu and Beerus commences, the immense power of which puts the Earth in terrible danger.

[Written by MAL Rewrite]","['Action', 'Adventure', 'Fantasy', 'Martial Arts', 'Shounen']"
25183,"Nicholas Brown and Worick Arcangelo, known in the city of Ergastalum as the ""Handymen,"" are mercenaries for hire who take on jobs no one else can handle. Contracted by powerful mob syndicates and police alike, the Handymen have to be ready and willing for anything. After completing the order of killing a local pimp, the Handymen add Alex Benedetto—a prostitute also designated for elimination—to their ranks to protect her from forces that want her gone from the decrepit hellhole of a city she has come to call home. However, this criminal’s paradise is undergoing a profound period of change that threatens to corrode the delicate balance of power.

Ergastalum was once a safe haven for ""Twilights,"" super-human beings born as the result of a special drug but are now being hunted down by a fierce underground organization. This new threat is rising up to challenge everything the city stands for, and the Handymen will not be able to avoid this coming war.

[Written by MAL Rewrite]","['Action', 'Drama', 'Adult Cast', 'Organized Crime', 'Seinen']"
24703,"The Red Dragon Emperor, Issei Hyoudou, and the Occult Research Club are back in action as summer break comes for the students of Kuoh Academy. After their fight with Issei’s sworn enemy, Vali and the Chaos Brigade, it is clear just how inexperienced Rias Gremory's team is. As a result, she and Azazel lead the club on an intense training regime in the Underworld to prepare them for the challenges that lie ahead.

While they slowly mature as a team, Issei will once again find himself in intimate situations with the girls of the Occult Research Club. Meanwhile, their adversaries grow stronger and more numerous as they rally their forces. And with the sudden appearance of Loki, the Evil God of Norse Mythology, the stage is set for epic fights and wickedly powerful devils in High School DxD BorN!

[Written by MAL Rewrite]","['Action', 'Comedy', 'Romance', 'Supernatural', 'Ecchi', 'Harem', 'Mythology', 'School']"
32215,Unaired anime episode bundled with the limited edition of High School DxD DX.2.,"['Action', 'Comedy', 'Romance', 'Supernatural', 'Ecchi', 'Harem', 'Mythology', 'School']"
19285,Recap of the events in Shingeki no Kyojin that happened prior to episode 14.,"['Action', 'Drama', 'Suspense', 'Gore', 'Survival', 'Shounen']"
8557,"Humans have been polluting the ocean for a long time, carelessly pouring their garbage and desecrating the waters that many creatures call home. The denizens of the sea have suffered at their poisoning hands. Finally, one certain squid has had enough and vows to punish the humans' selfish actions.

Possessing all the fearsome abilities of a squid such as powerful hair-tentacles, the ability to spit ink, and even use bioluminescence at will, Ika Musume takes it upon herself to rise from the depths of the ocean and exact revenge upon humanity! She surfaces at a certain Lemon Beach House, a restaurant managed by the sisters Eiko and Chizuru Aizawa. Thinking them to be an easy first step toward world domination, she immediately declares war against them, only to find out that she is, quite literally, a fish out of water! To make things worse, she destroys a part of a wall of the beach house in an attempt to flaunt her squiddy superiority and is consequently forced into becoming a waitress to pay the repair costs. Beached for the time being after tasting a thorough defeat at the hands of the Aizawa sisters, Ika Musume is forced to put her plans for world domination on hold.

Despite these setbacks, Ika Musume soon finds herself right at home in her unexpected position as Lemon Beach House's newest employee. Wacky and hilarious, Shinryaku! Ika Musume follows her brand new life on the surface as she makes precious memories and meet lots of new people. With her newfound acquaintances, Ika Musume is looking to take the world by storm, one squid ink spaghetti at a time!

[Written by MAL Rewrite]","['Comedy', 'Anthropomorphic', 'Shounen']"
2923,"Amu Hinamori is a shy girl who struggles to make friends in part due to the rumors spread around school about her ""cool and spicy"" personality. Wishing that she could show everyone her ""would-be"" self, Amu wakes up to the presence of three colorful and ornately decorated eggs in her bed. Each of these ""Hearts Eggs"" houses a ""Guardian Character""—manifestations of someone's would-be self and their dreams. With the aid of Ran, Miki, and Su, Amu now finds herself able to express who she truly is. However, things do not always pan out in her favor.

The sudden appearance of Amu's Guardian Characters prompts the Seiyo Elementary Guardians, a student council-like group with each member possessing their own Guardian Character, to take notice of her. As someone who has multiple Characters, Amu is roped into being the Guardians' ""Joker,"" tasked with helping them find X Eggs—corrupted versions of one's Hearts Egg. 

As she becomes entangled in the Guardians' quest, Amu begins to uncover more about these mysterious Characters, the X Eggs, and the organization that seems to be at the center of it all.

[Written by MAL Rewrite]","['Comedy', 'Mahou Shoujo', 'School', 'Shoujo']"
3974,"While pursuing an alien fugitive, Birdy Cephon Altera—a bombastic police officer from the Space Federation—finds herself on Earth. Her target, Geega, has disguised himself as a human and assimilated into the fashion industry, so Birdy follows suit and joins a modeling agency, taking on the identity ""Shion Arita."" Her position as a rising model has her posing for photo shoots by day and chasing intergalactic criminals by night.

Meanwhile, Tsutomu Senkawa, an average high school student, explores an abandoned building with his friend, and coincidentally, Birdy has tracked down Geega to the same building. Senkawa briefly witnesses the battle before being seized as a hostage by Geega. However, Birdy, oblivious, attacks Geega and accidentally kills Senkawa. Distraught, she quickly decides to save him by integrating his consciousness into her body.

Now, Birdy and Senkawa must not only cohabitate the same body, but also balance Senkawa's high school life, Shion Arita's modeling career, and Birdy's increasingly dangerous job as a Federation officer.

[Written by MAL Rewrite]","['Action', 'Comedy', 'Sci-Fi', 'Seinen']"
13663,"As close encounters of the twisted kind between the residents of the planet Deviluke (represented primarily by the female members of the royal family) and the inhabitants of Earth (represented mainly by one very exhausted Rito Yuuki) continue to escalate, the situation spirals even further out of control. When junior princesses Nana and Momo transferred into Earth School where big sister Lala can (theoretically) keep an eye on them, things SHOULD be smooth sailing. But when Momo decides she'd like to ""supplement"" Rito's relationship with Lala with a little ""sisterly love,"" you know Lala's not going to waste any time splitting harems. Unfortunately, it's just about that point that Yami, the Golden Darkness, enters the scene with all the subtleness of a supernova, along with an army of possessed high school students! All of which is certain to make Rito's life suck more than a black hole at the family picnic. Unless, of course, a certain semi-demonic princess can apply a little of her Devilukean Whoop Ass to exactly that portion of certain other heavenly bodies!

(Source: Sentai Filmworks) ","['Comedy', 'Romance', 'Sci-Fi', 'Ecchi', 'Harem', 'School', 'Shounen']"
39469,"When ""ordinary boy"" Kagami Kazuya meets the beautiful tsukumogami Kiriha, his life gets turned upside-down. As a ""Taboo Child"" who draws the supernatural towards him, he receives orders from the God of the Land, Kukuri, to become an exorcist and defeat these evil forces. And so, he and Kiriha do battle.

To find out information on these supernatural beings, Kazuya and his friends set up a counselor's club at school. But behind the typical-seeming troubles he hears about, he uncovers a major plot to target Kukuri...

In addition to the sadistic-yet-beautiful tsukumogami Kiriha, the situation draws other girls to Kazuya to join the fray!

(Source: Crunchyroll)","['Action', 'Comedy', 'Supernatural', 'Ecchi', 'Harem', 'Mythology', 'School']"
50710,"When aliens known as the Oni threaten to invade the Earth, they promise to leave under one condition—a randomly-chosen human must win a one-on-one game of tag against Lum, the beautiful daughter of the Oni leader. The ""lucky"" person selected happens to be the lustful and unlucky high schooler Ataru Moroboshi. Given 10 days to attempt to grab Lum's horns, Ataru realizes how impossible the challenge is as he is faced with Lum's extraterrestrial powers.

Motivated by a promise of marriage from his childhood friend Shinobu Miyake, Ataru manages to catch Lum off guard. He mistakenly grabs hold of her bikini top first, but he eventually achieves his true goal. Although the game is over, Lum misunderstands that she is the one whom Ataru wants to marry, and she decides to move in with him. The poor student constantly tries to shake off the clingy Lum while doing his best to reconcile with his desired fiancée. After Ataru's heroic feat results in such a disastrous outcome, it is questionable whether luck will ever be on his side.

[Written by MAL Rewrite]","['Comedy', 'Romance', 'Sci-Fi', 'Shounen']"
33094,"Daisuke Higashida is a serious first-year student at Higashizaka High School. He lives a peaceful everyday life even though he is not satisfied with the family who doesn't laugh at all and makes him tired. However, his father's company goes bankrupt one day, and he can no longer afford allowances, cellphone bills, and commuter tickets. When his father orders him to take up a part-time job, Daisuke decides to work at a nearby family restaurant in order to avoid traveling 15 kilometers to school by bicycle.","['Comedy', 'Workplace']"
34012,"Western Restaurant Nekoya is a popular eatery located on a street corner in a Tokyo shopping district. Serving both traditional Japanese fare as well as Western dishes, this eating establishment is popular among Tokyo's residents. But this seemingly ordinary restaurant is also popular with another type of clientele...

While the restaurant is thought to be closed on Saturdays, the truth is that on this special day each week, its doors are instead opened to the inhabitants of other worlds. From dragons and elves to fairies and mages, this restaurant has no shortage of strange customers. Nevertheless, the enigmatic chef known only as ""Master"" will be waiting to serve up their favorite dishes with a kind smile and keep them coming back for many more Saturdays to come. 

[Written by MAL Rewrite]","['Fantasy', 'Gourmet', 'Slice of Life', 'Isekai', 'Workplace']"
76,"Nanoha Takamachi, an ordinary third-grader who enjoys spending time with her family and friends, rescues an injured ferret that she had dreamed about the night before. The next day, the ferret cries out to her telepathically, asking Nanoha to save him. The ferret reveals himself to be Yuuno Scrya, a mage from another world who is trying to collect the dangerous 21 Jewel Seeds that he accidentally scattered across the world. He enlists Nanoha's help, gifting her the magical wand Raising Heart, and teaches her how to become a powerful mage.

Days later, after reclaiming a few of the Jewel Seeds, another mage appears: Fate Testarossa. Stronger than Nanoha, Fate refuses to divulge her reasons in trying to collect the Jewel Seeds. Nanoha senses a melancholy in her eyes, but Fate refuses to communicate. Directed by Akiyuki Shinbo, Mahou Shoujo Lyrical Nanoha is a story about the clash of emotions when goals collide.

[Written by MAL Rewrite]","['Action', 'Comedy', 'Drama', 'Mahou Shoujo']"
35078,"Residing within Tokyo's district of Ueno are the Colors, three individuals who protect their city by performing good deeds and aiding their community. Or, at the very least, they pretend to be the city's defenders. In reality, the Colors are just three young girls: the shy Yui Akamatsu, the noisy Sacchan, and the video game-loving Kotoha, who spend their time playing make-believe and exploring the city. The Colors' activities are facilitated by the grandfatherly Daigorou ""Pops"" Kujiraoka, who uses his store's inventory of knick-knacks to entertain the rambunctious trio.

Not everyone is a fan of the Colors though. The local policeman Saitou just wants to deal with his regular duties, but he often finds himself the target of the Colors' attention, having been made the villain in most of their fantasies. But despite his personal feelings, Saitou always finds the time to go along with the three girls' games. Even though the Colors do not actually defend Ueno, they definitely help brighten everyone's day.

[Written by MAL Rewrite]","['Slice of Life', 'CGDCT', 'Iyashikei', 'Shounen']"
15315,"Izayoi Sakamaki, Asuka Kudou, and You Kasukabe are extraordinary teenagers who are blessed with psychic powers but completely fed up with their disproportionately mundane lives—until, unexpectedly, each of them receives a strange envelope containing an invitation to a mysterious place known as Little Garden. 

Inexplicably dropped into a vast new world, the trio is greeted by Kurousagi, who explains that they have been given a once-in-a-lifetime chance to participate in special high-stakes games using their abilities. In order to take part, however, they must first join a community. Learning that Kurousagi's community ""No Names"" has lost its official status and bountiful land due to their defeat at the hands of a demon lord, the group sets off to help reclaim their new home's dignity, eager to protect its residents and explore the excitement that Little Garden has to offer.

[Written by MAL Rewrite]","['Action', 'Comedy', 'Fantasy', 'Isekai', 'Mythology']"
1579,"Seiso Academy is a prestigious high school that sorts students into two majors: General Studies, characterized by distinct grey uniforms, and Music Studies, characterized by pristine white uniforms. While rushing to class one morning, General Studies student Kahoko Hino has a chance encounter with Lili, a small fairy searching for someone with the ability to see her. Lili flies away, and Kahoko, puzzled by their meeting, continues on her way.

Later that day, the participants of a school-wide music competition are announced, and all of them are, unsurprisingly, Music Studies students—at least until Kahoko's name is read out. Immediately tracking down Lili, the small fairy gifts Kahoko a magical violin and convinces her to participate in the competition.

Kiniro no Corda: Primo Passo follows Kahoko's endeavors alongside Lili, as the young student must now face the challenges of competition and go head-to-head against her competitors while navigating a new world of classical music.

[Written by MAL Rewrite]","['Romance', 'Music', 'Reverse Harem', 'School', 'Josei']"
15051,"Otonokizaka High School is in a crisis! With the number of enrolling students dropping lower and lower every year, the school is set to shut down after its current first years graduate. However, second year Honoka Kousaka refuses to let it go without a fight. Searching for a solution, she comes across popular school idol group A-RISE and sets out to create a school idol group of her own. With the help of her childhood friends Umi Sonoda and Kotori Minami, Honoka forms μ's (pronounced ""muse"") to boost awareness and popularity of her school.

Unfortunately, it's all easier said than done. Student council president Eri Ayase vehemently opposes the establishment of a school idol group and will do anything in her power to prevent its creation. Moreover, Honoka and her friends have trouble attracting any additional members. But the Love Live, a competition to determine the best and most beloved school idol groups in Japan, can help them gain the attention they desperately need. With the contest fast approaching, Honoka must act quickly and diligently to try and bring together a school idol group and win the Love Live in order to save Otonokizaka High School.

[Written by MAL Rewrite]","['Slice of Life', 'Idols (Female)', 'Music', 'School']"
