ID,Sypnosis,Genres
34103,"The Future Foundation is in shambles after the Final Killing Game and the revelation of the true culprit. As a desperate plot arises from one of the survivors to rid the world of despair once and for all, the remaining Future Foundation members must band together to stop this atrocity from taking place. Fortunately, they find themselves with help from a group of unlikely allies as they race against the clock to stop their world from being changed.

In this finale to the Hope's Peak storyline of the Danganronpa series, the players in this neverending death game begin to understand the true meaning behind despair, hope, and atonement.

[Written by MAL Rewrite]","['Action', 'Horror', 'Mystery', 'Suspense', 'High Stakes Game', 'Psychological', 'Survival']"
6922,"In Fuyuki City, the Fifth Holy Grail War is about to commence a lengthy battle of blood, death, and misery. High school student Rin Toosaka has trained her entire life for this moment—to become a magus capable of being a Master in the war. Summoning her Servant known as Archer, Rin finally sets foot into the battle.

Discovering that one of her acquaintances, Shirou Emiya, is drawn into the war as well, Rin offers to form an alliance for the time being. And as the two of them grow closer, Rin begins to learn more about Shirou's fate and ideals. Nevertheless, her goal remains the same: to win the all-powerful relic that can fulfill the wishes of those who are victorious after the war—the Holy Grail.

[Written by MAL Rewrite]
","['Action', 'Fantasy', 'Urban Fantasy']"
31580,"Mysterious immortal humans known as ""Ajin"" first appeared 17 years ago in Africa. Upon their discovery, they were labeled as a threat to mankind, as they might use their powers for evil and were incapable of being destroyed. Since then, whenever an Ajin is found within society, they are to be arrested and taken into custody immediately.

Studying hard to become a doctor, Kei Nagai is a high schooler who knows very little about Ajin, only having seen them appear in the news every now and then. Students are taught that these creatures are not considered to be human, but Kei doesn't pay much attention in class. As a result, his perilously little grasp on this subject proves to be completely irrelevant when he survives an accident that was supposed to claim his life, signaling his rebirth as an Ajin and the start of his days of torment. However, as he finds himself alone on the run from the entire world, Kei soon realizes that more of his species may be a lot closer than he thinks.

[Written by MAL Rewrite]","['Action', 'Horror', 'Mystery', 'Supernatural', 'Gore', 'Seinen']"
22729,"The discovery of a hypergate on the Moon once allowed the human race to teleport to Mars. Those who chose to settle there unearthed a technology far more advanced than that of their home planet, which they named ""Aldnoah."" This discovery led to the founding of the Vers Empire of Mars and a declaration of war against the ""Terrans,"" those who stayed behind on Earth. However, a battle on the moon—later called ""Heaven's Fall""—caused the hypergate to explode, destroying the moon and leading the two planets to establish an uneasy ceasefire.

Their peace was a fragile one, however. Fifteen years later, high school student Inaho Kaizuka witnesses the plotted assassination of the Vers Empire's Princess Asseylum Vers Allusia, who had come to Earth in hopes of repairing the relationship between the empire and its homeland. The ceasefire is shattered, and the Martians declare war on the Terrans once again. In the face of this insurmountable enemy, Inaho and his friends must now fight against the Vers Empire to settle the war once and for all.

[Written by MAL Rewrite]","['Action', 'Sci-Fi', 'Mecha', 'Military']"
11235,"In the aftermath of Amagami SS, high school student Junichi Tachibana continues his relationships with the girls at his school. Amagami SS+ Plus offers a glimpse into what happened after the resolution of each girl's individual story. 

New events begin to take place between each of the girls and Junichi. Tsukasa Ayatsuji, the class representative, runs for student council president; Rihoko Sakurai, who has taken over the Tea Club with Junichi, still wants to confess her feelings to him; Ai Nanasaki questions the future of her relationship with Junichi when he leaves for college; Kaoru Tanamachi wonders if her relationship with Junichi will ever go any further; Sae Nakata and Junichi deal with classmates who still can't believe that someone so cute is his girlfriend; and Haruka Morishima wants to take their relationship to the next level and get married.

[Written by MAL Rewrite]","['Romance', 'Harem', 'School']"
53407,"Miwa Kurushima and her colleague Yukari Higuchi hunt for a skilled individual to run the counter bar at the famous Hotel Cardinal. The chairman of the hotel demands only one thing of the potential hire: the bartender must be able to craft the ultimate drink known as the ""Glass of God."" Because Miwa does not fully understand the requirement, her search runs dry after everyone she has scouted cannot get past the chairman's scrutiny.

Nestled in a quiet and secluded place among the bustling alleys of Ginza is Eden Hall. This cozy bar is maintained by Ryuu Sasakura, a prodigy mixologist who knows exactly what drink will ease his customers' worries at any given time. Every glass that he serves is garnished with humility, providing much-needed solace to people from all walks of life in their time of need.

In a chance encounter, the chairman is left speechless by Ryuu's astute bartending skills and is determined to have him join Hotel Cardinal. He becomes one of Ryuu's regulars, attempting daily to convince Ryuu to leave Eden Hall. But even with the assistance of Miwa, it is more difficult than expected to recruit this particular bartender.

[Written by MAL Rewrite]","['Drama', 'Gourmet', 'Adult Cast', 'Workplace', 'Seinen']"
28755,"The spirited Boruto Uzumaki, son of Seventh Hokage Naruto, is a skilled ninja who possesses the same brashness and passion his father once had. However, the constant absence of his father, who is busy with his Hokage duties, puts a damper on Boruto's fire. Upon learning that his father will watch the aspiring ninjas who will participate in the upcoming Chunin exams, Boruto is driven to prove to him that he is worthy of his attention. In order to do so, he enlists the help of Naruto's childhood friend and rival, Sasuke Uchiha. 

The Chunin exams begin and progress smoothly, until suddenly, the Konohagakure is attacked by a new foe that threatens the long-standing peace of the village. Now facing real danger, Naruto and his comrades must work together to protect the future of their cherished home and defeat the evil that terrorizes their world. As this battle ensues, Boruto comes to realize the struggles his father once experienced—and what it truly means to be a ninja.

[Written by MAL Rewrite]","['Action', 'Adventure', 'Fantasy', 'Martial Arts', 'Shounen']"
39175,"Yui ""Cherry"" Sakura expresses himself better through the haiku he writes and posts on the internet, even though no one gives it attention. While preparing for him and his family to relocate in August, he spends the summer working part-time at a welfare facility. Meanwhile, Yuki ""Smile"" Hoshino is a budding influencer who wants everyone to smile. However, she feels uneasy about the braces on her protruding front teeth and conceals her own smile using a disposable mask.

After an accidental encounter with Cherry, Smile finds herself becoming a part-time worker at the same facility as him. Soon, the two assist a senile man, Fujiyama, in searching for an old vinyl record he owns. Unable to remember its last location, he wishes to listen to it once more before his memories fade for good. Cherry and Smile only have the record's sleeve and the word ""yamazakura"" as clues, and their hunt in the hazy summer heat begins.

[Written by MAL Rewrite]","['Romance', 'Music']"
25731,"Angelise Ikaruga Misurugi is the first princess of the noble Misurugi Empire. The kingdom has seen great power and prosperity due to the advancement of the revolutionary technology known as ""Mana,"" an abstract bending of light that has reduced the world's problems of war and pollution to a timeless peace. 

However, not all are blessed with the ability to wield Mana. Those who cannot are labeled ""Norma,"" outcasts of society who are considered a threat to civilization and live under constant persecution, and Angelise herself is one of many who want the Norma exterminated. But as Angelise's sixteenth birthday commences, it is discovered in a shocking revelation that she is actually a Norma. Chaos ensues, the public is outraged, and the once adored princess is exiled to Arzenal: a remote military base where Normas are forced into conscription.

Now, the former royal must adapt to a harsh and vastly different lifestyle; piloting mechanical robots known as ""Paramail"" to fend off large, devastating beasts referred to as DRAGONs. However, a sinister truth about these savage creatures threatens to change everything.

[Written by MAL Rewrite]","['Action', 'Fantasy', 'Sci-Fi', 'Gore', 'Mecha', 'Military']"
12049,"In the mountains of north Fiore lies the Fire Village, where a lush-blue relic known as the Phoenix Stone is preserved. Entrusted to a mystifying woman named Éclair, it is said to contain the power of an ancient phoenix. She wanders the land alone and protects the stone from harm, despite having no memory of why it was left in her care and only the faintest recollection of where she must take it. 

After encountering the wizard guild Fairy Tail, Éclair receives an offer from Natsu Dragneel and his friends to help her uncover the mysteries surrounding the stone. However, in the midst of the group's journey, Éclair is suddenly attacked and the stone is taken from her. With this, nefarious intentions to revive the blazing phoenix for its unparalleled power come to light, and the wizards of Fairy Tail find themselves in a situation that could spell calamity. They must now work together to prevent the revival of the phoenix and save the world from ruin. 

[Written by MAL Rewrite]","['Action', 'Adventure', 'Fantasy', 'Shounen']"
134,"In the heart of Italy, the Social Welfare Agency rescues young girls from hospital beds and gives them a second chance at life using the latest in cybernetic advancements. With their artificially enhanced bodies, the girls are brainwashed and trained as assassins to carry out the dirty work of the Italian Government. Despite all the modifications, they are still just children at heart, struggling for recognition from those they love, even knowing the love they feel is manufactured. This tragic tale unfolds as these girls grapple with their emotions in an agency that treats them as nothing but ruthless killers.

[Written by MAL Rewrite]","['Action', 'Drama', 'Sci-Fi', 'Suspense', 'Military', 'Psychological']"
15613,"The village of Ootsuka—home to Shino Inuzuka, Sousuke Inukawa, and Hamaji—was lit on fire under the preconception that a virus had seen all of its life eradicated. Now surrounded by flames and on the verge of death, the three were approached by a strange man holding a sword. He tells them that they must reach a decision if they want to live. That night changed everything for these children.

Five years later, the family of three now lives under the watchful eye of the small Imperial Church in a nearby village. All is fine and dandy until the Church attempts to reclaim the demonic sword of Murasame. To accomplish this, they kidnap Hamaji to lure Shino, now a bearer of Murasame's soul, and Sousuke, who possesses the ability to transform into a dog. The brothers must put their differences aside to rescue their beloved sister from the Church in the Imperial Capital, signalling the beginning of a very difficult journey. ","['Action', 'Fantasy', 'Mystery', 'Mythology', 'Shoujo']"
16528,"Kurumi is a beautiful young woman whose beloved boyfriend, Hal, died in a sudden airplane accident. Left heartbroken and gloomy, she isolates herself in a small house. But this soon comes to change when her grandfather requests the help of a humanoid robot named Q01.

Taking on the appearance of Hal, Q01 is sent to Kurumi's house in order to save her from her state of despair. As Hal returns day after day and increases his efforts, Kurumi, despite her initial reluctance, slowly begins to open up to him and break free from her depression. But there is more to Hal than meets the eye, and these two will soon learn an unexpected truth about this relationship between a human and an android.

[Written by MAL Rewrite]","['Drama', 'Romance', 'Sci-Fi']"
34494,"Tired of her rural home, recent college graduate Yoshino Koharu is desperate to lead a more exciting life in Tokyo. After a fruitless job hunt, she finally receives a part-time offer as queen of the bizarre ""Kingdom of Chupakabura,"" a rundown mini-attraction in the small agricultural town of Manoyama. However, Yoshino discovers upon her arrival in Manoyama that she was mistaken for a celebrity and the job offer was a mistake. Left with no other options, Yoshino reluctantly agrees to take on the role and aid the Board of Tourism in their efforts to revitalize Manoyama. Determined to bring excitement to the dying town with the help of local residents, the queen enacts a series of projects to highlight the beauty and charm of Manoyama's culture.

Sakura Quest delves into the story of a tight-knit community that is struggling to balance change while also maintaining the rich traditions and bonds which define their identity.

[Written by MAL Rewrite]","['Slice of Life', 'Adult Cast', 'Workplace']"
44069,"Wang Ling has been living a quiet life ever since resolving a particular incident, but thanks to his previous tampering with the laws of nature, the level of psionic powers in the world has dropped drastically. To stop the levels from plummeting further, his spirit sword Jingke comes to the rescue. But due to the excessive use of power, Jingke ends up ripping a crack in space. This crack allows demons to infiltrate the world and steal spiritual energy essential to powering human society. Now the only person who has the power to thwart their plans is none other than Wang Ling.

In an attempt to balance his high school life with his supernatural one, Wang Ling must confront challenges ranging from teacher home visits, crafting spiritual swords, grappling with his growing feelings for Sun Rong, and battling invading demons!

[Written by MAL Rewrite]","['Adventure', 'Comedy', 'Fantasy', 'Mythology', 'School', 'Urban Fantasy']"
38959,"Ten years after facing defeat in the Fourth Holy Grail War, Waver Velvet, now Lord El-Melloi II, teaches classes at the Clock Tower—the center of education for mages. However, his new status as Lord comes with a caveat: obey the orders of Reines, the younger sister of the deceased Kayneth El-Melloi, until she is old enough to rule the House of El-Melloi.

Waver, along with his mysterious apprentice Gray, takes on a series of cases assigned by Reines and the Mages Association. With each case proving to be more complex than the last, could there be more to the Clock Tower than meets the eye, and what secrets does Reines hide?

[Written by MAL Rewrite]","['Fantasy', 'Mystery', 'Urban Fantasy']"
14527,"After the defeat of Myouri Unzen at the hands of Medaka Kurokami and her Student Council, peace has returned to Hakoniwa Academy—at least, for a short while. Soon, Medaka, Zenkichi Hitoyoshi, Kouki  Akune, and Mogana Kikaijima find themselves wrapped up in another sinister scheme, known as the ""Flask Plan,"" led by the school's principal himself.

However, the council's first problem is to deal with a whole new group of superhuman students calling themselves the ""Thirteen Party,"" led by the egotistical but powerful Oudo Miyakonojou. With the mysterious Flask Plan, Oudo's tyranny, and the resurfacing of an old enemy, the state of Hakoniwa Academy is far from tranquil, and Medaka and her companions have their hands full as things only get a lot more abnormal. 

[Written by MAL Rewrite]","['Action', 'Comedy', 'Ecchi', 'Martial Arts', 'School', 'Super Power', 'Shounen']"
38472,"It is a normal day; everyone from deranged military girl Tanya Degurechaff and 16-year-old isekai protagonist Satou Kazuma to expansionist overlord Ainz Ooal Gown and demon sisters Rem and Ram go on with their daily lives. Suddenly, a conspicuous red button begging to be pressed appears before them. Overcome by curiosity, the otherworldly characters push the button, sending them to an unfamiliar world.

With no way of escaping, the characters must lead a normal school life and make acquaintances with the others. One thing is certain: the classroom full of fan-favorite eccentric personalities never gets boring!

[Written by MAL Rewrite]
","['Comedy', 'Fantasy', 'Isekai', 'Parody']"
20785,"In the dawn of the 21st century, magic, long thought to be folklore and fairy tales, has become a systematized technology and is taught as a technical skill. In First High School, the institution for magicians, students are segregated into two groups based on their entrance exam scores: ""Blooms,"" those who receive high scores, are assigned to the First Course, while ""Weeds"" are reserve students assigned to the Second Course.

Mahouka Koukou no Rettousei follows the siblings, Tatsuya and Miyuki Shiba, who are enrolled in First High School. Upon taking the exam, the prodigious Miyuki is placed in the First Course, while Tatsuya is relegated to the Second Course. Though his practical test scores and status as a ""Weed"" show him to be magically inept, he possesses extraordinary technical knowledge, physical combat capabilities, and unique magic techniques—making Tatsuya the irregular at a magical high school.

[Written by MAL Rewrite]","['Action', 'Fantasy', 'Romance', 'Sci-Fi', 'School', 'Urban Fantasy']"
32668,"Long ago lived the ""nobles,"" an ancient race of immortal supernatural beings. They were revered as rulers and gods. Among the nobles was the ""Noblesse,"" a powerful individual shrouded in mystery named Cadis Etrama di Raizel, or ""Rai."" Upon awakening in South Korea after an 820-year-long sleep, Rai sets to find his loyal and devoted servant, Frankenstein, whom he discovers to be the current director of Ye Ran High School. In his wish to learn more about modern civilization, Rai enrolls as a student to better experience life in the modern world.

Noblesse: Awakening details the beginning of Rai's new life as a high school student as he spends time with friends and fights threats both human and supernatural in order to prevent their schemes from harming Korea.

[Written by MAL Rewrite]","['Action', 'Supernatural', 'School', 'Vampire']"
165,"The ordinary life of high school student Ayato Kamina is turned upside down when Tokyo is suddenly invaded by futuristic fighter jets. Amidst the chaos, he encounters a woman called Haruka Shitow who claims to be from a government organization called TERRA. She reveals that he has been living in a time bubble named ""Tokyo Jupiter"" that was put in place by the Mulians—humanoids from another dimension—in an attempt to isolate and take over Tokyo. TERRA has been trying to break through the barrier surrounding the city ever since. 

Unable to process the revelation, Ayato panics and flees. He runs into his classmate Reika Mishima who leads him to a place called ""The Shrine of Xephon"" where a large egg slumbers. She starts to sing and an unknown power awakens within Ayato, connecting him to a being called RahXephon that breaks out of the egg. Shortly after, Haruka finds him again and tries to make him join her cause of fighting against the Mulians.

Caught between the crosshairs of the Mulians and TERRA, Ayato begins to question his purpose, navigating altered memories and ultimately his very identity in this chaotic new world.

[Written by MAL Rewrite]","['Action', 'Award Winning', 'Drama', 'Mystery', 'Romance', 'Sci-Fi', 'Suspense', 'Mecha', 'Music', 'Psychological']"
35338,"For the production of their game's poolside scene, Blessing Software's illustrator Eriri Spencer Sawamura wants Megumi Katou to model in a swimsuit for her sketches of the game's heroine. However, Megumi refuses to wear such attire unless everyone else agrees to do the same. To ensure the development of their game continues smoothly, the team follows her request as they conduct their fruitful research at a luxury hotel.

[Written by MAL Rewrite]","['Comedy', 'Romance', 'Ecchi', 'Harem', 'School']"
1292,"When he was a young boy, Afro witnessed his father be cut down in a duel at the hands of a man known only as Justice. After taking the life of Afro's father, Justice cast aside his Number Two headband and took the Number One to claim its godly powers as his own.

Years later, having obtained the Number Two headband which grants him the right to challenge the Number One, Afro moves forward in his hunt for revenge on the man who murdered his father. There is just one thing that stands in his way—everyone else in the world! Though the Number One can only be challenged by the Number Two, the Number Two can be challenged by anyone. As his enemies gather to try and take the title of Number Two, Afro must fight through a myriad of foes and obstacles if he hopes to reach the Number One and claim vengeance once and for all.

[Written by MAL Rewrite]","['Action', 'Adventure', 'Gore', 'Samurai']"
33513,"A year can change a person's life forever. The 365 days Class 3-E of Kunugigaoka Junior High spent with their eccentric teacher, Koro-sensei, certainly did. Carrying the memories of that year close to their hearts, alumni Nagisa Shiota and Karma Akabane return to their former classroom to recall the events of that momentous time of their lives.

Nagisa and Karma are reminded by the familiar rooms, desks, chalkboard, and the class album of the events that shaped them into ""assassins"" and prepared them for the real world. That is the legacy of their octopus-like teacher—who had introduced himself by threatening to destroy the world if they didn't kill him by the end of the school year—and the time spent in the bizarre yet exceptional ""Assassination Classroom.""

[Written by MAL Rewrite]","['Action', 'Comedy', 'School', 'Shounen']"
39586,"The cells of the human body never rest for too long; there's always something new to do and learn every day. At least, that's what Hakkekkyuu U-1146 feels as he rushes to and fro, searching for any pathogens that could cause harm to the body. Despite his dangerous line of work, it's all worth it to protect the happy smiles of Sekkekkyuu AE3803, the platelet crew, his fellow neutrophils, and the other cells he meets along the way. 

In his latest pathogen-hunting adventures, Hakkekkyuu U-1146 discovers how important cells can sometimes make mistakes, and that not all bacteria are actually bad. Everybody has their bad days, but everything eventually works out when their comrades have their backs. In the end, it's just another normal day for these hardworking cells!

[Written by MAL Rewrite]","['Comedy', 'Anthropomorphic', 'Educational', 'Medical', 'Shounen']"
54913,"Determined to pursue his glorious childhood dreams, 30-year-old Rick Gladiatol, a modest clerk in the adventurers' guild, is offered a once-in-a-lifetime opportunity after he fatefully encounters the dark elf Reanette Elfelt. Reanette happens to be an elite adventurer of the legendary party Orichalcum Fist, whose members welcome Rick under the condition that he follow a Spartan training.

Two years later, Rick is finally ready to take the E-Rank exam officially qualifying him as an adventurer. However, raw magical power can only be developed until one turns 20. As such, Rick faces the general hostility of fellow participants and examiners alike, leaving him no choice but to show the world that his hellish training has turned him into an invincible warrior.

[Written by MAL Rewrite]","['Action', 'Adventure', 'Fantasy']"
38787,"To the students of Karai High School, Nanako Yukishiro is a pretty, calm, and cute 16-year-old. However, Nanako is no ordinary girl, as she cannot speak! Instead, Nanako communicates through senryuu—17-syllable-long poems. 

Sixteen-year-old Eiji Busujima used to be delinquent in his middle school years. However, he has since turned over a new leaf due to his newfound love of senryuu. Despite his menacing looks, Eiji gets along well with Nanako as a fellow member of the Literature Club.

Even though Nanako is mute, the adorable pair have no problem communicating with each other. Senryuu Shoujo is a light and relaxing story of two teenagers' daily lives.

[Written by MAL Rewrite]
","['Comedy', 'Romance', 'Love Status Quo', 'School', 'Shounen']"
